,description,headline,url,provider,date
52,"The last car has been built in Australia. After 69 years, <b>General</b> <b>Motors</b> is ending manufacturing in the country, following similar moves made by Ford last year and Toyota just two weeks ago. High costs and low <b>production</b> volumes led them to shift car ...",Car <b>production</b> ends in Australia with last <b>General</b> <b>Motors</b> model built,https://www.foxnews.com/auto/car-production-ends-in-australia-with-last-general-motors-model-built,Fox News,2017-10-20T12:14:00.0000000Z
53,TORONTO (Reuters) - <b>General</b> <b>Motors</b> Co (GM.N) said on Friday it reached a tentative ... 18 after the U.S. automaker rejected a union call to designate the factory as lead <b>production</b> site for the Chevrolet Equinox model in North America.,<b>General</b> <b>Motors</b> reaches tentative deal with striking Canada workers,https://www.reuters.com/article/us-gm-canada/general-motors-reaches-tentative-deal-with-striking-canada-workers-idUSKBN1CH2C9,Reuters,2017-10-14T01:26:00.0000000Z
54,Check out this story on Freep.com: http://on.freep.com/2wRnkoR <b>General</b> <b>Motors</b> plans to cut <b>production</b> and jobs at its <b>Detroit-Hamtramck</b> plant as the auto industry continues adjusting to a consumer shift from cars to trucks and SUVs. The company said it ...,"GM cutting <b>production</b>, jobs at <b>Detroit-Hamtramck</b> plant amid slowing demand",https://www.freep.com/story/money/cars/general-motors/2017/10/12/gm-detroit-hamtramck-plant-jobs-general-motors/757867001/,Detroit Free Press,2017-10-12T00:00:00.0000000Z
55,The top U.S. automaker <b>General</b> <b>Motors</b> (GM) witnessed a <b>production</b> stoppage at the CAMI plant in Canada this month where the company&#39;s popular Chevrolet Equinox brand (also the top-selling crossover in the U.S. and Canada) is built. A meeting was held ...,<b>General Motors Equinox Production Suffers</b> Over Labor Issue,https://finance.yahoo.com/news/general-motors-equinox-production-suffers-222848593.html,Yahoo Finance,2017-10-01T22:45:00.0000000Z
56,"A new Automotive World report, ‘<b>General</b> <b>Motors model plans and production outlook</b> to 2021‘ is available to download from the research section of AutomotiveWorld.com. Having reported its fourth successive year of record sales, with retail deliveries of ...",<b>General</b> <b>Motors model plans and production outlook</b> to 2021 – A new Automotive World report,https://www.automotiveworld.com/news-releases/general-motors-model-plans-production-outlook-2021-2/,Automotive World,2017-09-14T09:07:00.0000000Z
57,"Having reported its fourth successive year of record sales, with retail deliveries of 10.008 million vehicles in 2016, <b>General Motors</b> is now in the midst of a major strategic realignment. The sale of Opel/Vauxhall to PSA Group followed announcements of ...",<b>General Motors</b> model plans and <b>production</b> outlook to 2021,https://www.automotiveworld.com/research/general-motors-model-plans-production-outlook-2021/,Automotive World,2017-09-14T09:07:00.0000000Z
58,"<b>General</b> <b>Motors</b> is about to reap the benefits of its $581 million purchase of Cruise Automation. Cruise said Monday that it&#39;s ready to mass produce a self-driving car. For now, Cruise has built 50 cars that will give rides to its employees in San Francisco.",<b>General</b> <b>Motors</b>&#39; first self-driving car is ready for <b>production</b>,https://www.businessinsider.com/general-motors-cruise-production-ready-2017-9,Business Insider,2017-09-11T19:06:00.0000000Z
59,"This is another impetus for <b>production</b> cuts. Automakers like <b>General</b> <b>Motors</b> book revenue when they ship a car to a dealer -- not when it is finally sold to a customer. Thus, the company&#39;s recent streak of strong profit growth has been helped by inventory ...","<b>With Inventory Climbing, General Motors Schedules</b> More Downtime",https://www.fool.com/investing/2017/06/18/with-inventory-climbing-general-motors-schedules-m.aspx,The Motley Fool,2017-06-18T13:23:00.0000000Z
60,"<b>General</b> <b>Motors</b> Company GM announced the completion of 130 Chevrolet Bolt EV test vehicle <b>production</b> at the Orion Assembly Plant located in Orion Township, MI. The vehicles have been enabled with next-generation self-driving technology. The new vehicles ...",<b>General Motors Finishes Self-Driving</b> Test Vehicle <b>Production</b>,https://sports.yahoo.com/general-motors-finishes-self-driving-135201808.html,Yahoo Sports,2017-06-14T13:52:00.0000000Z
61,"PORT ELIZABETH - American automotive giant <b>General</b> <b>Motors</b> has announced that it is withdrawing from the South African market. As a result, <b>production</b> and sales of Chevrolet models will cease and Isuzu will take control of the firm’s Port Elizabeth ...",<b>General Motors exits SA - Isuzu</b> to step in,https://www.enca.com/money/general-motors-exits-sa-isuzu-to-step-in,eNCA,2017-05-18T10:21:00.0000000Z
62,"<b>General</b> <b>Motors</b> has announced that it is withdrawing from the South African market, ceasing <b>production</b> and sales of Chevrolet models in the country, according to a report by Cars.co.za This announcement was made to the press early on 18 May 2017 in Port ...",<b>General Motors pulls out of South</b> Africa,https://businesstech.co.za/news/business/175745/general-motors-pulls-out-of-south-africa-report/,businesstech.co.za,2017-05-18T08:51:00.0000000Z
63,"MUMBAI: Automobile major <b>General</b> <b>Motors</b> India on Friday said that it has ceased <b>production</b> at its Halol facility located in Gujarat. According to the company, it will now consolidate its manufacturing activity at its Talegaon facility in Maharashtra.",<b>General Motors ceases production at its Gujarat facility</b>,https://timesofindia.indiatimes.com/auto/miscellaneous/general-motors-ceases-production-at-its-gujarat-facility/articleshow/58428288.cms,Times of India,2017-04-29T04:51:00.0000000Z
64,"NEW DELHI: US auto major <b>General</b> <b>Motors</b> (GM) today stopped <b>production</b> at its first Indian plant in Halol, Gujarat, as part of the consolidation of manufacturing operations in the country. The company&#39;s arm, <b>General</b> <b>Motors</b> India will now operate all of its ...",<b>General</b> <b>Motors</b> ceases <b>production</b> at Halol plant,https://economictimes.indiatimes.com/industry/general-motors-ceases-production-at-halol-plant/articleshow/58415845.cms,Economic Times,2017-04-28T10:10:00.0000000Z
65,"By the end of April 2017, <b>General</b> <b>Motors</b> will halt the <b>production</b> at its Halol plant. The car maker had already stopped the <b>production</b> of Cruze sedan last week. The <b>production</b> of Tavera will come to an end by April 28, 2017. <b>General</b> <b>Motors</b>&#39; Talegaon plant ...",<b>General Motors Hints At Ending</b> Its India Operations — The End Of An Era?,https://www.drivespark.com/four-wheelers/2017/general-motors-hints-ending-india-operations-021483.html,DriveSpark,2017-04-06T12:10:00.0000000Z
66,"LORDSTOWN, Ohio (WKBN) – <b>General</b> <b>Motors</b> Lordstown Complex have added several weeks of <b>production</b> downtime to the 2017 schedule. Spokesman Tom Mock said GM is not commenting on the timing of the down weeks or the impact it may have on the <b>production</b> ...",<b>General Motors announces more ‘production downtime</b>’ at Lordstown,http://www.wkbn.com/2017/02/01/general-motors-announces-more-production-downtime-at-lordstown/,WKBN 27 First News,2017-02-01T18:13:00.0000000Z
67,"Mary Barra, the CEO of <b>General Motors</b>, isn’t letting Donald Trump change her company’s plans. Speaking to reporters at a GM event in Detroit, Barra said GM’s small-car <b>production</b> will stay in Mexico, since manufacturing and plant investments are not ...",<b>General Motors</b> CEO Mary Barra Says Donald Trump’s Threats Won’t Change the Company’s Plans,http://fortune.com/2017/01/09/donald-trump-general-motors-mary-barra/,Fortune,2017-01-09T14:29:00.0000000Z
68,"A glut of inventory is prompting <b>General</b> <b>Motors</b> Co. to reduce <b>production</b> at its Detroit-Hamtramck Assembly Plant, as well as at factories in Lansing, Ohio and Kentucky. GM says it had more than 874,000 cars, trucks and crossovers in its inventory at the ...",GM inventory at 8-year high; will reduce car <b>production</b>,https://www.detroitnews.com/story/business/autos/general-motors/2016/12/18/gm-production/95601094/,The Detroit News,2016-12-18T00:00:00.0000000Z
69,"<b>General</b> <b>Motors</b> Company (GM - Free Report) recently announced that its subsidiary in Germany, Opel, is reducing working hours at two of its plants. The automaker took this decision in the view of the sluggish demand for Corsa and Insignia models post ...",<b>General Motors&#39; Opel Cuts Production in Germany Post Brexit</b>,https://www.zacks.com/stock/news/228764/general-motors-opel-cuts-production-in-germany-post-brexit,Zacks Investment Research,2016-08-22T00:00:00.0000000Z
70,"SHREVEPORT, La., July 13, 2016 /PRNewswire/ -- Elio <b>Motors</b> (otc-qx:ELIO) announced that it has named Doug Frick as plant manager for its Shreveport <b>production</b> facility. The manufacturing assembly plant is the former <b>General</b> <b>Motors</b> Shreveport Assembly and ...","Former <b>General</b> <b>Motors</b> Manufacturing Executive joins Elio <b>Motors</b> as Plant Manager of its Shreveport, La., Manufacturing Facility",https://www.marketwatch.com/press-release/former-general-motors-manufacturing-executive-joins-elio-motors-as-plant-manager-of-its-shreveport-la-manufacturing-facility-2016-07-13-16183160,MarketWatch,2016-07-13T16:16:00.0000000Z
71,"FLINT, MI - <b>General</b> <b>Motors</b> will add <b>production</b> of its Chevrolet Silverado 1500 crew cab at the Flint Assembly plant beginning in 2017. The light duty truck is currently produced in Mexico and United Auto Workers Local 598 Shop Chairman Eric Welter said the ...",<b>General</b> <b>Motors</b> to add light duty truck <b>production</b> in Flint in 2017,https://www.mlive.com/news/flint/index.ssf/2016/05/general_motors_to_add_light_du.html,MLive,2016-05-25T20:23:00.0000000Z
72,"As soon as diesel enthusiasts heard about the availability of a turbodiesel in the next-generation Chevrolet Colorado and GMC Canyon, interest was piqued. Although no official figures have been released, highway fuel economy is reportedly well into the 30s.",<b>General Motors Thailand Starts Production of</b> U.S.-Bound 2.8L Duramax,http://www.trucktrend.com/news/1507-general-motors-thailand-starts-production-of-u-s-bound-2-8l-duramax/,Truck Trend,2015-07-06T23:07:00.0000000Z
73,"<b>General</b> <b>Motors</b> Co. GM is facing a challenging situation in Russia on account of declining sales due to a weak economy. Consequently, the automaker will stop <b>production</b> at its lone assembly plant in the country, per media reports. <b>General</b> <b>Motors</b> will shut ...",<b>General</b> <b>Motors</b> Halts <b>Production</b> in Russia on Declining Sales - Analyst Blog,https://www.nasdaq.com/article/general-motors-halts-production-in-russia-on-declining-sales-analyst-blog-cm493020,Nasdaq,2015-07-02T20:30:00.0000000Z
74,"ST. PETERSBURG – <b>General</b> <b>Motors</b> will transfer part of its Russian <b>production</b> capacity to neighboring Belarus, where it also will launch Cadillac <b>production</b>, a spokesman for the government of the Eastern European country says. GM earlier this month ...",<b>General</b> <b>Motors</b> Shifts Russian <b>Production</b> to Belarus,https://www.wardsauto.com/industry/general-motors-shifts-russian-production-belarus,WardsAuto,2015-06-15T00:00:00.0000000Z
75,"<b>General</b> <b>Motors</b> is ending almost all its <b>production</b> in Russia, but others are staying put for now. Russia is the third-largest European car market, but is giving automakers a bumpy ride. The 10% drop in car sales last year paled in comparison that of 2009 ...",<b>General Motors is stopping production in</b> Europe&#39;s third largest car market,http://uk.businessinsider.com/general-motors-is-stopping-production-in-europes-third-largest-car-market-2015-3,Business Insider,2015-03-29T18:50:00.0000000Z
76,"Russia is the third-largest European car market, but is giving automakers a bumpy ride. The 10% drop in car sales last year paled in comparison that of 2009, when new registrations halved following the financial crisis. Even so, the optimism that sustained ...",<b>General</b> <b>Motors</b> is stopping <b>production</b> in Europe&#39;s third largest car market,https://www.businessinsider.com/general-motors-is-stopping-production-in-europes-third-largest-car-market-2015-3,Business Insider,2015-03-29T17:50:00.0000000Z
77,"After a fairly exhaustive analysis of GM North American sales, <b>production</b>, and inventory by vehicle type (i.e. car, CUV, truck), we conclude that <b>General</b> <b>Motors</b> only has enough <b>production</b> capacity in the segments doing well (i.e. Large Pickup / Large SUV ...",<b>General</b> <b>Motors</b> Can’t <b>Keep Up With Truck Demand…and That</b>’s a Problem,https://www.barrons.com/articles/general-motors-cant-keep-up-with-truck-demandand-thats-a-problem-1427210651,Barron&#39;s,2015-03-24T15:25:00.0000000Z
78,<b>General</b> <b>Motors</b> Co. said Thursday it will stop producing vehicles in Indonesia because of high material costs and limited scale there. The Detroit automaker will shutter its plant in Bekasi and cut 500 jobs by the end of June. The plant was originally ...,<b>General</b> <b>Motors</b> to stop <b>production</b> in Indonesia,https://www.detroitnews.com/story/business/autos/general-motors/2015/02/26/gm-stopping-production-indonesia/24070473/,The Detroit News,2015-02-26T20:23:00.0000000Z
79,"<b>General</b> <b>Motors</b> Company (GM) has decided to stop vehicle and engine <b>production</b> in Australia by 2017-end. Furthermore, it plans a transition into a national sales company in Australia and New Zealand. The automaker also plans to gradually cut down ...",<b>General</b> <b>Motors</b> Company (GM) to End <b>Production</b> in Australia,https://www.valuewalk.com/2013/12/general-motors-company-gm-to-end-production-in-australia/,ValueWalk,2013-12-20T22:30:00.0000000Z
80,"<b>General</b> Motorsannounced plans Tuesday to improve its global performance by discontinuing vehicle and engine manufacturing, and significantly reducing its engineering operations in Australia by the end of 2017. <b>General</b> <b>Motors</b>&#39; decision will impact ...",<b>General Motors to End Production in Australia</b>,https://www.aol.com/article/finance/2013/12/11/general-motors-to-end-production-in-australia/20786547/,AOL,2013-12-11T11:17:00.0000000Z
81,"TORONTO (Reuters) - <b>General</b> <b>Motors</b> (GM.N) is extending operations at one of its <b>production</b> lines in Oshawa, Ontario that was due to shut down next summer, the company said on Thursday. The Detroit automaker said the consolidated assembly line will continue ...",<b>General</b> <b>Motors</b> extends <b>production</b> at Oshawa plant line to 2016,https://www.reuters.com/article/us-generalmotors-canada-idUSBRE99G0U920131017,Reuters,2013-10-17T21:04:00.0000000Z
82,"<b>General</b> <b>Motors</b> Co., saddled with large stocks of unsold cars and trucks, is taking steps to cut excess <b>production</b> and signaled there may be more to come. Workers at its Lordstown, Ohio, assembly plant soon will be off the job for three weeks instead of a ...",<b>General Motors Cutting Production to Control Inventory</b>,https://blogs.wsj.com/drivers-seat/2012/12/04/general-motors-cutting-production-to-control-inventory/,The Wall Street Journal,2012-12-04T14:36:00.0000000Z
83,SÃO PAULO—<b>General</b> <b>Motors</b> Co. suspended <b>production</b> for a day at its São José dos Campos plant in Brazil on Tuesday citing safety worries and prompting an outcry from the labor union that has been organizing protests against possible layoffs at the factory.,<b>General Motors Halts Production at Plant</b> in Brazil,https://blogs.wsj.com/drivers-seat/2012/07/25/general-motors-halts-production-at-plant-in-brazil/,The Wall Street Journal,2012-07-25T09:00:00.0000000Z
84,"CLEVELAND, Ohio -- After announcing late Wednesday that it has solved its supplier problems and would resume <b>production</b> late Thursday, <b>General</b> <b>Motors</b> said this morning that it was not ready to resume work at Lordstown. The company said the plant will down ...",<b>General</b> <b>Motors</b> will not resume Lordstown <b>production</b> tonight after 3-day shutdown,https://www.cleveland.com/business/index.ssf/2011/12/general_motors_to_resume_lords.html,The Plain Dealer,2011-12-15T14:54:00.0000000Z
85,<b>General</b> <b>Motors</b> has sid it had completely stopped <b>production</b> of petrol cars in its plants after demand for its diesel cars increased. GM is using its <b>production</b> lines to build diesel cars only. The fuel price difference between petrol and diesel has become ...,<b>General</b> <b>Motors</b> Stops Petrol Car <b>Production</b>,https://www.drivespark.com/four-wheelers/2011/28-general-motors-stops-diesel-car-production.html,DriveSpark,2011-09-28T10:41:00.0000000Z
86,"<b>General</b> <b>Motors</b> Co. officially started <b>production</b> this morning of the only subcompact vehicle to be built in the U.S., according to officials. The Detroit automaker’s Orion Assembly Plant in Orion Township began producing the 2012 Chevrolet Sonic at 6 a.m ...",<b>General</b> <b>Motors</b> starts <b>production</b> of Chevrolet Sonic subcompact at Metro Detroit plant,https://www.mlive.com/auto/index.ssf/2011/08/general_motors_starts_producti.html,MLive,2011-08-01T20:45:00.0000000Z
87,"<b>General</b> <b>Motors</b> Co. GM, +2.03% plans to significantly expand its <b>production</b> of its battery-powered Volt cars, disclosing plans to close the car&#39;s home plant for four weeks starting in June to upgrade the facility. GM is counting on the Volt as a tool to ...",<b>General</b> <b>Motors</b> to expand Volt <b>production</b> capacity,https://www.marketwatch.com/story/general-motors-to-expand-volt-production-capacity-2011-05-18,MarketWatch,2011-05-18T21:26:00.0000000Z
88,"First Volt battery pack of the line – Click above for high-res image gallery Starting today, the battery packs are full <b>production</b>-spec units, but GM engineers are still tweaking the management software in an attempt to maximize range and lifespan.",<b>General Motors builds first Volt battery</b> pack on <b>production</b> line [w/video],https://www.autoblog.com/2010/01/07/general-motors-builds-first-volt-battery-pack-on-production-line/,Autoblog,2010-01-07T00:00:00.0000000Z
89,<b>General</b> <b>Motors</b> is in the midst of a solar-powered makeover. The company is harnessing the power of the sun at its largest plant in Europe with the world&#39;s largest solar-powered rooftop. GM is also expected to announce that it&#39;s investing in solar power for ...,<b>General Motors has sunny new production</b>,https://www.marketplace.org/2008/07/08/business/marketplace-reader/general-motors-has-sunny-new-production,Marketplace,2008-07-08T11:43:00.0000000Z
90,"DETROIT -- Get ready to say goodbye to the <b>Hummer H1</b>, the hulking, gas-guzzling status symbol that has attracted celebrities and off-road enthusiasts but has drawn the ire of environmentalists. <b>General</b> <b>Motors</b> Corp. said Friday that the 2006 model year will ...",<b>General</b> <b>Motors</b> to End <b>Hummer H1</b> <b>Production</b>,http://www.washingtonpost.com/wp-dyn/content/article/2006/05/12/AR2006051201065_pf.html,The Washington Post,2006-05-12T00:00:00.0000000Z
91,"Authors: Jeffrey M. Alden <b>General</b> <b>Motors</b> Corporation, Mail Code 480-106-359, 30500 Mound Road, Warren, Michigan 48090 Lawrence D. Burns <b>General</b> <b>Motors</b> Corporation, Mail Code 480-106-EX2, 30500 Mound Road, Warren, Michigan 48090 Theodore Costy <b>General</b> ...",<b>General</b> <b>Motors</b> Increases Its <b>Production</b> Throughput,https://dl.acm.org/citation.cfm?id=1245531.1245533,dl.acm.org,2006-01-01T00:00:00.0000000Z
92,"The <b>General</b> <b>Motors</b> Corporation said yesterday that it would build 100,000 fewer cars and trucks in the first quarter in North America than it had planned last month, to try to reduce dealer inventories as sales slow. <b>General</b> <b>Motors</b> said it would produce 1 ...",COMPANY NEWS; <b>GENERAL</b> <b>MOTORS</b> AGAIN CUTS <b>PRODUCTION</b> PLANS,https://www.nytimes.com/2001/01/09/business/company-news-general-motors-again-cuts-production-plans.html,The New York Times,2001-01-09T11:59:00.0000000Z
93,"They were then divided by actual <b>production</b> to give a monthly performance to capacity measure. Figure 1 compares <b>General</b> <b>Motors</b>&#39; performance to the North American industry average and to World Class, the company with the quickest vehicle launch.",World <b>Class Vehicle Launch Timing: General Motors</b> (Part 2 of 6),https://www.adandp.media/articles/world-class-vehicle-launch-timing-general-motors-part-2-of-6,adandp.media,2001-01-01T11:59:00.0000000Z
94,<b>General</b> <b>Motors</b> is on track to resume full operations at <b>General</b> <b>Motors</b> Oshawa and three other North American plants where vehicle assembly was halted because of supply chain interruptions caused by earthquakes in Japan last month. Manufacturing that was ...,<b>General</b> <b>Motors</b> Oshawa <b>production</b> to resume,https://www.thepeterboroughexaminer.com/news-story/8221167-general-motors-oshawa-production-to-resume/,Peterborough Examiner,2016-05-05T22:25:00.0000000Z
95,"<b>General</b> <b>Motors</b> will increase <b>production</b> of its Chevrolet Bolt EV this year at its Orion Assembly Plant in Oakland County, Mich., as part of the company&#39;s &quot;path to an all-electric future,&quot; chief executive Mary Barra told attendees at an energy conference.",<b>General</b> <b>Motors</b> to Boost Chevy Bolt EV <b>Production</b>,https://www.automotive-fleet.com/279066/general-motors-to-boost-chevy-bolt-ev-production,Automotive Fleet,2018-03-07T23:23:00.0000000Z
96,"<b>General</b> <b>Motors</b> issued a press release today announcing a significant reduction of planned <b>production</b> for the first quarter of 2009 due to the ongoing and severe drop in industry sales, which were down 36 percent in November overall and 41 percent for GM ...","<b>General</b> <b>Motors Idles Plants, Cuts Production 30 Percent</b>",http://caradvice.askpatty.com/ask_patty_/2008/12/general-motors-idles-plants-production-cuts-production-30-percent.html,caradvice.askpatty.com,2008-12-12T00:00:00.0000000Z
97,"<b>General</b> <b>Motors</b> Corporation (NYSE: GM), a United States-based automaker, is halting <b>production</b> of GM-branded cars in Indonesia. The automaker is planning to cut around 500 jobs and move its focus to sport utility vehicles. This step is part of a broader ...",<b>General Motors stops production of</b> GM-branded cars in Indonesia.,https://www.thefreelibrary.com/General+Motors+stops+production+of+GM-branded+cars+in+Indonesia.-a0403279100,HSBC launches new Pep,2015-02-27T00:00:00.0000000Z
0,<b>General</b> <b>Motors</b> is on track to resume full operations at <b>General</b> <b>Motors</b> Oshawa and three other North American plants where vehicle assembly was halted because of supply chain interruptions caused by earthquakes in Japan last month. Manufacturing that was ...,<b>General</b> <b>Motors</b> Oshawa <b>production</b> to resume,https://www.thepeterboroughexaminer.com/news-story/8221167-general-motors-oshawa-production-to-resume/,Peterborough Examiner,2016-05-05T22:25:00.0000000Z
1,"<b>General</b> <b>Motors</b> (NYSE: GM) CEO Mary Barra said the company will boost its <b>production</b> of the battery-electric Chevrolet Bolt EV to keep pace with rising global demand. Clearly, GM thinks it can sell considerably more Bolts than it&#39;s making right now.",Why Does <b>General</b> <b>Motors</b> Want to Boost <b>Production</b> of the Chevy Bolt?,https://billingsgazette.com/business/investment/markets-and-stocks/why-does-general-motors-want-to-boost-production-of-the/article_2ccba067-3d73-5a1e-ba65-f2c3f4850f07.html,Billings Gazette,2018-03-08T17:36:00.0000000Z
2,"<b>General</b> <b>Motors</b> will increase <b>production</b> of its Chevrolet Bolt EV this year at its Orion Assembly Plant in Oakland County, Mich., as part of the company&#39;s &quot;path to an all-electric future,&quot; chief executive Mary Barra told attendees at an energy conference.",<b>General</b> <b>Motors</b> to Boost Chevy Bolt EV <b>Production</b>,https://www.automotive-fleet.com/279066/general-motors-to-boost-chevy-bolt-ev-production,Automotive Fleet,2018-03-07T23:23:00.0000000Z
3,"<b>General</b> <b>Motors</b> issued a press release today announcing a significant reduction of planned <b>production</b> for the first quarter of 2009 due to the ongoing and severe drop in industry sales, which were down 36 percent in November overall and 41 percent for GM ...","<b>General</b> <b>Motors Idles Plants, Cuts Production 30 Percent</b>",http://caradvice.askpatty.com/ask_patty_/2008/12/general-motors-idles-plants-production-cuts-production-30-percent.html,caradvice.askpatty.com,2008-12-12T00:00:00.0000000Z
4,"<b>General</b> <b>Motors</b> Corporation (NYSE: GM), a United States-based automaker, is halting <b>production</b> of GM-branded cars in Indonesia. The automaker is planning to cut around 500 jobs and move its focus to sport utility vehicles. This step is part of a broader ...",<b>General Motors stops production of</b> GM-branded cars in Indonesia.,https://www.thefreelibrary.com/General+Motors+stops+production+of+GM-branded+cars+in+Indonesia.-a0403279100,HSBC launches new Pep,2015-02-27T00:00:00.0000000Z
