,description,headline,url,provider,date
12,"In the next six months, <b>General Motors</b>’(s <b>gm</b>) first 4G cars will start rolling off dealer lots, but on Tuesday <b>GM</b> treated me to a sneak peak at what its newly revamped MyLink infotainment system and OnStar connectivity platform will look like. The most ...",Hands on with <b>GM</b>’s new <b>4G-powered connected car system</b>,https://gigaom.com/2014/02/12/hands-on-with-gms-new-4g-powered-connected-car-system/,Gigaom,2014-02-14T04:57:00.0000000Z
13,"Honda is partnering with <b>General Motors</b> to spend billions of dollars on autonomous cars in a new joint-venture manufacturing deal. Cruise Automation, the San Francisco startup <b>GM</b> purchased in 2016 for $1 billion, is cashing a $750 million equity stake from ...",Honda Will Build a High-Volume Self-Driving <b>Car</b> with <b>General Motors</b>&#39; Cruise Automation,https://www.caranddriver.com/news/honda-general-motors-self-driving-car,Car and Driver,2018-10-03T17:54:00.0000000Z
14,"OnStar Go, the <b>auto</b> industry&#39;s first &#39;cognitive mobility platform.&#39; Credit: <b>General Motors</b> In-<b>car</b> advertising is about to take a leap forward as <b>General Motors</b> and IBM roll out a new system to deliver personalized brand messages to drivers inside <b>GM</b> ...",Can You Get Your Brand Into <b>GM</b>&#39;s In-<b>Car</b> Marketing System? (Yes),https://adage.com/article/cmo-strategy/questions-gm-ibm-s-car-marketing-system/306497/,Ad Age,2016-10-27T11:19:00.0000000Z
15,"<b>General Motors</b> launched its Maven <b>car-sharing service in Baltimore</b> on Wednesday with a fleet of 40 Chevrolets and GMCs that can be rented at 20 locations in the city. The service, already available in more than a dozen cities including Washington and New ...",<b>GM</b> <b>launches Maven car-sharing service in Baltimore</b>,http://www.baltimoresun.com/classified/automotive/bs-bz-gm-maven-launch-20170405-story.html,The Baltimore Sun,2017-04-06T00:00:00.0000000Z
16,"Discussions with the UAW have started. Entire plants at risk. <b>GM</b> is getting whacked harder than any of the major automakers by the industry-wide plunge in <b>car</b> sales, as Americans switch in ever larger numbers from cars to “trucks,” which include ...","As Sales Plunge, <b>GM Might Cancel Six Car Models</b>",https://wolfstreet.com/2017/07/20/gm-might-cancel-six-car-models-after-2020/,Wolf Street,2017-07-21T02:18:00.0000000Z
17,<b>GM</b> WANTS ELECTRIC <b>CAR</b> MANDATE: Major <b>car</b> manufacturer <b>General Motors</b> is asking the Trump administration to back a national <b>car</b> program that would make automakers in all 50 states annually increase their output of electric vehicles. The National Zero ...,Overnight Energy: <b>GM</b> proposes electric <b>car</b> mandate | Deadline nears for EPA <b>car</b> rule comments | Greens change tactics to mobilize climate voters,https://thehill.com/policy/energy-environment/413399-overnight-energy-gm-pushes-for-national-electric-car-mandate,The Hill,2018-10-26T20:12:00.0000000Z
18,"<b>General Motors</b> reported Tuesday an 11-percent plunge in <b>auto</b> sales for the third quarter of 2018, confirming analyst expectations that North American <b>car</b> buyers were tapping the breaks after a robust first half of the year. Other major brands also reported ...","<b>GM</b>, US <b>car</b> sales slump but Fiat Chrysler surges",https://www.france24.com/en/20181002-gm-us-car-sales-slump-but-fiat-chrysler-surges,France 24,2018-10-02T17:19:00.0000000Z
19,"<b>General Motors</b> plans to mass-produce self-driving cars that lack traditional controls like steering wheels and pedals by 2019, the company announced today. Its a bold declaration for the future of driving from one of the country’s Big Three automakers ...",<b>GM</b> will make an autonomous <b>car</b> without steering wheel or pedals by 2019,https://www.theverge.com/2018/1/12/16880978/gm-autonomous-car-2019-detroit-auto-show-2018,The Verge,2018-01-12T00:01:00.0000000Z
20,"Members of Congress who voted against the <b>auto</b> bailout are getting campaign money from an unlikely source -- <b>General Motors</b>, the biggest recipient of <b>auto</b> bailout money. <b>GM</b>&#39;s political action committee has donated $43,000 to House members who voted against ...",<b>General Motors</b> Donates To <b>Politicians Who Voted Against</b> <b>Auto</b> Industry Bailout,https://www.huffingtonpost.com/2012/07/25/general-motors-political-donations_n_1699638.html,HuffPost,2012-07-25T19:43:00.0000000Z
21,"Tech stocks are getting pounded lately. Almost all the FAANG stocks whiffed on earnings, with Apple (NASDAQ:AAPL) providing the latest blow to the sector. As a result, we’re seeing a bunch of ...",7 Autonomous Vehicle Stocks to Consider Now,https://investorplace.com/2018/11/7-autonomous-vehicle-stocks-to-consider-now/,InvestorPlace,2018-11-16T18:12:00.0000000Z
22,"Under the terms of the Justice Department’s $900 million settlement, no <b>GM</b> executives will be prosecuted for covering up the faulty ignition switch linked to at least 124 deaths. The deal is the latest in a string of deferred prosecution agreements ...","<b>GM</b> Did the Crime, Drivers Do the Time: Ralph Nader on Failure of U.S. to Prosecute <b>Car</b> Executives",https://www.democracynow.org/2015/9/18/gm_did_the_crime_drivers_do,Democracy Now!,2015-09-18T15:53:00.0000000Z
23,"Washington: <b>General Motors</b> said Tuesday it was launching a peer-to-peer <b>car</b> rental service to allow owners to make money by listing them as shared vehicles. The US <b>auto</b> giant said <b>GM</b> <b>car</b> owners would be able to list their vehicles via Maven, its <b>car</b> ...",<b>GM</b> launches peer-to-peer <b>car</b> sharing service on rental platform,https://auto.economictimes.indiatimes.com/news/passenger-vehicle/cars/gm-launches-peer-to-peer-car-sharing-service-on-rental-platform/65121448,ET Auto.com,2018-07-24T13:57:00.0000000Z
24,"Black Friday sales, which roll into the nearly ubiquitous Holiday Sales Events, have gotten underway in earnest at several manufacturers. The programs, playing off the longstanding retail tradition of “black Friday” (the day after Thanksgiving sales ...",This Week in <b>Car</b> Buying: Black Friday deals; Inventories fatten; China&#39;s Zotye plans 2020 U.S. launch; Volvo subscriptions thrive,https://www.kbb.com/car-news/all-the-latest/this-week-in-car-buying-black-friday-sales-inventories-fatten/2100006056/,Kelley Blue Book,2018-11-16T17:00:00.0000000Z
25,"<b>General Motors</b> cut its full-year profit forecast on Wednesday, in part due to higher commodity costs as it amplified its warning that mushrooming trade conflicts could dent US and global <b>car</b> sales. <b>GM</b> trimmed its earnings forecast from its prior range of $ ...","<b>GM</b> cuts 2018 profit forecast, says trade war hit to <b>car</b> sales",https://phys.org/news/2018-07-gm-profit-war-car-sales.html,Phys.org,2018-07-25T17:42:00.0000000Z
26,U.S. automakers and parts suppliers on Thursday urged the Trump administration to end steel and aluminum tariffs on Mexico and Canada and warned that potential U.S. national security tariffs on automotive imports would lead to widespread job losses.,Automaker Groups Warn US Tariffs Will Undermine New NAFTA Deal,https://www.voanews.com/a/automaker-groups-warn-us-tariffs-will-undermine-new-nafta-deal/4660339.html,Voice of America,2018-11-15T18:25:00.0000000Z
27,"<b>General Motors</b> today announced the launch of a short-term vehicle rental program exclusive to the Lyft ride-sharing service. The Express Drive rental program will make cars available to Lyft drivers starting at $99, a price that includes insurance and ...","Lyft, <b>GM</b> start <b>short-term car rental program, aim for self-driving</b> <b>car</b> network",https://www.computerworld.com/article/3044556/car-tech/lyft-gm-start-short-term-car-rental-program-aim-for-self-driving-car-network.html,Computerworld,2016-03-15T21:55:00.0000000Z
28,"<b>GM</b> is launching a <b>car</b>-sharing service called Maven. Photo by John F. Martin. Courtesy of <b>General Motors</b>. Uber. Tesla. Zipcar. <b>General Motors</b>? Unlikely as it may seem, the 107-year-old Detroit automaker is trying to position itself among the upstarts that ...",<b>General Motors Is Planning for</b> a <b>Future in Which People Don</b>’t Buy Cars,http://www.slate.com/blogs/moneybox/2016/01/21/gm_s_maven_car_sharing_service_is_part_of_its_plan_for_the_future_of_cars.html,Slate,2016-01-21T00:00:00.0000000Z
29,"<b>General Motors</b> will begin offering <b>both Apple CarPlay and Android Auto</b> in most of its 2016 vehicles, allowing customers to mirror their smartphones and their apps to their infotainment systems. <b>GM</b>&#39;s announcement today follows one earlier this week by ...",<b>GM</b> to offer <b>both Apple CarPlay and Android Auto</b> on most vehicles,https://www.computerworld.com/article/2927454/telematics/gm-to-offer-both-apple-carplay-and-android-auto-on-most-vehicles.html,Computerworld,2015-05-28T04:16:00.0000000Z
30,"It is sleek and streamlined, fast and electric. But as CBS News Correspondent John Blackstone reports, <b>General Motors</b>&#39; EV1, the <b>car</b> of the future, is about to become a thing of the past. &quot;I can out accelerate most of the cars on the road without using a ...",<b>GM Pulls Plug On Electric Car</b>,https://www.cbsnews.com/news/gm-pulls-plug-on-electric-car/,CBS News,2003-03-11T16:50:00.0000000Z
31,"Unlike other Cadillac CT6 models sold in the US, the PHEV variant is made in China, its primary market. With the <b>car</b>’s high price, low sales and the ongoing trade war initiated by President Donald Trump, <b>GM</b> has decided to pull the plug (sorry) on the CT6 ...",Cadillac CT6 Plug-in Hybrid axed from 2019 range in the US,https://www.betweentheaxles.net/cadillac-ct6-plug-in-hybrid-axed-from-2019-range-in-the-us-19733,betweentheaxles.net,2018-11-16T02:05:00.0000000Z
32,"<b>General Motors</b>&#39; self-driving unit, Cruise, could be worth $43 billion, RBC Capital Markets estimates. The autonomous arm received a valuation of $11.5 billion from Japan&#39;s SoftBank in May. <b>GM</b> is reportedly eyeing a spin-off or tracking stock for Cruise ...","<b>GM</b>&#39;s self-driving <b>car</b> unit could be worth $43 billion — nearly 4 times the valuation it received 6 weeks ago, RBC says (<b>GM</b>)",https://markets.businessinsider.com/news/stocks/gm-stock-price-cruise-self-driving-car-unit-could-be-worth-43-billion-rbc-says-2018-7-1027355015,Markets Insider,2018-07-10T13:41:00.0000000Z
33,The world’s largest online retailer is partnering with <b>General Motors</b> Co. and Volvo Cars to launch in-<b>car</b> package deliveries as connected vehicle technology becomes more sophisticated. Amazon.com Inc. is hoping a new in-<b>car</b> delivery service will serve as ...,<b>GM</b> partners with Amazon for in-<b>car</b> delivery,https://www.detroitnews.com/story/business/autos/general-motors/2018/04/24/gm-amazon-car-delivery/34191261/,The Detroit News,2018-04-24T12:41:00.0000000Z
34,Don’t be impressed when a <b>car</b> dealership manager offers to throw in a few free oil changes on a new <b>car</b> purchase. <b>General Motors</b> is upping the ante in buyer incentives by including MetLife <b>auto</b> insurance coverage for a full year on new vehicles bought in ...,"Buy a New <b>GM</b> <b>Car, Get Free Auto Insurance for</b> a Year",http://business.time.com/2011/07/07/buy-a-gm-car-get-free-auto-insurance-for-a-year/,TIME Business &amp; Money,2011-07-07T00:00:00.0000000Z
35,"<b>General Motors</b> agreed to settle a lawsuit filed by a motorcyclist involved in a minor crash with one of its self-driving cars in San Francisco late last year, the automaker said on Friday. Oscar Nilsson sued <b>GM</b> in U.S. District Court in January for ...",<b>GM</b> settles lawsuit with motorcyclist hit by self-driving <b>car</b>,http://canada.autonews.com/article/20180601/MOBILITY/180609924/gm-lawsuit-self-driving-car-san-francisco-california,canada.autonews.com,2018-06-01T22:51:00.0000000Z
36,"Even for those who love driving, owning a <b>car</b> can be a pain. Gas, maintenance, and insurance costs can add up quickly and, if you live in a crowded city, finding a parking space can be difficult. These annoyances have created a profitable niche for <b>car</b> ...","<b>GM</b>’s Maven <b>car</b>-sharing service is convenient, but we’re not giving up our keys",https://www.digitaltrends.com/cars/testing-out-general-motors-maven-car-sharing-service/,digitaltrends.com,2018-06-14T21:39:00.0000000Z
37,"Global automakers&#39; bid to invest hugely into the development of autonomous and electric vehicles continues unabated. Honda Motor Co., Ltd. HMC, which has so far been lagging behind with respect to self-driving vehicle front, has come up in a big way.","<b>Auto</b> Stock Roundup: <b>GM</b>, HMC Tie Up for Self-Driving Technology, TM to Form JV",https://www.nasdaq.com/article/auto-stock-roundup-gm-hmc-tie-up-for-self-driving-technology-tm-to-form-jv-cm1036038,Nasdaq,2018-10-12T13:34:00.0000000Z
38,"SAN FRANCISCO: It’s one of the biggest bets going in the world of cars. Since May, <b>General Motors</b> Co and its Cruise self-driving <b>car</b> unit have landed $5 billion in investment commitments from Japan’s SoftBank Group Corp and Honda Motor Co Ltd to ...",<b>GM</b>’s driverless <b>car</b> bet faces long road ahead,https://thepeninsulaqatar.com/article/24/10/2018/GM%E2%80%99s-driverless-car-bet-faces-long-road-ahead,The Peninsula,2018-10-24T10:22:00.0000000Z
39,(TNS) -- <b>General Motors</b>’ purchase last year of San Francisco self-driving startup Cruise Automation appears to be bearing fruit. The two companies on Monday unveiled a jointly developed self-driving <b>car</b> that — unlike the autonomous prototypes already ...,"Self-<b>Driving Car From GM, Cruise</b> <b>Is Ready For Mass Production</b>",http://www.govtech.com/fs/Self-Driving-Car-From-GM-Cruise-Ready-For-Mass-Production.html,Government Technology,2017-09-12T19:29:00.0000000Z
40,"<b>General Motors</b>&#39; Maven division is launching a &quot;peer-to-peer&quot; <b>car</b>-sharing service, meaning <b>GM</b> owners and lessees will be able to rent out their cars when they aren&#39;t driving them. The service is launching in &quot;beta&quot; form in Chicago, Detroit, and Ann Arbor ...",Maven Will Let <b>GM</b> Owners Rent Out Their Cars,http://www.thedrive.com/tech/22258/maven-will-let-gm-owners-rent-out-their-cars,The Drive,2018-07-24T12:07:00.0000000Z
41,"BMW and Hyundai urged the US not to impose tariffs on <b>auto</b> imports, joining <b>General Motors</b> in pressing their case to the Commerce Department even as a top aide to President Donald Trump dismissed the concerns as “smoke and mirrors”. “It seems that ...",BMW and Hyundai join <b>GM</b> in begging Donald Trump not to put tariffs on <b>auto</b> imports,https://www.scmp.com/news/china/economy/article/2153337/bmw-and-hyundai-join-gm-begging-donald-trump-not-put-tariffs-auto,South China Morning Post,2018-07-01T18:35:00.0000000Z
42,"Chevrolet is bringing the Monza name back for a midsize sedan with &quot;dynamic design that inherits the brand&#39;s sporty DNA.&quot; This sedan is set to debut at the Guangzhou <b>Auto</b> Show in China, but Chevy dropped a teaser of the front end today. Its styling speaks ...",Chevrolet revives the Monza name with a midsize sedan,https://www.autoblog.com/2018/11/15/chevy-revives-monza-name/,Autoblog,2018-11-15T17:31:00.0000000Z
43,"<b>GM</b> is seeking approval for an autonomous <b>car</b> which <b>has no steering wheel</b> and no pedals, and you can imagine the regulatory and red tape maze it has to navigate. <b>General Motors</b> is asking the federal government to approve adjustments to 16 motor vehicle ...","<b>GM</b> Autonomous <b>Car</b> <b>Has No Steering Wheel</b>, No Pedals",https://www.newsmax.com/thewire/gm-autonomous-car-no-steering-wheel-pedals/2018/01/12/id/836832/,Newsmax,2018-01-12T17:36:00.0000000Z
44,"Electric vehicle adoption is coming — and soon, say many in the industry — but <b>car</b> manufacturers and other stakeholders believe the federal tax credit is necessary to narrow price differences between the emissions-free vehicles and internal-combustion ...","Tesla, <b>GM</b>, ChargePoint and other EV interests press Congress to continue federal tax credit",https://www.utilitydive.com/news/tesla-gm-chargepoint-and-other-ev-interests-press-congress-to-continue-fe/542257/,Utility Dive,2018-11-15T15:24:00.0000000Z
45,"We’ve entered the “sharing economy,” the experts tell us, with home-sharing operations such as AIRBNB, ride-sharing companies like Uber and <b>car</b>-sharing ventures like Car2Go becoming increasingly popular with American travelers and commuters.",Maven to Let <b>GM</b> Vehicle Owners Profit from <b>Car</b>-Sharing,http://www.thedetroitbureau.com/2018/07/maven-to-let-gm-vehicle-owners-profit-from-car-sharing/,TheDetroitBureau,2018-07-24T13:43:00.0000000Z
46,"After a successful pilot launch in a couple of cities, <b>General Motors</b>’ peer-to-peer <b>car</b> sharing service Maven will expand to 10 more cities by the end of 2018. The service joins cities such as Baltimore, Boston, Denver, Los Angeles, San Francisco, and ...",<b>GM</b> expands Maven peer-to-peer <b>car</b>-sharing program to new cities,http://www.nydailynews.com/autos/news/gm-maven-car-sharing-expansion-article-article-1.4044027,New York Daily News,2018-10-25T17:54:00.0000000Z
47,"Ford Motor Co. is recalling 37,801 2018 Ford Expedition and Lincoln Navigator sport utility vehicles with second-row bench seats that may be missing reinforcement brackets in the seat track assembly. If one or both J-channel reinforcement brackets were ...",Ford recalls Expedition and Navigator SUVs for rear seat issue,https://www.trucks.com/2018/11/16/ford-recalls-2018-expedition-navigator-missing-seat-parts/,trucks.com,2018-11-16T21:42:00.0000000Z
48,"This article is being republished as part of our daily reproduction of WSJ.com articles that also appeared in the U.S. print edition of The Wall Street Journal (October 4, 2018). Honda Motor Co. is investing $750 million in <b>General Motors</b> Co.&#39;s self ...",Honda Bets on <b>GM</b>&#39;s Driverless <b>Car</b> -- WSJ,https://ih.advfn.com/p.php?pid=nmona&article=78395980,ih.advfn.com,2018-10-04T08:01:00.0000000Z
49,"That someone might be <b>General Motors</b>. The automaker wants to make money from understanding its drivers&#39; <b>car</b> radio listening habits. In a three-month test, <b>GM</b> used in-<b>car</b> Wi-Fi to track the habits of some of its drivers in hopes of seeing whether ...",<b>GM</b> tracked radio listening habits for 3 months to better target in-<b>car</b> advertising,https://www.msn.com/en-us/news/other/gm-tracked-radio-listening-habits-for-3-months-to-better-target-in-car-advertising/ar-BBNNyi1,MSN,2018-10-01T16:33:00.0000000Z
50,<b>General Motors</b> has confirmed it will reach the threshold for the U.S. federal electric <b>car</b> tax credit this year. The tax credits were signed into law as part of the Energy Improvement and Extension Act of 2008 and feature a built-in phase-out period.,<b>GM</b> Will Reach Electric <b>Car</b> Tax Credit Limit This Year,https://gm-volt.com/2018/10/25/gm-will-reach-electric-car-tax-credit-limit-year/,GM-VOLT : Chevy Volt Electric Car Site,2018-10-25T17:17:00.0000000Z
51,"<b>General Motors</b> has said it wants to deploy a fleet of self-driving Chevy Bolts for a commercial ride-sharing service at some point in 2019. But ahead of that, <b>GM</b>’s self-driving unit, <b>GM</b> Cruise, is aiming to deploy autonomous cars without a driver at the ...",<b>GM</b> Cruise Prepping Launch Of Driverless <b>Car</b> Pilot In San Francisco: Emails,https://jalopnik.com/gm-cruise-prepping-launch-of-driverless-car-pilot-in-sa-1826571157,Jalopnik,2018-06-05T19:06:00.0000000Z
52,(CNN) - Volkswagen has committed to spending tens of billions of dollars as part of a dramatic shift to electric and autonomous vehicles. The Germany carmaker said Friday that it would invest €44 billion ($50 billion) by 2023 to develop electric cars ...,Volkswagen to spend $50B on electric <b>car</b> &#39;offensive&#39;,https://www.click2houston.com/news/talkers/volkswagen-to-spend-50b-on-electric-car-offensive,Click2Houston,2018-11-16T15:20:00.0000000Z
53,"After struggling during the summer, the outlook for Tesla (NASDAQ:TSLA) stock has dramatically improved. With the company reporting a quarterly profit, and CEO Elon Musk out as chairman, optimism ...",A Speculative Buy Case for Risky Tesla Stock Has Emerged,https://investorplace.com/2018/11/speculative-buy-case-risky-tesla-stock/,InvestorPlace,2018-11-15T10:00:00.0000000Z
54,"Meeting future emissions and fuel-economy standards in medium- and heavy-duty trucks is becoming more and more of a concern for manufacturers and users alike. Over the last few years, we have seen major players in the game push to develop technology that ...",Detonation: A Future for Trucks,http://www.trucktrend.com/features/1811-detonation-a-future-for-trucks/,Truck Trend,2018-11-14T23:08:00.0000000Z
55,"Get instant alerts when news breaks on your stocks. Claim your 2-week free trial to StreetInsider Premium here. BEIJING/SHANGHAI (Reuters) - China&#39;s powerful state planner said on Thursday it had not considered reducing the vehicle purchase tax, seemingly ...","China state planner douses hopes for <b>auto</b> tax cuts, tells sector to buckle up",https://www.streetinsider.com/Reuters/China+state+planner+douses+hopes+for+auto+tax+cuts%2C+tells+sector+to+buckle+up/14833291.html,StreetInsider,2018-11-15T02:35:00.0000000Z
56,"The self-driving Ford Fusion, with a white crown of cameras, radars and lasers sensing its surroundings, was coursing through the congested streets of Miami when a bicyclist cut across its path. The robot didn&#39;t even tap the brakes. It cruised along at 25 ...",Ford charts progress on its robotic rides,http://www.messenger-inquirer.com/features/the_link/ford-charts-progress-on-its-robotic-rides/article_4df9d700-e90d-11e8-a608-139f4deb10e8.html,Messenger-Inquirer,2018-11-15T19:41:00.0000000Z
57,"For this year’s Guangzhou <b>Auto</b> Show, Chevrolet has scheduled a wide range of debuts, from the Blazer-like FNR-CarryAll Concept SUV, to the Monza RS sedan, new Malibu XL and multiple Redline variants such as the Malibu XL Redline and the Corvette C7.R ...","Chevy Revives Monza Name On New Sedan, Gives Blazer Third Row In China",https://www.carscoops.com/2018/11/chevy-revives-monza-name-new-sedan-gives-blazer-third-row-china/,Carscoops,2018-11-15T15:02:00.0000000Z
58,"Editor&#39;s note: This article was published in Grand Traverse Business magazine&#39;s Fall 2018 issue. For more stories from the magazine, click here to read GT Business in its entirety online. KALKASKA — Americans fell in love with their cars during the 1920s.",History on Wheels: Voice family has been selling cars for 97 years,https://www.record-eagle.com/news/gt_business/history-on-wheels-voice-family-has-been-selling-cars-for/article_d1d3bf21-36c8-5161-9a70-fb88324d2a13.html,Traverse City Record-Eagle,2018-11-14T23:23:00.0000000Z
59,"Autoblog rating for the is not available. Please check back later. This model is an XLT SuperCrew model with a 145-inch wheelbase. It&#39;s powered by the 2.7-liter EcoBoost, the second least-powerful engine in the F-150 lineup. It&#39;s no slouch, though, with ...",2019 Ford F-150 2.7L EcoBoost Drivers&#39; Notes Review | More than just adequate,https://www.autoblog.com/2018/11/16/2019-ford-f-150-2-7l-ecoboost-drivers-notes-review-more-than/,Autoblog,2018-11-16T17:25:00.0000000Z
60,"The self-driving Ford Fusion, with a white crown of cameras, radars and lasers sensing its surroundings, was coursing through the congested streets of Miami when a bicyclist cut across its path. The robot didn’t even tap the brakes. It cruised along at ...",Ford Gives Grandma the Heave-Ho and Emboldens Its Robotic Rides,https://www.claimsjournal.com/news/national/2018/11/15/287859.htm,Claims Journal,2018-11-15T15:47:00.0000000Z
61,"A big <b>car</b> company is going small. Ford is buying electric scooter company Spin. Ford and Spin won’t confirm the price tag, but reports put the purchase price at $100 million and an overall investment from Ford of $200 million. The acquisition, announced ...",Why Ford Is Getting Into The Scooter Business,https://www.opb.org/news/article/npr-why-ford-is-getting-into-the-scooter-business/,Oregon Public Broadcasting,2018-11-16T14:03:00.0000000Z
62,"Trucks and SUVs are all the rage, and automakers don&#39;t plan to sit by idly and let their competition reap the rewards. That&#39;s pretty evident with automakers&#39; recent moves, including Ford <b>Motor&#39;s</b> (F) decision to essentially scrap its <b>car</b> portfolio to focus ...","Meet Jeep&#39;s New Truck, the Gladiator",https://www.thestreet.com/lifestyle/cars/meet-jeep-new-truck-the-gladiator-14783288,TheStreet.com,2018-11-15T17:57:00.0000000Z
63,"Ford Motor Co. is pairing up with Walmart Inc., the world’s largest retailer, to begin laying the groundwork for a driverless grocery delivery service. The two companies will test out the concept as part of an existing grocery-delivery partnership ...",Ford and Walmart to test using autonomous cars for deliveries,https://www.pennlive.com/business/2018/11/ford-and-walmart-to-test-using-autonomous-cars-for-deliveries.html,The Patriot-News,2018-11-14T15:39:00.0000000Z
