,description,headline,url,provider,date
0,"Other automakers, including Audi and Volkswagen, Fiat Chrysler Automobiles, <b>General Motors</b>, and Mercedes-Benz have issued <b>recalls</b> for the same issue. Honda says it is not aware of any crashes or injuries related to this issue. Vehicles involved ...","Honda <b>Recalls</b> 64,000 SUVs and Minivans for Brake Issue",https://www.yahoo.com/news/honda-recalls-64-000-suvs-minivans-brake-issue-001537595.html,YAHOO!,2018-11-17T00:55:00.0000000Z
1,He concluded a 20-year career in domestic and international communications at <b>General Motors</b> in 2017. He can be found on Twitter: @AlanAdler.,Ford <b>recalls</b> Expedition and Navigator SUVs for rear seat issue,https://www.trucks.com/2018/11/16/ford-recalls-2018-expedition-navigator-missing-seat-parts/,trucks.com,2018-11-16T21:42:00.0000000Z
2,"Just days after taking the job in January 2014, <b>General Motors</b> CEO Mary Barra had to confront a crisis that threatened the entire company&#39;s post-government bailout future. An ignition switch malfunction in some of its car models from a decade prior had ...",<b>GM</b> CEO Mary Barra said the <b>recall</b> crisis of 2014 forever changed her leadership style,https://www.businessinsider.com/gm-mary-barra-recall-crisis-leadership-style-2018-11,Business Insider,2018-11-14T13:43:00.0000000Z
3,National Highway Traffic Safety Administration (NHTSA) stated it was investigating if <b>General Motors</b> should <b>recall</b> another 1.7 million sport utility vehicles because of an issue with windshield ...,NHTSA investigates 1.7 million <b>General Motors</b> SUVs over wiper failures,https://speedlux.com/nhtsa-investigates-1-7-million-general-motors-suvs-over-wiper-failures/,Supercars,2018-11-09T18:56:00.0000000Z
4,"The government agency will probe both vehicles after a previous <b>recall</b> in 2016 addressed wiper failure, Reuters reported Tuesday. If the NHTSA finds new evidence of wiper failure, <b>GM</b> will be forced to <b>recall</b> an additional 1.7 million crossovers.","NHTSA to probe Chevrolet Equinox, GMC Terrain crossover SUV windshield wipers",https://www.thecarconnection.com/news/1119799_nhtsa-to-probe-chevrolet-equinox-gmc-terrain-crossover-suv-windshield-wipers,The Car Connection,2018-11-08T13:54:00.0000000Z
5,Nov. 7 (UPI) — The U.S. National Highway Traffic Safety said Tuesday it is investigating whether <b>General Motors</b> should add 1.7 million sport-utility vehicles to a 2016 <b>recall</b> for windshield wipers.,NHTSA investigating if 1.7M <b>GM</b> SUVs should be added to <b>recall</b>,https://gephardtdaily.com/national-international/nhtsa-investigating-if-1-7m-gm-suvs-should-be-added-to-recall/,Gephardt Daily,2018-11-08T03:30:00.0000000Z
6,"Stack all of <b>GM</b>’s 2014 recalled cars and you’d be halfway to the moon, which is 384,403 km away. NASA, call your office. 4. The longest <b>time</b> between <b>recalls</b> hasn’t even been longer than the World Cup. The longest stretch between separate <b>GM</b> <b>recalls</b> ...",All the Cars <b>GM</b> Has Recalled This Year Would Wrap the Earth 4 Times,http://time.com/2945867/gm-recalls-facts/,Time,2018-11-07T23:40:00.0000000Z
7,<b>General Motors</b> may soon have to <b>recall</b> an additional 1.7 million Chevrolet Equinox and GMC Terrain crossovers from the 2010-2016 model years. The National Highway Traffic Safety Administration (NHTSA) explained it is investigating whether or not the ...,<b>GM</b> Under Investigation by NHTSA for Chevy Equinox and GMC Terrain Wiper Defects,http://www.thedrive.com/news/24752/gm-under-investigation-by-nhtsa-for-chevy-equinox-and-gmc-terrain-wiper-defects,The Drive,2018-11-07T19:49:00.0000000Z
8,The NHTSA is investigating whether or not <b>General Motors</b> should <b>recall</b> up to 1.7 million SUVs. The <b>recall</b> in question revolves around a windshield wiper failure that affected GMC Terrain and Chevy Equinox SUVs from 2010-2016. <b>GM</b> already had to <b>recall</b> ...,NHTSA Investigating 1.7 Million Chevy Equinox and GMC Terrain SUVs for Windshield Wiper Failure [News],https://www.tflcar.com/2018/11/equinox-terrain-wiper-failure-nhtsa/,The Fast Lane Car,2018-11-07T18:30:00.0000000Z
9,"KEYWORDS <b>GM</b> vehicles recalled <b>recall</b> U.S. government questions 2016 <b>recall</b> wiper blades recalled Nov. 7, 2018—The U.S. government is investigating whether <b>General Motors</b> should expand a 2016 windshield wiper <b>recall</b> to include 1.7 million more SUVs ...",Government Questions <b>GM</b> <b>Recall</b>,https://www.fenderbender.com/articles/11859-us-questions-gm-recall,FenderBender,2018-11-07T16:37:00.0000000Z
10,"DETROIT (AP) — The U.S. government is investigating whether <b>General Motors</b> should expand a 2016 windshield wiper <b>recall</b> to include 1.7 million more SUVs. The government wants to know if a <b>recall</b> of 368,000 Chevrolet Equinox and GMC Terrain compact SUVs ...",US probing whether <b>GM</b> SUV <b>recall</b> included enough vehicles,https://www.wxyz.com/news/us-probing-whether-gm-suv-recall-included-enough-vehicles?autoplay=true,WXYZ,2018-11-07T15:46:00.0000000Z
11,"(WASHINGTON) -- A <b>recall</b> issued by <b>General Motors</b> two years ago regarding faulty windshield wipers may soon be expanded to cover approximately 1.7 million vehicles. In 2016, <b>GM</b> announced it was recalling 2013 Chevrolet Equinox and GMC Terrain SUVs over an ...",NHTSA investigating <b>GM</b> <b>recall</b> over faulty windshield wipers,http://www.wbal.com/article/345149/113/nhtsa-investigating-gm-recall-over-faulty-windshield-wipers,WBAL,2018-11-07T13:53:00.0000000Z
12,"<b>General Motors</b> is no stranger to vehicle <b>recalls</b>, and it may soon be facing another. This time it’s a problem with windshield wipers that could see 1.7 million SUVs recalled. <b>GM</b> already recalled ...","<b>GM</b> Faces Yet Another Potential <b>Recall</b>, This Time Over Faulty Wipers",http://fortune.com/2018/11/07/gm-wiper-suv-recall-nhtsa/,Fortune,2018-11-07T12:48:00.0000000Z
13,"A little over two years ago, <b>General Motors</b> had to <b>recall</b> an estimated 367,808 GMC Terrain and Chevy Equinox crossovers in the United States due to a problem with their windshield wipers. According to the <b>recall</b> notice, the issue was with the ball joints ...",NHTSA Investigating Old <b>GM</b> Crossovers For Windshield Wiper Issue,https://www.carscoops.com/2018/11/nhtsa-investigating-old-gm-crossovers-windshield-wiper-issue/,Carscoops,2018-11-07T12:34:00.0000000Z
14,Consumer Reports has no financial relationship with advertisers on this site. The National Highway Traffic Safety Administration is investigating whether a <b>recall</b> <b>General Motors</b> issued two years ago to address faulty windshield wipers covered enough models ...,NHTSA Launches Probe Into Faulty <b>GM</b> Windshield Wipers,https://www.yahoo.com/news/nhtsa-launches-probe-faulty-gm-windshield-wipers-202519650.html,YAHOO!,2018-11-07T10:22:00.0000000Z
15,"said on Tuesday it was investigating whether <b>General Motors</b> Co (<b>GM</b>.N), should <b>recall</b> an additional 1.7 million sport utility vehicles due to an issue with windshield wiper failures. <b>GM</b>, the largest U.S. automaker, had recalled 367,800 2013 GMC Terrain and ...",U.S. agency probes 1.7 million <b>GM</b> SUVs over wiper failures,https://www.reuters.com/article/us-gm-safety/u-s-agency-probes-1-7-million-gm-suvs-over-wiper-failures-idUSKCN1NB256,Reuters,2018-11-07T03:15:00.0000000Z
16,"The U.S. National Highway Traffic Safety Administration said it is investigating whether <b>General Motors</b> (<b>GM</b>) missed more than a million vehicles during a 2016 <b>recall</b> for windshield wipers that could fail. In 2016 <b>General Motors</b> recalled about 368,000 2013 ...",U.S. Probes Whether <b>GM</b> Should Expand SUV <b>Recall</b> On Wiper Failures,http://www.rttnews.com/2952330/u-s-probes-whether-gm-should-expand-suv-recall-on-wiper-failures.aspx,RTTNews,2018-11-07T02:00:00.0000000Z
17,"<b>General Motors</b> is under investigation by U.S. safety regulators that are considering forcing the company to expand a windshield wiper <b>recall</b> to cover 1.7 million additional sport-utility vehicles. The company recalled 368,000 Chevrolet Equinox and GMC ...",U.S. Regulators May Force <b>GM</b> to Expand Wiper <b>Recall</b>,http://www.thedetroitbureau.com/2018/11/u-s-regulators-may-force-gm-to-expand-wiper-recall/,TheDetroitBureau,2018-11-06T21:57:00.0000000Z
18,"Back in August 2016, <b>General Motors</b> recalled 367,808 Chevrolet Equinox and GMC Terrain crossovers for potentially faulty windshield wipers. At the time, certain 2013 models were identified as having linkages that could rust and separate, leaving drivers ...",Wipeout: Government Agency Investigating <b>GM</b> Windshield Wiper <b>Recall</b>,https://www.thetruthaboutcars.com/2018/11/wipeout-government-agency-investigating-gm-windshield-wiper-recall/,The Truth About Cars,2018-11-06T18:09:00.0000000Z
19,"WASHINGTON -- The U.S. National Highway Traffic Safety Administration said on Tuesday it is investigating whether <b>General Motors</b> should <b>recall</b> an additional 1.7 million crossovers for windshield wiper failures. <b>GM</b> recalled 367,000 2013 GMC Terrain and ...",NHTSA probes 1.7 million <b>GM</b> crossovers for windshield wiper failures,http://www.autonews.com/article/20181106/OEM11/181109854/general-motors-wipers-recall-investigation,Automotive News,2018-11-06T17:19:00.0000000Z
20,"DETROIT — The U.S. government is investigating whether <b>General Motors</b> should expand a 2016 windshield wiper <b>recall</b> to include 1.7 million more SUVs. The government wants to know if a <b>recall</b> of 368,000 Chevrolet Equinox and GMC Terrain compact SUVs from ...",U.S. questions whether <b>GM</b> SUV <b>recall</b> included enough vehicles,https://www.freep.com/story/money/cars/general-motors/2018/11/06/chevrolet-equinox-gmc-terrain-suvs-recall/1901108002/,Detroit Free Press,2018-11-06T16:06:00.0000000Z
21,"Over the span of two weeks, <b>General Motors</b> Company <b>GM</b> has again been caught into a <b>recall</b> mess. Per Reuters, this U.S. auto giant announced that its China joint venture, Shanghai <b>GM</b>, will <b>recall</b> over 3.3 million vehicles in China from Oct 20. Per the State ...",<b>General Motors</b> (<b>GM</b>) to <b>Recall</b> Over 3.3M Vehicles in China,https://finance.yahoo.com/news/general-motors-gm-recall-over-135901846.html,Yahoo Finance,2018-10-02T14:55:00.0000000Z
22,"Over the span of two weeks, <b>General Motors</b> Company (<b>GM</b> - Free Report) has again been caught into a <b>recall</b> mess. Per Reuters, this U.S. auto giant announced that its China joint venture, Shanghai <b>GM</b>, will <b>recall</b> over 3.3 million vehicles in China from Oct 20.",<b>General Motors</b> (<b>GM</b>) to <b>Recall</b> Over 3.3M Vehicles in China,https://www.zacks.com/stock/news/325844/general-motors-gm-to-recall-over-33m-vehicles-in-china,Zacks Investment Research,2018-10-02T13:24:00.0000000Z
23,"The Takata airbag <b>recall</b> is the largest <b>recall</b> in us auto history, with 19 different automakers recalling over 30 million cars. But owners of some popular <b>General Motors</b> pickups and SUVs are wondering why they can&#39;t get their airbags replaced. Among them ...",Why <b>GM</b> won&#39;t <b>recall</b> thousands of Takata airbags,https://www.wcpo.com/money/consumer/dont-waste-your-money/why-gm-won-t-recall-thousands-of-takata-air-bags,WCPO-TV,2018-09-19T15:36:00.0000000Z
24,"Just two days after recalling more than 1 million vehicles, <b>General Motors</b> issued another <b>recall</b> for 41,000 pickup trucks and sports-utility vehicles, citing problems with the brakes, according to the Associated Press. Vehicles recalled because of loose ...","<b>GM</b> <b>recalls</b> trucks, SUVs for brake problem",https://finance.yahoo.com/news/gm-recalls-trucks-suvs-brake-192506253.html,Yahoo Finance,2018-09-16T04:10:00.0000000Z
25,"<b>General Motors</b> has issued a <b>recall</b> for several 2018-2019 models due to a brake problem that could lead to a collision. Models with the issue are said to have defective brake pistons. According to <b>GM</b> (via <b>GM</b> Authority), the supplier (ZF Group) that provides ...","<b>General Motors</b> Brake <b>Recall</b> Hits Chevy Volt, Bolt Too",https://insideevs.com/general-motors-brake-recall-chevy-volt-bolt/,Inside EVs,2018-09-14T19:10:00.0000000Z
26,"<b>General Motors</b> is recalling more than 210,000 SUVs and pickup trucks because a faulty brake component could reduce the effectiveness of the rear brakes and increase the risk of a crash, according to the National Highway Traffic Safety Administration (NHTSA).","<b>GM</b> Brake <b>Recall</b> Includes 210,000 Cars, SUVs, and Trucks",https://www.consumerreports.org/car-recalls-defects/gm-brake-recall-longer-stopping-distances/,Consumer Reports,2018-09-13T19:37:00.0000000Z
27,"FCA had a big Ram <b>recall</b> in August, Ford had one of its own for the F-150 just last week, and now it&#39;s <b>GM</b>&#39;s turn for a massive pickup truck <b>recall</b>. If you drive a 2015 <b>GM</b> full-size truck or SUV, you can expect a notice coming in the mail soon as the ...",<b>GM</b> <b>Recalls</b> 1.2 Million Full-Size Trucks Over Potential for Power Steering Failure,http://www.thedrive.com/news/23565/gm-recalls-1-2-million-full-size-trucks-over-potential-for-power-steering-failure,The Drive,2018-09-13T16:47:00.0000000Z
28,<b>General Motors</b> is recalling more than a million big pickup trucks and SUVs in the U.S. because of power-assisted steering problems that have been cited in a number of accidents. It&#39;s the second <b>recall</b> by <b>GM</b> this week. <b>GM</b> says the power steering can fail ...,"<b>GM</b> <b>recalls</b> 1 million pickups, SUVs over steering issues",https://www.nj.com/business/index.ssf/2018/09/gm_recalls_1_million_pickups_suvs_over_steering_is.html,NJ.com,2018-09-13T16:11:00.0000000Z
29,"<b>General Motors</b> is recalling 1,015,918 pickup trucks and SUVs in the US over concerns of power steering loss. The affected models include the Chevrolet Silverado, Suburban and Tahoe, the GMC Sierra and Yukon, and the Cadillac Escalade, all of which are from ...",<b>GM</b> <b>recalls</b> over 1 million trucks and SUVs in the US,https://www.cnet.com/roadshow/news/chevy-gmc-cadillac-truck-suv-recall/,CNET,2018-09-13T15:59:00.0000000Z
30,"<b>General Motors</b> Co is recalling 1.205 million pickup trucks and sport utility vehicles worldwide due to issues with a temporary loss of power steering, the No.1 U.S. automaker said on Thursday. Listings New Used New &amp; Used Make Acura Alfa Romeo AMC Aston ...",<b>GM</b> to <b>recall</b> about 1.2 million vehicles worldwide,https://www.msn.com/en-us/autos/news/gm-to-recall-about-12-million-vehicles-worldwide/ar-BBNgWIW,MSN,2018-09-13T15:36:00.0000000Z
31,"(Reuters) - <b>General Motors</b> Co is recalling 1.205 million pickup trucks and sport utility vehicles worldwide due to issues with a temporary loss of power steering, the No.1 U.S. automaker said on Thursday. The <b>recall</b> covers certain 2015 Chevrolet, GMC and ...",<b>GM</b> to <b>recall</b> about 1.2 million vehicles worldwide,https://www.aol.com/article/finance/2018/09/13/gm-to-recall-about-12-million-vehicles-worldwide/23526139/,AOL,2018-09-13T14:51:00.0000000Z
32,<b>General Motors</b> is recalling more than a million big pickup trucks and SUVs in the U.S. because of power-assisted steering problems that have been cited in a number of accidents. <b>GM</b> says the power steering can fail momentarily during a voltage drop and ...,<b>GM</b> <b>recalls</b> over 1 million pickups and SUVs for power steering problem,https://www.cbsnews.com/news/gm-recalls-over-1-million-pickups-and-suvs-for-power-steering-problem/,CBS News,2018-09-13T14:32:00.0000000Z
33,"(Reuters) - <b>General Motors</b> Co (<b>GM</b>.N) is recalling 1.205 million pickup trucks and sport utility vehicles worldwide due to issues with a temporary loss of power steering, the No.1 U.S. automaker said on Thursday. The <b>recall</b> covers certain 2015 Chevrolet ...",<b>GM</b> to <b>recall</b> about 1.2 million vehicles worldwide,https://www.reuters.com/article/us-gm-recall-idUSKCN1LT21K,Reuters,2018-09-13T13:33:00.0000000Z
34,DETROIT - <b>General Motors</b> is recalling more than a million big pickup trucks and SUVs in the U.S. because of power-assisted steering problems that have been cited in a number of accidents. <b>GM</b> says the power steering can fail momentarily during a voltage ...,"<b>General Motors</b> <b>recalls</b> more than 1 million pickups, SUVs for power steering issue",https://www.clickondetroit.com/consumer/recalls/general-motors-recalls-more-than-1-million-pickups-suvs-for-power-steering-issue,clickondetroit.com,2018-09-13T12:53:00.0000000Z
35,"A <b>recall</b> document sent to Jalopnik by a <b>GM</b> representative says the airbag deployment can become an issue “under certain track conditions” like hard braking and sustained acceleration, which can cause a sensing device in the car, the sensing and ...",<b>GM</b> <b>Recalls</b> Almost 500 2019 Corvette ZR1s Over Airbag Risk,https://jalopnik.com/gm-recalls-almost-500-2019-corvette-zr1s-over-airbag-ri-1826992819,Jalopnik,2018-09-13T10:21:00.0000000Z
36,"<b>General Motors</b> is recalling more than 240,000 newer vehicles in North America due to an issue with the brakes that could increase the risk of a crash. According to documents posted by Automotive News, the <b>recall</b> affects model year 2018-2019 Buick LaCrosse ...",<b>GM</b> <b>recalls</b> 240K vehicles across different brands due to potential brake issue,https://www.mlive.com/auto/index.ssf/2018/09/gm_brake_recalls_for_newer_che.html,MLive,2018-09-12T22:01:00.0000000Z
37,"DETROIT (AP) — <b>General Motors</b> is recalling more than 240,000 vehicles, mainly in the U.S. and Canada, to fix a problem that could hamper rear brake performance. The <b>recall</b> covers many GMC Terrain, Buick Lacrosse and Regal, Cadillac XTS and Chevrolet ...","<b>GM</b> <b>recalls</b> over 240,000 vehicles to fix rear brake problem",https://www.wxyz.com/news/gm-recalls-over-240-000-vehicles-to-fix-rear-brake-problem,WXYZ,2018-09-12T19:54:00.0000000Z
38,"<b>General Motors</b> is recalling more than 210,000 vehicles in the U.S. because of bad brakes. The <b>recall</b> impacts 2018 and 2019 models of the Chevrolet Bolt, Cruze, Equinox, Impala, Malibu, and Volt as well as Buick Cadillac XTS, LaCrosse, Regal; and GMC Terrain.","<b>GM</b> <b>recalls</b> 210,000 vehicles due to brake problem",https://abc7news.com/automotive/gm-recalls-210000-vehicles-due-to-brake-problem/4221404/,ABC7 San Francisco,2018-09-12T12:38:00.0000000Z
39,"It looks like the <b>recall</b> fairy is spending its summer in Detroit this year because <b>General Motors</b> just issued a <b>recall</b> for 210,628 vehicles in the US and 19,385 vehicles in Canada over reports that improperly chromed rear brake pistons are causing gas to ...","<b>GM</b> issues a <b>recall</b> for nearly 230,000 vehicles over brake pistons",https://www.cnet.com/roadshow/news/2018-2019-general-motors-brake-recall/,CNET,2018-09-11T22:17:00.0000000Z
40,"<b>GM</b> said Friday that it will <b>recall</b> 3,233 2013 model year Chevrolet Volts to remedy a problem with battery cell balancing that could cause the car to shut down in traffic. The <b>recall</b> mirrors two service campaigns for the 2017 and 2018 Chevrolet Bolt EVs for ...",<b>GM</b> <b>recalls</b> 2013 Chevrolet Volts for battery software (Updated),https://www.greencarreports.com/news/1117379_gm-recalls-2013-chevrolet-volts-for-battery-software-updated,Green Car Reports,2018-06-25T16:53:00.0000000Z
41,"When <b>General Motors</b> recalled 2.6 million Chevrolet Cobalts, Saturn Ions and other small cars worldwide for faulty ignition switches in 2014, it had the daunting task of figuring out where they were, given that most were old enough to have already changed ...","<b>GM</b>&#39;s drive to 100% completion rate on <b>recalls</b>: Not there, yet",http://www.autonews.com/article/20180604/OEM11/180609962/gm-recall-ignition-repair,Automotive News,2018-06-04T04:15:00.0000000Z
42,"For the third time in the past three years, <b>General Motors</b> has asked the U.S. government for permission to avoid <b>recalls</b> of potentially deadly Takata airbag inflators. The company disclosed its third petition to escape the <b>recalls</b> on Tuesday in a filing ...",<b>General Motors</b> asks to avoid Takata airbag <b>recalls</b> for 3rd time,https://www.freep.com/story/money/cars/general-motors/2018/02/07/takata-airbag-recall-general-motors/316980002/,Detroit Free Press,2018-02-07T21:10:00.0000000Z
43,"<b>General Motors</b> Co. said Thursday it is recalling 1.9 million 2007-11 full-size trucks and SUVs with passenger-side Takata air bag inflators, even though the company hopes to prove to federal regulators that the inflators in <b>GM</b> vehicles are safe and that ...","<b>GM</b> <b>recalls</b> 1.9M trucks, SUVs with Takata air bags",https://www.detroitnews.com/story/business/autos/general-motors/2016/06/02/gm-recalls-trucks-suvs-takata-air-bags/85285658/,The Detroit News,2016-06-02T12:26:00.0000000Z
44,"And what’s worse, the National Highway Traffic Safety Administration exclusively told <b>Jalopnik</b> that <b>GM</b> did not act ... NHTSA says they gave them a choice: Issue a <b>recall</b> or face formal investigation. <b>GM</b> quickly capitulated, and on July 9th, they issued ...",<b>GM</b> Didn&#39;t <b>Recall</b> The Hummer Over Fires Until The Feds Threatened Them,https://jalopnik.com/gm-didnt-recall-the-hummer-over-fires-until-the-feds-th-1717581525,Jalopnik,2015-07-13T21:55:00.0000000Z
45,"Washington — Even on New Year&#39;s Day, <b>General Motors</b> couldn&#39;t find respite from the ignition switch crisis that shook the automaker from the executive suite on down in 2014. <b>GM</b> announced Thursday that it has recalled 92,000 additional SUVs and trucks for ...",<b>Recall</b> woes follow <b>GM</b> into new year,https://www.detroitnews.com/story/business/autos/general-motors/2015/01/01/gm-recalls-suvs-trucks-ignition-issue/21149405/,The Detroit News,2015-01-01T16:10:00.0000000Z
46,"As it issues an almost-unprecedented public apology, <b>General Motors</b> finds itself beset from all sides as it struggles to contain the damage from its massive <b>recall</b> of 1.6 million vehicles equipped with ignition switches that may inadvertently shut off ...",Did <b>GM</b> drag <b>its feet in ignition-switch recalls</b>?,https://www.consumeraffairs.com/news/did-gm-drag-its-feet-in-ignition-switch-recalls-022814.html,ConsumerAffairs,2014-11-16T23:21:00.0000000Z
47,"<b>General Motors</b> has yet another unresolved safety concern with its vehicles. This one involves trucks with anti-lock braking system (ABS) problems. The ABS in some <b>GM</b> trucks engages at slow speeds in dry conditions, leading to a loss of braking and ...",Another <b>GM</b> Unresolved <b>Recall</b> Problem – Trucks with ABS Defect,http://nlpc.org/2014/08/12/another-gm-unresolved-recall-problem-%e2%80%93-trucks-abs-defect/,National Legal and Policy Center,2014-08-12T20:15:00.0000000Z
48,"<b>General Motors</b>&#39; troubles with safety <b>recalls</b> has surfaced in another case, this time with the company recalling a group of SUVs for a third time to fix power window switches that can catch fire. The problem, revealed in documents posted by federal safety ...",<b>GM</b>: <b>Third recall</b> on SUVs that can catch fire,https://www.usatoday.com/story/money/cars/2014/08/07/gm-recall-suvs/13747461/,USA Today,2014-08-09T15:48:00.0000000Z
49,"<b>General Motors</b> has announced yet another <b>recall</b>, this time impacting roughly 185,000 Chevy Trailblazers, GMC Envoy and other mid-sized SUV’s after receiving 242 complaints of the driver side window switch circuit boards overheating, which may cause the ...","<b>GM</b> <b>Recalls Chevy Trailblazers, GMC Envoy Other</b> SUVs Due to Fire Risk",https://www.aboutlawsuits.com/gm-suv-fire-recall-69126/,Aboutlawsuits.com,2014-08-08T16:09:00.0000000Z
50,"<b>General Motors</b> (<b>GM</b>) has announced it’s largest auto <b>recall</b> of the year, pulling more than eight million vehicles from the market worldwide due to unintended ignition key rotations that may have caused at least three deaths. <b>GM</b> CEO Mary Barra announced ...",<b>GM</b> <b>Recalls 8.45M Cars Over Ignition Key Rotation Problems</b>,https://www.aboutlawsuits.com/gm-ignition-rotation-recall-67279/,Aboutlawsuits.com,2014-07-25T02:11:00.0000000Z
51,"Welcome to your monthly <b>General Motors recall</b> update. <b>General Motors</b>, you’ll <b>recall</b>, is an American automaker. It sells people cars and then—as it was again shown on Wednesday—it takes those cars back from their owners. <b>GM</b>’s latest effort to look ...","With Latest <b>Recall</b>, <b>GM</b> Makes a Solid Run at Recalling Every Car It’s Ever Made",http://www.slate.com/blogs/the_slatest/2014/07/23/gm_recalls_more_cars.html,Slate,2014-07-23T23:54:00.0000000Z
52,"Last week was pretty stressful for <b>General Motors</b>’ (<b>GM</b>) CEO Mary Barra: Grilled by a U.S. Senate committee again on <b>recalls</b> of some 26 million vehicles in 2014 alone, she was forced to mount a strident defense of the automaker’s top lawyer and Saturday ...",3 Signs That <b>General Motors’ Recall Woes Are Far From Over</b>,https://investorplace.com/2014/07/gm-recall-mary-barra/,InvestorPlace,2014-07-22T14:22:00.0000000Z
