,description,headline,url,provider,date
0,"While the Amazon spectacle has few parallels, it does recall when happened when <b>General Motors</b> announced plans for a $5 billion <b>auto</b> plant for its new Saturn brand in 1985. Governors from more than two dozen states visited Detroit to personally pitch <b>GM</b>&#39;s ...","Rejected by Amazon, cities ponder next steps",http://www.messenger-inquirer.com/features/business/rejected-by-amazon-cities-ponder-next-steps/article_554ca56d-416d-592f-bba0-38e64b63265f.html,Messenger-Inquirer,2018-11-18T06:18:00.0000000Z
1,"Enter &quot;Tesla <b>Motors</b> Incorporated&quot; into cell B1 and &quot;<b>General Motors</b> Company&quot; into cell C1. Tesla and <b>GM</b> are <b>car</b> manufacturing companies. Tesla has a beta of 1.16, while <b>GM</b> has a beta of 1.11. Assume the risk-free rate is 0.25% and the expected market return ...",What is the formula for calculating CAPM in Excel?,https://www.investopedia.com/ask/answers/071415/what-formula-calculating-capital-asset-pricing-model-capm-excel.asp,Investopedia,2018-11-18T05:38:00.0000000Z
2,That’s because every <b>car</b> assembled in the U.S. contains a large percentage of foreign parts. Toyota has said the costs of its cars could rise by thousands of dollars. <b>General Motors</b> has said it would be forced to downsize and cut jobs. A spokeswoman for ...,Trump&#39;s <b>auto</b> tariffs put on hold,https://www.indianagazette.com/news/national/trump-s-auto-tariffs-put-on-hold/article_cfb6f436-e9cf-11e8-84d7-af354179e017.html,Indiana Gazette,2018-11-18T05:26:00.0000000Z
3,"<b>GM</b> landed four green ratings ... Get 24/7 access to in-depth, authoritative coverage of the <b>auto</b> industry from a global team of reporters and editors covering the news that&#39;s vital to your business. Sign up today to get the best of Automotive News ...","Ford, Toyota recognized for commitment to diversity",http://www.autonews.com/article/20181118/RETAIL07/181119752/ford-toyota-rainbow-push-diversity,Automotive News,2018-11-18T05:06:00.0000000Z
4,"Others are also aiming for self-driving ride-share services. <b>GM</b> is putting $100 million into self-driving <b>car</b> production, The Verge reported, and the company has plans for its own service in 2019 ...",Ford Plans a Self-Driving Service—But Tech Problems Still Loom,https://finance.yahoo.com/news/ford-plans-self-driving-tech-153644298.html,Yahoo Finance,2018-11-18T03:50:00.0000000Z
5,"Using the factory Corvette control arms and spindles, the <b>car</b>’s overall footprint, with stock wheels at least, is nearly identical to that of a factory C5. One departure from factory <b>GM</b> engineering is the way the <b>car</b> absorbs bumps. In the front ...",Loud &amp; Offensive: Kyle’s 1967 Mustang C5,http://www.speedhunters.com/2018/11/loud-offensive-kyles-1967-mustang-c5/,Speedhunters,2018-11-18T02:07:00.0000000Z
6,"<b>GM</b>) (TSE:GMM.U) by 1.2% during the 3rd quarter, according to its most recent filing with the SEC. The firm owned 670,098 shares of the <b>auto</b> manufacturer’s stock after selling 8,342 shares during the quarter. TCW Group Inc.’s holdings in <b>General Motors</b> ...",<b>General Motors</b> (NYSE:<b>GM</b>) Position Reduced by TCW Group Inc.,https://theenterpriseleader.com/2018/11/15/tcw-group-inc-has-22-56-million-position-in-general-motors-gm.html,theenterpriseleader.com,2018-11-18T00:42:00.0000000Z
7,"<b>GM</b>) (TSE:GMM.U) from a hold rating to a buy rating in a research note released on Friday. Zacks Investment Research currently has $40.00 price target on the <b>auto</b> manufacturer’s stock. According to Zacks, “In third-quarter 2018, <b>General Motors</b> reported ...",<b>General Motors</b> (<b>GM</b>) Raised to Buy at Zacks Investment Research,https://theenterpriseleader.com/2018/11/17/general-motors-gm-raised-to-buy-at-zacks-investment-research.html,theenterpriseleader.com,2018-11-18T00:00:00.0000000Z
8,<b>General Motors</b> has revealed that its Maven peer-to-peer <b>car</b>-sharing program will get non-<b>GM</b> vehicles from mid-2019. Maven launched in July and only allows owners and eligible lessees of <b>GM</b> vehicles made in 2015 or newer to make them available on the <b>car</b> ...,<b>GM</b>’s Maven <b>Car</b>-Sharing Fleet To Expand And Include Non-<b>GM</b> Models,https://www.carscoops.com/2018/11/gms-maven-car-sharing-fleet-expand-include-non-gm-models/,Carscoops,2018-11-17T21:57:00.0000000Z
9,It could result in sanctions under section 232 of the Trade Expansion Act if it&#39;s determined that <b>auto</b> imports pose a threat to national security. Ford and <b>GM</b> said the aluminum and steel tariffs alone will cost them each about $1 billion more just for the ...,"Hit hard by trade war, automakers hoping Trump will hold off on new round of tariffs",https://www.msn.com/en-us/finance/markets/hit-hard-by-trade-war-automakers-hoping-trump-will-hold-off-on-new-round-of-tariffs/ar-BBPOjRn,CNBC,2018-11-17T21:36:00.0000000Z
10,"So, when they got ready to present the <b>car</b> back to the museum, they brought her in and had her sign the part.” The museum sits across the street from a <b>GM</b> assembly plant. “The 1953s were assembled in Flint, Michigan,” Walker said. “Then they moved ...",Walker discusses history of Vettes,https://www.cleburnetimesreview.com/living/walker-discusses-history-of-vettes/article_2d61b048-e9e5-11e8-8afb-6bc39d81554d.html,Cleburne Times-Review,2018-11-17T16:33:00.0000000Z
11,"The company inked a deal with the city to cover up to $1,730 per <b>car</b>, per year. Lime plans to launch about 500 cars in Seattle. The company isn&#39;t alone in recognizing different needs in urban environments. <b>General Motors</b> launched its Maven mobility ...",Scooter renter Lime gets into the <b>car</b>-share business,https://www.thecarconnection.com/news/1119972_scooter-renter-lime-gets-into-the-car-share-business,The Car Connection,2018-11-17T11:01:00.0000000Z
12,"<b>GM</b> must trim costs amid the rising prices of raw materials and plateauing <b>car</b> sales. So on Oct. 31, <b>GM</b> CEO Mary Barra sent an email to all 50,000 salaried <b>GM</b> employees in North America saying the automaker is offering voluntary buyouts to the 17,700 ...","If you don&#39;t take the <b>GM</b> buyout, will your boss protect your job?",https://www.msn.com/en-us/finance/news/if-you-dont-take-the-gm-buyout-will-your-boss-protect-your-job/ar-BBPO1sR,Detroit Free Press,2018-11-17T12:36:00.0000000Z
13,"Our <b>car</b> is at times struggling with that, but it’s the same for everyone.” A big draw in terms of racing in China is the market size, and its importance to <b>GM</b>. Corvette has a lot of guests on site for the race, and will look to impress those trackside ...",Corvette begins learning experience at Shanghai,https://racer.com/2018/11/16/corvette-begins-learning-experience-at-shanghai/,Racer,2018-11-17T01:15:00.0000000Z
14,"<b>General Motors</b> (NYSE:<b>GM</b>) (TSE:GMM.U) last posted its earnings results on Wednesday, October 31st. The <b>auto</b> manufacturer reported $1.87 earnings per share (EPS) for the quarter, beating the Thomson Reuters’ consensus estimate of $1.25 by $0.62.",<b>General Motors</b> (<b>GM</b>) Cut to Hold at Zacks Investment Research,https://www.themarketsdaily.com/2018/11/16/general-motors-gm-cut-to-hold-at-zacks-investment-research.html,themarketsdaily.com,2018-11-17T00:30:00.0000000Z
15,"It worsened, as 59 investors sold <b>GM</b> shares while 314 reduced holdings ... The institutional investor held 8,245 shares of the <b>auto</b> manufacturing company at the end of 2018Q2, valued at $325,000, down from 950,270 at the end of the previous reported ...",<b>General</b> Mtrs Co (<b>GM</b>) Share Price Declined While Golub Group LLC Has Trimmed Its Position by $36.74 Million,http://reurope.com/2018/11/16/general-mtrs-co-gm-share-price-declined-while-golub-group-llc-has-trimmed-its-position-by-36-74-million/,reurope.com,2018-11-17T00:22:00.0000000Z
16,BMO Capital Markets currently has a $38.00 target price on the <b>auto</b> manufacturer’s stock. <b>GM</b> has been the topic of a number of other research reports. Morgan Stanley lifted their price target on shares of <b>General Motors</b> from $43.00 to $44.00 and gave the ...,<b>General Motors</b>’ (<b>GM</b>) “Hold” Rating Reiterated at BMO Capital Markets,https://www.dispatchtribunal.com/2018/11/16/general-motors-gm-hold-rating-reiterated-at-bmo-capital-markets.html,dispatchtribunal.com,2018-11-17T00:12:00.0000000Z
17,"However, with the U.S. economy cratered and <b>General Motors</b> and Chrysler struggling through government-managed bankruptcies, it was not a good year for finding a job, let alone in the <b>auto</b> industry. Yet within a few months, Tyler’s obvious talent helped ...","Interview: Tyler Moffett, Creative Designer, Chevrolet Trucks",http://www.trucktrend.com/features/1811-interview-tyler-moffett-creative-designer-chevrolet-trucks/,Truck Trend,2018-11-16T22:49:00.0000000Z
18,"Coming out of production hell, Tesla’s Model 3 is now the #1 selling <b>car</b> in the USA by revenue ... It’s probable that <b>GM</b> was hoping for more press for its announcement of the same day as ...","Tesla, <b>GM</b>, Yamaha, &amp; Ducati All On The Electric Bike Bandwagon",https://cleantechnica.com/2018/11/16/tesla-gm-yamaha-ducati-all-on-the-electric-bike-bandwagon/,CleanTechnica,2018-11-16T22:44:00.0000000Z
19,"Companies do seem to enjoy endowing all their machines with a corporate face. Elsewhere, our Associate Editor was quite excited to once more see the Monza name on a <b>GM</b> <b>car</b>. Described by the company as a sedan with a “youthful aesthetic,” the RS model ...","<b>GM</b> Brings Back Monza, CarryAll Names … in China",https://www.autoguide.com/auto-news/2018/11/gm-brings-back-monza-carryall-names-in-china.html,AutoGuide,2018-11-16T22:40:00.0000000Z
20,"The hope is that another unifying campaign could catch <b>GM</b>&#39;s eyes again. &quot;Is an SUV the answer? Is an electric <b>car</b> the answer? I know that we need something in addition to one small <b>car</b>,&quot; said Dave Green, president of UAW 1112. Two shifts have been ...",Lordstown urges <b>GM</b>: &#39;Nobody in this Valley wants a handout. We want work.&#39;,https://www.wkbn.com/news/local-news/lordstown-urges-gm-nobody-in-this-valley-wants-a-handout-we-want-work-/1602404254,WKBN 27 First News,2018-11-16T21:49:00.0000000Z
21,"The transaction relegated <b>GM</b> to Einhorn&#39;s second-largest holding, behind Brighthouse Financial Inc. (BHF). Shares of the Detroit-based <b>auto</b> manufacturer averaged $36.84 during the quarter.",David Einhorn&#39;s Top 4 Sells in 3rd Quarter,https://finance.yahoo.com/news/david-einhorns-top-4-sells-212036443.html,Yahoo Finance,2018-11-16T21:26:00.0000000Z
22,"And adventure requires some big and bulky equipment that a <b>car</b> just cannot accommodate ... a psychologist and consultant to Daimler Chrysler, Ford and <b>General Motors</b>, explaining instinctual reasons for buying called “reptiles.” Rapaille believes ...","Active lifestyles, fear and safety form consumers’ preference for SUVs",https://www.readingeagle.com/drivetime/article/active-lifestyles-fear-and-safety-form-consumers-preference-for--suvs,Reading Eagle Company,2018-11-16T19:43:00.0000000Z
23,The American automaker which is present in China through the SAIC-<b>GM</b> partnership said that the Monza &quot;has a dynamic design that inherits the brand’s sporty DNA and reflects the youthful aesthetic trend to cater to the preferences of younger <b>car</b> buyers.&quot;,The new Monza will be a mid-size sedan with an RS badge,https://www.topspeed.com/cars/car-news/chevy-is-bringing-back-the-monza-name-with-an-rs-badge-but-don-t-expect-to-get-one-outside-of-china-ar183436.html,Top Speed,2018-11-16T19:05:00.0000000Z
24,"The 12-acre dealership, with a 50,000-square-foot showroom and service center, had offered more than 200 new Buick and GMC cars, trucks and SUVs, which are being returned to <b>General Motors</b> or transferred ... likely to find the <b>car</b> they want online and ...",Harbor Buick GMC closing in Portage after sale of property,https://www.nwitimes.com/business/local/harbor-buick-gmc-closing-in-portage-after-sale-of-property/article_9d465277-d1d1-5ab1-a60f-beb871965946.html,The Times of Northwest Indiana,2018-11-16T19:00:00.0000000Z
25,Many <b>auto</b> manufacturers were developing high-horsepower four-passenger ... and each victory solidified it as the brand of choice amongst performance-minded consumers. Then <b>GM</b> pulled the plug on race programs in January 1963. Pontiac was forced to abandon ...,Refined &amp; Powerful: A 1966 Pontiac GTO For The Highway!,https://www.hotrod.com/articles/refined-powerful-1966-pontiac-gto/,Hot Rod,2018-11-16T18:53:00.0000000Z
26,Super Cruise which is a system of <b>General Motors</b> has a host of semi-autonomous technologies which allows the vehicle to consider its surroundings and drive on its own in the limited situation. The self-driving <b>car</b> Market segment is based on various ...,The Self-driving <b>Car</b> Market in North America: Analysis &amp; Outlook Through 2018-2024 - ResearchAndMarkets.com,https://www.bizjournals.com/businesswire/press_releases/2018/11/16/20181116005411,The Business Journals,2018-11-16T16:25:00.0000000Z
27,"Coupled with attending demolition derbies and local <b>car</b> shows with his dad growing up ... To channel the power a warmed-over <b>GM</b> 4L80E trans links to a custom driveshaft. Seeing that the truck’s vintage sheetmetal had seen better days, the cab and ...",This 1963 Chevy C10 Proves Second Time’s a Charm,https://www.hotrod.com/articles/1963-chevy-c10-second-times-a-charm/,Hot Rod,2018-11-16T16:21:00.0000000Z
28,"Since taking the helm in April, Diess has set about revamping the 12-<b>auto</b> brand behemoth to better meet future ... while Toyota Motor Corp. and <b>General Motors</b> Co. reported strong results. Diess said he hoped to have an outline agreement on Ford cooperation ...","VW to spend $50.2 billion on electric, autonomous vehicles by 2023",http://www.autonews.com/article/20181116/OEM05/181119791/volkswagen-spending-plans-for-electric-autonomous-vehicles,Automotive News,2018-11-16T14:58:00.0000000Z
29,"More education for EV owners relate to cold weather. As winter sets in, there’s lots of talk about EVs and cold weather. For this reason, we’ve ramped up our coverage of the topic as of late.",Cold Weather Electric <b>Car</b> Tips From <b>General Motors</b>,https://insideevs.com/gm-cold-weather-electric-car-tips/,Inside EVs,2018-11-16T14:56:00.0000000Z
30,SEE ALSO: The IMF just became the latest to warn about the $1.3 trillion &#39;leveraged loan&#39; market »,<b>GM</b> Financial Automobile Leasing Trust 2016-1 -- Moody&#39;s upgrades <b>GM</b> Financial <b>auto</b> lease ABS issued in 2016,https://markets.businessinsider.com/news/bonds/gm-financial-automobile-leasing-trust-2016-1-moody-s-upgrades-gm-financial-auto-lease-abs-issued-in-2016-1027734869,Markets Insider,2018-11-16T13:24:00.0000000Z
31,"Above: Two of the industry’s biggest heavyweights, VW and <b>GM</b>, have dialed up their bold claims surrounding electric <b>car</b> efforts (Image: Kinibiz) In a puzzling interview with VW’s Herbert ...",Big <b>Auto</b> Continues To Discount Tesla And Claim They’ll Take The Lead,https://insideevs.com/big-auto-dismisses-tesla/,Inside EVs,2018-11-16T12:56:00.0000000Z
32,"More importantly, the tech under the shell could find its way into the fuel-cell production <b>car</b> that <b>GM</b> promised to deliver by 2022. Until that happens, let’s see what this truck is all about. The Silverado ZH2 looks extreme as hell. It&#39;s like Chevrolet ...",2018 <b>GM</b> Defense Chevrolet Silverado ZH2 Concept,https://www.topspeed.com/cars/chevrolet/2018-gm-defense-chevrolet-silverado-zh2-concept-ar183373.html,Top Speed,2018-11-16T11:18:00.0000000Z
33,"Through its Cruise Automation subsidiary, <b>General Motors</b> has been testing its autonomous ... If there&#39;s skepticism on why traditional <b>auto</b> companies are chasing autonomous technology, Ford ...",Ford&#39;s blueprint to turn self-driving tech into profits,http://europe.autonews.com/article/20181115/COPY/311159848/fords-blueprint-to-turn-self-driving-tech-into-profits,Automotive News Europe,2018-11-16T09:43:00.0000000Z
34,"<b>GM</b>’s latest powertrain combination churns out maximum output ... new Malibu XL, Orlando and Traverse, at <b>Auto</b> Guangzhou 2018. Gasgoo not only offers timely news and profound insight about China <b>auto</b> industry, but also help with business connection ...",Chevrolet shows several new models at <b>Auto</b> Guangzhou 2018,http://autonews.gasgoo.com/auto_guangzhou_2018/70015379.html,Gasgoo,2018-11-16T07:26:00.0000000Z
35,"Here&#39;s how Ford Motor compares against its biggest U.S. rival, <b>General Motors</b> (<b>GM</b>), in terms of forward ... attesting to the pain that tariffs inflict on U.S. <b>auto</b> companies.",Ford Motor: 6.3% Yield And Dirt Cheap,https://seekingalpha.com/article/4222697-ford-motor-6_3-percent-yield-dirt-cheap,Seeking Alpha,2018-11-16T06:39:00.0000000Z
36,"The <b>GM</b> of former CEOs Jack Smith and Rick Wagoner tried to capitalize on growth in the traditional <b>auto</b> industry — the once-emerging markets of China, Eastern Europe and India — to drive the top line and deliver scale. Not Barra&#39;s <b>GM</b>: It&#39;s pushing ...","Howes: <b>GM</b> aims to drive transformation, promising risk, disruption",https://www.detroitnews.com/story/business/columnists/daniel-howes/2018/11/16/gm-drives-transformation-promising-risk-disruption/2014335002/,The Detroit News,2018-11-16T04:56:00.0000000Z
37,"Sales were mixed, and <b>GM</b> had made it known it was planning a successor to the Cavalier and the Pontiac Sunfire. There were fears the company planned to double its <b>car</b> production in Mexico. So, in fall 1998, Mahoning Valley leaders – including the ...",Campaign hopes to persuade <b>GM</b> to &#39;Drive It Home&#39; to Valley,https://www.vindy.com/news/2018/nov/15/campaign-hopes-persuade-gm-drive-it-home-valley/?nw,The Vindicator,2018-11-16T04:01:00.0000000Z
38,<b>General Motors</b> Co. and Sweden’s Volvo Cars export Chinese-made vehicles to the United States. China’s BYD <b>Auto</b> sells battery-powered buses to U.S. transit companies. Other Chinese brands have announced U.S. sales plans but have struggled to meet safety ...,Chinese automaker Zotye plans to sell vehicles in US in 2020,https://www.boston.com/cars/car-news/2018/11/15/chinese-automaker-zotye-plans-to-sell-vehicles-in-us-in-2020,Boston.com,2018-11-16T01:51:00.0000000Z
39,"The fund owned 622,223 shares of the <b>auto</b> manufacturer’s stock after buying an additional 34,600 shares during the period. Commonwealth Bank of Australia’s holdings in <b>General Motors</b> were worth $20,944,000 as of its most recent SEC filing. A number of ...",<b>General Motors</b> (<b>GM</b>) Shares Bought by Commonwealth Bank of Australia,https://www.dispatchtribunal.com/2018/11/15/general-motors-gm-shares-bought-by-commonwealth-bank-of-australia.html,dispatchtribunal.com,2018-11-16T00:06:00.0000000Z
40,Local leaders announced they are launching a “Drive It Home” campaign to urge <b>General Motors</b> “to support growing its investment ... will kick off the campaign with a news conference on Monday at the United <b>Auto</b> Workers Local 11112 Hall in Warren.,Valley leaders to launch “Drive It Home” campaign in support of <b>GM</b> plant,http://www.vindy.com/news/2018/nov/15/valley-leaders-launch-drive-it-home-campaign-suppo/,The Vindicator,2018-11-15T20:47:00.0000000Z
41,<b>GM</b>’s latest powertrain combination churns out maximum output ... with customized Michelin racing tires to provide powerful braking capability. The racing <b>car</b>’s body has a high-strength hydroformed aluminum frame with a lightweight aerodynamic package ...,Chevy FNR Carry All Concept Previews Shape Of Future Bowtie SUVs,https://www.motor1.com/news/276490/chevy-fnr-concept-china/,Motor1,2018-11-15T20:19:00.0000000Z
42,"Opinions expressed by Forbes Contributors are their own. Cars &amp; Bikes I cover the pervasive, yet little-understood <b>auto</b> industry. “We are in a year and a half going to get sort of what most of you think is a company that could be IPO’d with a couple ...","Maven, <b>GM</b>&#39;s <b>Car</b>-Sharing Service, Could Grow To A More Independent Future",https://www.forbes.com/sites/jimhenry/2018/11/15/maven-gms-car-sharing-service-could-grow-to-a-more-independent-future/,Forbes,2018-11-15T18:53:00.0000000Z
43,"Julia Steyn, vice president of Urban Mobility Programs at <b>GM</b>, wants the world to know what the <b>auto</b> maker is up to. She outlined what’s changing with <b>car</b> ownership and what <b>GM</b> is doing to stake its claim in ride sharing in a presentation at the Barclays ...",<b>GM</b> Says Ride Sharing is Going to Be Big. It Plans to Play Too.,https://www.barrons.com/articles/gm-says-ride-sharing-is-going-to-be-big-it-plans-to-play-too-1542310841,Barron&#39;s,2018-11-15T18:40:00.0000000Z
44,"The EV Drive Coalition, a broad coalition, including Tesla, <b>GM</b>, and Nissan, with a focused goal to reform ... giving consumers the freedom to decide which <b>car</b> they want in a free and fair market. Increased competition spurs more American innovation and ...","Tesla, <b>GM</b>, Nissan and Others Form Coalition To Reform EV Tax Credit",https://electriccarsreport.com/2018/11/tesla-gm-nissan-and-others-form-coalition-to-reform-ev-tax-credit/,electriccarsreport.com,2018-11-15T18:22:00.0000000Z
45,"The average <b>car</b> on American roads is 11 years old now. The average smartphone doesn’t live to be two and a half. Let’s say, just for the sake of discussion, that <b>GM</b> brings out a perfected electric <b>car</b> in the year 2025 and Ford doesn’t match it until ...","Why Smart Automakers Will Hold Off on EVs and Autonomy, For Now",https://www.roadandtrack.com/new-cars/car-technology/a25127208/why-smart-automakers-will-hold-off-on-evs-and-autonomy-for-now/,Road &amp; Track,2018-11-15T17:29:00.0000000Z
46,"The mother of a Grain Valley teenager who burned to death in a fiery <b>car</b> wreck in 2016 has filed a wrongful death lawsuit against <b>General Motors</b>, saying the <b>car</b> was defective. Anthony Dunlap was killed after the 2006 Chevrolet Impala he was driving hit a ...",Mother of Grain Valley teen who burned to death in 2016 <b>car</b> crash sues automaker <b>GM</b>,https://www.kansascity.com/news/local/article221706770.html,The Kansas City Star,2018-11-15T17:10:00.0000000Z
47,"while the 5.3 equipped with the new DFM technology uses an eight-speed <b>auto</b>, as will the four-cylinder when it becomes available. The 6.2-liter and forthcoming 3.0-liter turbo-diesel come with a 10-speed automatic that <b>GM</b> shares with Ford. A single-speed ...",The 2019 Chevrolet Silverado 1500: Number Two Tries Harder,https://www.yahoo.com/news/2019-chevrolet-silverado-1500-number-164000508.html,YAHOO!,2018-11-15T16:59:00.0000000Z
48,"For the 2018 Guangzhou <b>Auto</b> Show, Chevrolet prepared a wide and varied selection ... <b>general</b> director of Chevrolet at SAIC-<b>GM</b>. “Chevrolet is able to draw from <b>GM</b>’s global resources and long-standing industry experience to introduce the best products ...",Chevrolet FNR-CarryAll Concept Looks Like A Blazer With Six Seats,https://www.autoevolution.com/news/chevrolet-fnr-carryall-concept-looks-like-a-blazer-with-six-seats-130186.html,autoevolution,2018-11-15T16:25:00.0000000Z
49,"<b>GM</b> has added autobrake to a number of vehicles beyond the 2015 ... Once the system reaches near ubiquity on new cars, the benefits of these systems will be more readily recognized. <b>Auto</b> Tech: Stay up to date on all things technological in the automotive ...","<b>GM</b>&#39;s autobrake proves effective in reducing crashes, IIHS study finds",https://www.cnet.com/roadshow/news/gm-autobrake-effective-iihs-study/,CNET,2018-11-15T15:22:00.0000000Z
50,"Presented at the 2015 Shanghai <b>Auto</b> Show and imported in the United States from China ... Cadillac will continue to serve as the technological spearhead for Super Cruise and V2X within <b>General Motors</b>. In other words, it was wrong to combine a 2.0-liter ...",Cadillac Discontinues CT6 Plug-In From U.S. Lineup,https://www.autoevolution.com/news/cadillac-discontinues-ct6-plug-in-from-us-lineup-130174.html,autoevolution,2018-11-15T14:38:00.0000000Z
51,"The company’s October market share rang in at 7.1%, up from 6.6% last year. <b>General Motors</b> Co. (NYSE: <b>GM</b>) has left the EU market and had sales of just 222 units in October. <b>GM</b> stopped selling ...",European <b>Auto</b> Sales Decline Continued in October,https://247wallst.com/autos/2018/11/15/european-auto-sales-decline-continued-in-october/,24/7 Wall St.,2018-11-15T12:30:00.0000000Z
52,“The <b>Auto</b> Alliance (Alliance of Automobile Manufacturers ... many vehicles out of the fuel economy regulations entirely. <b>General Motors</b> came out recently with what it calls its National ...,Automakers agreed to emissions standards when they took bailout money. Now they’re reneging on the deal.,http://redgreenandblue.org/2018/11/15/automakers-agreed-emissions-standards-took-bailout-money-now-theyre-reneging-deal/,Red Green Blue,2018-11-15T11:27:00.0000000Z
