,description,headline,url,provider,date
0,"<b>Production</b> of the Chevrolet Cavalier was winding down and ... The cuts resulted in a huge financial windfall for GM and other American corporations. And yet, <b>General</b> <b>Motors</b> won’t commit to the future of the Lordstown assembly complex.",Has GM bailed on the Valley?,http://www.vindy.com/news/2018/nov/18/has-gm-bailed-on-the-valley/,The Vindicator,2018-11-18T05:59:00.0000000Z
1,"It also features, price, <b>production</b>, and revenue ... Key companies profiled in this report are ZF, Getrag, Eaton, Volkswagen, <b>General</b> <b>Motors</b>, Hyundai, Gord, Fiat Powertrain Technologies (FPT) and others. Purchase a copy of this report at: https ...","Global Automotive DCT Industry Sales, Revenue, Gross Margin, Market Share, by Regions (2013-2025)",http://www.emailwire.com/release/974434-Global-Automotive-DCT-Industry-Sales-Revenue-Gross-Margin-Market-Share-by-Regions-20132025.html,emailwire.com,2018-11-17T16:29:00.0000000Z
2,"It also features, price, <b>production</b>, and revenue ... Key companies profiled in this report are ZF, Getrag, Eaton, Volkswage, , <b>General</b> <b>Motors</b>, Hyundai, Gord ,Fiat Powertrain Technologies (FPT) and others. Purchase a copy of this report at: https ...","Global Automotive Dual Clutch Transmission System Market by Manufacturers, Types, Regions and Application Research Report",http://www.emailwire.com/release/974435--Global-Automotive-Dual-Clutch-Transmission-System-Market-by-Manufacturers-Types-Regions-and-Application-Research-Report.html,emailwire.com,2018-11-17T16:29:00.0000000Z
3,"<b>General</b> <b>Motors</b>, Nissan and Mitsubishi already are selling mass-market ... It is converting three of its German plants from internal combustion to battery car <b>production</b> as it pivots away from diesel vehicles in the wake of its emissions scandal.",VW wants to storm car market with cheaper electric model,https://www.washingtontimes.com/news/2018/nov/16/vw-wants-to-storm-car-market-with-mass-market-elec/,The Washington Times,2018-11-17T00:55:00.0000000Z
4,"Coming out of <b>production</b> hell, Tesla’s Model 3 is ... including engineers who had worked on the Bolt. The Director of <b>General</b> <b>Motors</b> Urban Mobility Solutions, Hannah Parish said: “As an ...","Tesla, GM, Yamaha, &amp; Ducati All On The Electric Bike Bandwagon",https://cleantechnica.com/2018/11/16/tesla-gm-yamaha-ducati-all-on-the-electric-bike-bandwagon/,CleanTechnica,2018-11-16T22:44:00.0000000Z
5,It&#39;s a group effort to urge <b>General</b> <b>Motors</b> and let them know Lordstown has been a great ... The &quot;Bring It Home&quot; campaign nearly 20 years ago convinced GM to start <b>production</b> of the Cobalt here. The hope is that another unifying campaign could catch GM&#39;s ...,Lordstown urges GM: &#39;Nobody in this Valley wants a handout. We want work.&#39;,https://www.wkbn.com/news/local-news/lordstown-urges-gm-nobody-in-this-valley-wants-a-handout-we-want-work-/1602404254,WKBN 27 First News,2018-11-16T21:49:00.0000000Z
6,"More than 80 concept, demonstrator and/or test-fleet fuel-cell-powered electric vehicles have been fielded by 25 automakers worldwide since <b>General</b> <b>Motors</b> (Detroit ... Accordingly, SGL has increased SIGRACET <b>production</b> at its Meitingen facility.",The markets: Fuels cells and batteries (2019),https://www.compositesworld.com/articles/the-markets-fuels-cells-and-batteries-2016,CompositesWorld,2018-11-16T21:20:00.0000000Z
7,"That&#39;s a departure from many major manufacturers in the region, like the <b>General</b> <b>Motors</b> and Ford plants ... t specify how many of the Tesla jobs are <b>production</b> positions. They said the plant ...",Tesla offers glimpse inside Buffalo gigafactory,https://buffalonews.com/2018/11/16/tesla-offers-glimpse-inside-gigafactory/,The Buffalo News,2018-11-16T20:29:00.0000000Z
8,"However, with increasing investments towards new energy vehicle <b>production</b> and favorable government policies ... in the report are Renault-Nissan Alliance, Mitsubishi <b>Motors</b> Corporation, <b>General</b> <b>Motors</b> Company, Toyota Motor Corporation, Ford Motor Company ...",Analysis of New Energy Vehicles Industry Policy in China’s Cities from the Perspective of Policy instruments,http://www.tampabayreview.com/news/business/analysis-new-energy-vehicles-industry-policy-chinas-cities-perspective-policy-instruments/58143/,tampabayreview.com,2018-11-16T18:54:00.0000000Z
9,"The move comes as Tesla and <b>General</b> <b>Motors</b> are lobbying government officials to extend ... but the current stream of Model 3s will come from the company’s sole <b>production</b> source: the Fremont, California plant. Musk noted in a Twitter post that ...",Tesla Promises Model 3 Delivery by Dec. 31 to Meet Tax Deadline,http://www.thedetroitbureau.com/2018/11/tesla-promises-model-3-delivery-by-dec-31-to-meet-tax-deadline/,TheDetroitBureau,2018-11-16T16:55:00.0000000Z
10,"German peers Daimler AG and BMW AG have cut their outlook, while Toyota Motor Corp. and <b>General</b> <b>Motors</b> Co. reported strong results ... need to sign off on the plan to create global <b>production</b> capacity for 1 million electric vehicles by 2025 amid their ...","VW to spend $50.2 billion on electric, autonomous vehicles by 2023",http://www.autonews.com/article/20181116/OEM05/181119791/volkswagen-spending-plans-for-electric-autonomous-vehicles,Automotive News,2018-11-16T14:58:00.0000000Z
11,"Developed by <b>General</b> <b>Motors</b>’ new military defense unit ... More importantly, the tech under the shell could find its way into the fuel-cell <b>production</b> car that GM promised to deliver by 2022. Until that happens, let’s see what this truck is all ...",2018 GM Defense Chevrolet Silverado ZH2 Concept,https://www.topspeed.com/cars/chevrolet/2018-gm-defense-chevrolet-silverado-zh2-concept-ar183373.html,Top Speed,2018-11-16T11:18:00.0000000Z
12,<b>General</b> <b>Motors</b> Co. said in its third quarter earnings report and ... to prepare the facility near the intersection of U.S. 24 and Interstate 69 at Roanoke for <b>production</b> of the next-generation pickup trucks. They also are built at the company’s plants ...,"2019 Silverado, Sierra sales exceed expectations",https://www.fwbusiness.com/news/latest/businessweekly/article_f4f04ea5-022b-50d4-90f3-e1094bb765d4.html,Fort Wayne Business Weekly,2018-11-16T05:14:00.0000000Z
13,"Twenty years ago, the <b>General</b> <b>Motors</b> Lordstown plant was in a similar situation to ... There were fears the company planned to double its car <b>production</b> in Mexico. So, in fall 1998, Mahoning Valley leaders – including the Youngstown/Warren Regional ...",Campaign hopes to persuade GM to &#39;Drive It Home&#39; to Valley,http://www.vindy.com/news/2018/nov/15/campaign-hopes-persuade-gm-drive-it-home-valley/?nw,The Vindicator,2018-11-16T04:01:00.0000000Z
14,TurboSquid introduced the CheckMate standard in 2011 to improve quality across all <b>production</b> pipelines ... turbosquid-is-now-an-official-<b>general</b>-<b>motors</b>-licensee-300751716.html,TurboSquid is now an official <b>General</b> <b>Motors</b> licensee,https://finance.yahoo.com/news/turbosquid-now-official-general-motors-222200530.html,Yahoo Finance,2018-11-15T22:27:00.0000000Z
15,"with <b>production</b>, price, revenue (value) and market share for each manufacturer; the top players including Renault, PSA Group, Ford, Volkswagen, Fiat Chrysler Automobiles (FCA),Other prominent vendors: Daimler, Toyota, JAC , PACCAR , <b>General</b> <b>Motors</b> ...","Light Commercial Vehicle Market Key Vendors, Topographical Regions, and Industry Segments",https://realzima.com/light-commercial-vehicle-market-key-vendors-topographical-regions-and-industry-segments/,realzima.com,2018-11-15T21:43:00.0000000Z
16,"Musk spotlighted 50 new “<b>production</b>” cars in a crowded livestreamed event ... One way to boost sales: Tesla has joined <b>General</b> <b>Motors</b> and Nissan to lobby Congress for an extension of the $7,500 federal tax credit on electric-car purchases, which ...",How Elon Musk might make $920 million in Tesla debt go away,http://www.latimes.com/business/autos/la-fi-hy-tesla-convertible-bonds-20181115-story.html,Los Angeles Times,2018-11-15T21:00:00.0000000Z
17,"However, with increasing investments towards new energy vehicle <b>production</b> and favorable government policies ... in the report are Renault-Nissan Alliance, Mitsubishi <b>Motors</b> Corporation, <b>General</b> <b>Motors</b> Company, Toyota Motor Corporation, Ford Motor Company ...",New Energy Vehicles Market Report Just Published By Credence Research,http://www.tampabayreview.com/news/business/new-energy-vehicles-market-report-just-published-credence-research/58074/,tampabayreview.com,2018-11-15T19:27:00.0000000Z
18,"<b>General</b> <b>Motors</b> said it was increasing <b>production</b> of its Bolt electric car by 20 percent to meet global demand. Sales of the Bolt are up more than 15 percent this year, though the majority of sales ...",Go green or make green: Carmakers know SUVs still vastly outsell electric and hybrid cars,https://abcnews.go.com/Business/green-make-green-carmakers-suvs-vastly-outsell-electric/story?id=59215445,ABC News,2018-11-15T16:42:00.0000000Z
19,"In this segmentation, SUVs will have an upper hand due to increasing demand and <b>production</b> is estimated in the forecast ... Toyota Corporation, <b>General</b> <b>Motors</b> Company, HIAB, Zero, Fiat Chrysler, Says Group, Pal finger, Magna International, Plastic Omnia ...",Automotive Liftgate Market Expected to Deliver Dynamic Progression Until 2028,http://www.sbwire.com/press-releases/automotive-liftgate-market-expected-to-deliver-dynamic-progression-until-2028-1080495.htm,SBWire,2018-11-15T12:16:00.0000000Z
20,About 20 percent of the total TARP funds — $80 billion — went to bail out <b>General</b> <b>Motors</b> and Chrysler ... then go through a structured bankruptcy process and quickly return to <b>production</b>. Chrysler emerged as a newly merged company with Italian-based ...,"What did America buy with the auto bailout, and was it worth it?",http://www.keranews.org/post/what-did-america-buy-auto-bailout-and-was-it-worth-it,KERA News,2018-11-14T16:43:00.0000000Z
21,"The F-150 also prepares to go hybrid for the 2020 model year, with <b>production</b> scheduled to start in the latter ... hybrid system on the 1500 for the 2019 model year. So how does <b>General</b> <b>Motors</b> plan to counter the Ford Motor Company and Fiat Chrysler ...","<b>General</b> <b>Motors</b> Not Interested In Autonomous, Electric Pickup Trucks",https://www.autoevolution.com/news/general-motors-not-interested-in-autonomous-electric-pickup-trucks-130094.html,autoevolution,2018-11-12T16:07:00.0000000Z
22,"<b>General Motors Corporation</b> pays its employees an average of $82,341 a year. Salaries at <b>General Motors Corporation</b> range from an average of $56,789 to $119,596 a year. <b>General Motors Corporation</b> employees with the job title Vice President (VP ...",Average <b>General Motors Corporation</b> Salary,https://www.payscale.com/research/IN/Employer=General_Motors_Corporation/Salary,PayScale,2018-11-11T00:00:00.0000000Z
23,"This is a digitized version of an article from The Times’s print archive, before the start of online publication in 1996. To preserve these articles as they originally appeared, The Times does not alter, edit or update them. Occasionally the digitization ...",CHRYSLER PACES U.S. AUTO OUTPUT; Ford and <b>General Motors Production</b> Off Peak,https://www.nytimes.com/1964/11/10/archives/chrysler-paces-us-auto-output-ford-and-general-motors-production.html,The New York Times,2018-11-10T05:00:00.0000000Z
24,"Thanks. Mary Teresa Barra - <b>General</b> <b>Motors</b> Co. Adam, thanks for the recognition on the Chevrolet Bolt EV. We have announced that we are increasing capacity there. We&#39;ve been opportunistic as to what markets we are allowing the current <b>production</b> to go to ...",<b>General</b> <b>Motors</b>: Sell,https://seekingalpha.com/article/4220428-general-motors-sell,Seeking Alpha,2018-11-09T17:12:00.0000000Z
25,"<b>General</b> <b>Motors</b> went bankrupt in 2009 ... This is quite in line with the company’s policy regarding closing its regional branches. Meanwhile, car <b>production</b> was lowered by 14.70% compared to last year, but GM succeeded thanks to the price increase ...",Time to Focus on <b>General</b> <b>Motors</b>,https://hacked.com/time-to-focus-on-general-motors/,Hacked,2018-11-07T17:11:00.0000000Z
26,"The typical <b>General Motors Production</b> Supervisor salary is $75,398. <b>Production</b> Supervisor salaries at <b>General</b> <b>Motors</b> can range from $61,874 - $88,318. This estimate is based upon 26 <b>General Motors Production</b> Supervisor salary report(s) provided by ...",<b>General Motors Production Supervisor Salaries</b>,"https://www.glassdoor.com/Salary/General-Motors-Production-Supervisor-Salaries-E279_D_KO15,36.htm",Glassdoor,2018-11-06T00:00:00.0000000Z
27,"Automotive News reports that managing two generations of full-size pickup trucks isn’t easy for <b>General</b> <b>Motors</b>. The <b>production</b> hub is in Fort Wayne, Indiana, and additional capacity comes from Flint, Michigan. At the same time, the company is gearing up ...","<b>General</b> <b>Motors</b> To Continue Making Old Silverado, Sierra Well Into 2019",https://www.autoevolution.com/news/general-motors-to-continue-making-old-silverado-sierra-well-into-2019-129907.html,autoevolution,2018-11-05T13:12:00.0000000Z
28,<b>General</b> <b>Motors</b> was working with Canada&#39;s BionX last year to design and manufacture a mid-drive system for a folding e-bike. A purchase agreement fell apart when BionX projected higher-than-expected <b>production</b> costs. BionX filed for receivership in ...,<b>General</b> <b>Motors</b> to enter e-bike market,https://www.bicycleretailer.com/industry-news/2018/11/02/general-motors-enter-e-bike-market,Bicycle Retailer and Industry News,2018-11-02T17:30:00.0000000Z
29,"Chennai: It is well-known that American automotive giant <b>General</b> <b>Motors</b> (GM) stopped its retail business in India in May last year. However, the firm has refrained from being silent and instead has used its base in the country to undertake… Continue Reading",<b>general motors production</b> in india newstoday,https://newstodaynet.com/index.php/tag/general-motors-production-in-india-newstoday/,The News Today,2018-10-04T09:04:00.0000000Z
30,"<b>General</b> <b>Motors</b> generated a significant amount of cash during its ... (which includes large SUVs such as the Suburban and Tahoe), competitors are increasing <b>production</b> capacity - in both full-size pickup trucks and large SUVs. Ram announced their new ...","<b>General</b> <b>Motors</b>: Missed Guidance, Cash Flow Deterioration, Unusual Items &amp; Increasing Competition Require Heightened Due Diligence",https://seekingalpha.com/article/4198475-general-motors-missed-guidance-cash-flow-deterioration-unusual-items-and-increasing,Seeking Alpha,2018-10-04T01:53:00.0000000Z
31,"It is said that JSW energy wants to acquire the GM plant for the <b>production</b> of its EV and launch the zero-emissions vehicle at INR 10-15 lakh. Currently, <b>General</b> <b>Motors</b> uses the Pune facility for the manufacturing of the export-spec Chevrolet Beat ...",JSW Energy eyeing GM’s Pune plant for <b>production</b> of its electric car - Report,https://indianautosblog.com/2018/09/jsw-energy-general-motors-pune-314630,Indian Autos blog,2018-09-26T05:05:00.0000000Z
32,"No, no, says Dave Bolognino, who heads up <b>General</b> <b>Motors</b>’ design fabrication division ... Detroit giant are thinking about ways they can fold the process into actual <b>production</b> vehicles, the kind real people drive around every day.","GM&#39;s 3-D-Printed Seat Bracket Heralds a Future of Cheaper, Better Cars",https://www.wired.com/story/general-motors-auto-industry-3d-printing-additive-manufacturing/,Wired,2018-08-24T02:25:00.0000000Z
33,"<b>General</b> <b>Motors</b> Company (GM - Free Report) has made the announcement to increase the <b>production</b> of Chevrolet Bolt EV by 20% in fourth-quarter 2018, per Autoblog. The growing demand for this auto giant’s electric compact crossover has prompted it to gear ...",<b>General</b> <b>Motors</b> (GM) to Ramp Up Chevrolet Bolt EV <b>Production</b>,https://www.zacks.com/stock/news/310538/general-motors-gm-to-ramp-up-chevrolet-bolt-ev-production,Zacks Investment Research,2018-07-06T14:23:00.0000000Z
34,"<b>General</b> <b>Motors</b> Company GM has made the announcement to increase the <b>production</b> of Chevrolet Bolt EV by 20% in fourth-quarter 2018, per Autoblog. The growing demand for this auto giant&#39;s electric compact crossover has prompted it to gear up <b>production</b>.",<b>General</b> <b>Motors</b> (GM) to Ramp Up Chevrolet Bolt EV <b>Production</b>,https://www.nasdaq.com/article/general-motors-gm-to-ramp-up-chevrolet-bolt-ev-production-cm987962,Nasdaq,2018-07-06T09:33:00.0000000Z
35,"<b>General</b> <b>Motors</b> Company GM has made the announcement to increase the <b>production</b> of Chevrolet Bolt EV by 20% in fourth-quarter 2018, per Autoblog. The growing demand for this auto giant’s electric compact crossover has prompted it to gear up <b>production</b>.",<b>General</b> <b>Motors</b> (GM) to Ramp Up Chevrolet Bolt EV <b>Production</b>,https://sg.finance.yahoo.com/news/general-motors-gm-ramp-chevrolet-133301133.html,Yahoo Singapore Finance,2018-07-06T00:00:00.0000000Z
36,"Photo by Michael Wayland/Automotive News Though, in collaboration with Autodesk, <b>General</b> <b>Motors</b> is also applying 3D printing to produce lighter electric vehicles, these headline figures are generated by the <b>production</b> of tools to be used on the assembly line.","<b>General</b> <b>Motors</b> saves $300,000 by switching to 3D printed tooling",https://3dprintingindustry.com/news/general-motors-saves-300000-by-switching-to-3d-printed-tooling-134991/,3D Printing Industry,2018-06-21T13:47:00.0000000Z
37,"Last week, in Eaton Rapids, Michigan, a fire and explosion forced an evacuation of a Meridian Magnesium Products of America plant. The end of the resulting <b>production</b> shutdown has no ETA, and with Ford&#39;s reliance on Meridian for lightweight structural ...","Ford <b>Production</b> Ills Infect Fiat-Chrysler, <b>General</b> <b>Motors</b>",http://www.thedrive.com/news/20800/ford-production-ills-infect-fiat-chrysler-general-motors,The Drive,2018-05-12T12:23:00.0000000Z
38,"<b>General</b> <b>Motors</b> has halted <b>production</b> of its full-size van line in Wentzville after a major fire at a supplier in Eaton Rapids, Michigan, on May 2. A GM spokesman told NBC News that the shutdown is &quot;temporary.&quot; Ford Motor Co. halted <b>production</b> at Kansas ...",<b>General</b> <b>Motors</b> halts van <b>production</b> in Wentzville,https://www.bizjournals.com/stlouis/news/2018/05/10/general-motors-halts-van-production-in-wentzville.html,The Business Journals,2018-05-10T12:08:00.0000000Z
39,"<b>General</b> <b>Motors</b> has been pouring investment into autonomous vehicles, helped by the Cruise Automation start-up, which it absorbed in 2016. Cruise Automation operates modified Chevy Bolt EVs, renamed the Cruise AV, which it hopes will be the subject of an ...",<b>General</b> <b>Motors</b>: Autonomous Vehicle <b>Production</b> Begins Next Year,http://www.thedrive.com/news/19331/general-motors-autonomous-vehicle-production-begins-next-year,The Drive,2018-03-18T15:01:00.0000000Z
40,"<b>General</b> <b>Motors</b> has announced a $100 million investment to upgrade two manufacturing facilities in Michigan, a move that strengthens the company’s ongoing commitment to automated driving. The announcement comes on the heels of Chief Executive Officer Mary ...",<b>General</b> <b>Motors</b> Invests $100 Million Toward Autonomous Vehicle <b>Production</b>,https://www.automoblog.net/2018/03/15/general-motors-invests-100-million-toward-autonomous-vehicle-production/,Automoblog.net,2018-03-15T21:38:00.0000000Z
41,"GM has built test vehicles for autonomous driving for more than a year. It also has been testing autonomous vehicles (AV) in tough urban environments, such as downtown San Francisco. Now it&#39;s taking the &quot;next step&quot; toward the self-driving future, GM ...",<b>General</b> <b>Motors</b> Will Make &#39;<b>Production</b>-Ready&#39; Self-Driving Cruise AV In Michigan,https://www.investors.com/news/general-motors-will-make-production-ready-self-driving-cruise-av-in-michigan/,Investor&#39;s Business Daily,2018-03-15T17:45:00.0000000Z
42,<b>General</b> <b>Motors</b> to pay up to $6.29 million for Arizona consumers <b>General</b> <b>Motors</b> plans to boost Chevy Bolt EV <b>production</b> at Orion Assembly &quot;Kim brings to the job a strong set of leadership and organizational skills that will help lead our ongoing efforts to ...,<b>General</b> <b>Motors</b> names Kimberly Brycz as new head of global human resources,https://www.freep.com/story/money/cars/general-motors/2018/03/13/general-motors-kimberly-brycz/419622002/,Detroit Free Press,2018-03-13T16:17:00.0000000Z
43,Latest News Industries Personal Finance,Why Does <b>General</b> <b>Motors</b> Want to Boost <b>Production</b> of the Chevy Bolt?,https://nz.finance.yahoo.com/news/why-does-general-motors-want-160500849.html,Yahoo New Zealand,2018-03-09T19:18:00.0000000Z
44,"People really seem to like the Chevrolet Bolt. They like it so much that GM is expanding <b>production</b> of the little electric hatchback at its Orion Assembly Plant in Michigan to meet global demand. When the Bolt launched, it did so in the shadow of the Tesla ...","<b>General</b> <b>Motors</b> to increase Bolt <b>production</b> in Michigan, says CEO Barra",https://www.cnet.com/roadshow/news/chevrolet-bolt-gm-production-increase/,CNET,2018-03-09T01:48:00.0000000Z
45,"<b>General</b> <b>Motors</b> Company GM announced that it would increase the <b>production</b> of Chevrolet Bolt electric vehicle (EV) to meet growing demand, per Reuters. Additionally, the carmaker asked the U.S. Congress to rethink about the expansion of the tax credit for EV.",<b>General</b> <b>Motors</b> to Hike EV Bolt <b>Production</b> to Meet Demand,https://uk.finance.yahoo.com/news/general-motors-hike-ev-bolt-142002817.html,Yahoo Finance UK and Ireland,2018-03-09T00:00:00.0000000Z
46,"<b>General</b> <b>Motors</b> Company (NYSE:GM) announced that it would increase the <b>production</b> of Chevrolet Bolt electric vehicle (EV) to meet growing demand, per Reuters. Additionally, the carmaker asked the U.S. Congress to rethink about the expansion of the tax ...",<b>General</b> <b>Motors</b> To Hike EV Bolt <b>Production</b> To Meet Demand,https://www.investing.com/analysis/general-motors-to-hike-ev-bolt-production-to-meet-demand-200296888,Investing.com,2018-03-08T21:20:00.0000000Z
47,"<b>General</b> <b>Motors</b> (NYSE:GM) CEO Mary Barra said the company will boost its <b>production</b> of the battery-electric Chevrolet Bolt EV to keep pace with rising global demand. Clearly, GM thinks it can sell considerably more Bolts than it&#39;s making right now.",Why Does <b>General</b> <b>Motors</b> Want to Boost <b>Production</b> of the Chevy Bolt?,https://www.fool.com/investing/2018/03/08/why-does-general-motors-want-to-boost-production-o.aspx,The Motley Fool,2018-03-08T16:05:00.0000000Z
48,"<b>General</b> <b>Motors</b> (NYSE: GM) CEO Mary Barra said the company will boost its <b>production</b> of the battery-electric Chevrolet Bolt EV to keep pace with rising global demand. Clearly, GM thinks it can sell considerably more Bolts than it&#39;s making right now.",Why Does <b>General</b> <b>Motors</b> Want to Boost <b>Production</b> of the Chevy Bolt?,https://sg.finance.yahoo.com/news/why-does-general-motors-want-160500849.html,Yahoo Singapore Finance,2018-03-08T00:00:00.0000000Z
49,The decision made by <b>General</b> <b>Motors</b> to cease vehicle <b>production</b> in Australia at the end of last year meant that US car enthusiasts sadly lost the Chevrolet SS and car nuts in Australia lost the Holden Commodore as they knew it. It also meant the ...,<b>Shuttered General Motors plant targeted</b> for EV <b>production</b>,https://www.cnet.com/roadshow/news/shuttered-general-motors-plant-targeted-for-ev-production/,CNET,2018-01-22T16:39:00.0000000Z
50,"Just as 1908 marked the end of the horse and buggy era with the introduction of the Ford Model T, 2018 may well be remembered as the end of the automotive era, as <b>General</b> <b>Motors</b> begins mass-<b>production</b> of a driverless car without steering wheels or pedals.",Driverless Cars: <b>General</b> <b>Motors</b> Ditches Steering Wheel and Pedals for New Car,https://www.newsweek.com/driverless-cars-general-motors-ditches-steering-wheel-and-pedals-new-car-779346,Newsweek,2018-01-12T12:24:00.0000000Z
51,<b>General</b> <b>Motors</b> has filed a safety petition with the Department of Transportation for its self-driving Cruise AV. The automaker calls it the first “<b>production</b>-ready vehicle build from the start to operate safely on its own.”,<b>General Motors unveils production-ready vehicle</b> with no steering wheel or pedals,https://www.clickondetroit.com/news/general-motors-unveils-production-ready-vehicle-with-no-steering-wheel-or-pedals,clickondetroit.com,2018-01-12T07:54:00.0000000Z
