,description,headline,url,provider,date
0,"Therefore let’s take a look at these six hassle-free, yet sufficiently premium cars from the used <b>car</b> market. The Corolla is the best selling <b>Toyota</b> product till date, thanks to its refined petrol engine along with a comfortable and feature-laden cabin.","Honda Civic to <b>Toyota</b> Corolla: 6 hassle-free, used luxury cars at the price of a Renault Kwid",https://www.cartoq.com/honda-civic-to-toyota-corolla-6-hassle-free-used-luxury-cars-at-the-price-of-a-renault-kwid/,cartoq.com,2018-11-18T05:16:00.0000000Z
1,"DETROIT — Ford, <b>Toyota</b>, General Motors and Nissan received strong ratings in the Rainbow PUSH Coalition&#39;s 2018 <b>Automotive</b> Diversity Scorecard released this month. The coalition also praised Hyundai, which has vaulted to No. 4 in the industry in minority ...","Ford, <b>Toyota</b> recognized for commitment to diversity",http://www.autonews.com/article/20181118/RETAIL07/181119752/ford-toyota-rainbow-push-diversity,Automotive News,2018-11-18T05:06:00.0000000Z
2,Both cars get <b>Toyota</b>&#39;s 3.5-liter V6 engine ... Lamborghini&#39;s racing arm builds wild one-off to combat Ferrari Monza The SC18 was developed with input from the <b>car</b>&#39;s owner and they apparently wanted a Grigio Daytona grey exterior with red accents.,<b>Toyota</b> Camry and Avalon get the TRD treatment,http://cybersecuritycaucus.com/2018/11/toyota-camry-and-avalon-get-the-trd-treatment/,cybersecuritycaucus.com,2018-11-18T01:23:00.0000000Z
3,"<b>Toyota</b> says the TRD engineers have developed the dynamic characteristics ... against Max Verstappen next year Lewis Hamilton names this year&#39;s Mercedes as the <b>auto</b> he has enjoyed driving the most, as it has allowed him to extract extra performance from ...",<b>Toyota</b> Camry and Avalon TRDs are enthusiast-focused Toyotas,http://precisionresearchandconsulting.com/2018/11/toyota-camry-and-avalon-trds-are-enthusiast-focused-toyotas/,precisionresearchandconsulting.com,2018-11-17T23:09:00.0000000Z
4,Their latest attempt involves <b>Toyota</b> Racing Development (TRD) to work their magic on these two sedans. The end result is the Camry and Avalon TRD which will be showing up at the LA <b>Auto</b> Show in a couple of weeks. The changes begin under the skin as TRD ...,2020 <b>Toyota</b> Avalon and Camry TRD Hope To Kiss Boring Good-Bye,https://www.cheersandgears.com/articles/auto-show-news/la-auto-show/2020-toyota-avalon-and-camry-trd-hope-to-kiss-boring-good-bye-r5395/,cheersandgears.com,2018-11-17T21:43:00.0000000Z
5,"Like every automaker that’s worth its salt, <b>Toyota</b>’s bottom line is the most important thing the company has to take care of. And, with the U.S. <b>car</b> market experiencing a shift in demand the likes of which we haven’t seen in a long time, the Japanese ...",Here Are the Cars <b>Toyota</b> Might Kill Off,https://www.topspeed.com/cars/car-news/here-are-the-cars-toyota-might-kill-off-ar183366.html,Top Speed,2018-11-17T17:15:00.0000000Z
6,The no7 <b>Toyota</b> Gazoo Racing TS050 Hybrid will start the 6 Hours of ... RSR of Kevin Estre and Michael Christensen in fourth spot and four tenths behind the pole <b>car</b>. The no51 AF Corse Ferrari of reigning world champions James Calado and Alessandro Pier ...,WEC Shanghai: <b>Toyota</b> claim front row lockout,https://www.grandprix247.com/2018/11/17/wec-shanghai-toyota-claim-front-row-lockout/,grandprix247,2018-11-17T15:46:00.0000000Z
7,FAIRFIELD — Six of the seven Momentum <b>Auto</b> Group dealerships in Fairfield were closed this week in what has been suggested to be a prelude to a possible sale. A sales representative at the <b>Toyota</b> dealership confirmed in the late morning Friday it was ...,6 of 7 Momentum <b>Auto</b> Group dealerships shut down in Fairfield,https://www.dailyrepublic.com/all-dr-news/solano-news/fairfield/6-of-7-momentum-auto-group-dealerships-shut-down-in-fairfield/comment-page-1/,Daily Republic,2018-11-17T13:58:00.0000000Z
8,"Most notably, the 2019 Corolla Hatchback that was introduced earlier this year at the New York <b>Auto</b> Show already rides on TNGA. TNGA gives the Corolla more agility in addition to what <b>Toyota</b> says is the sedan&#39;s quietest and smoothest ride to date.","More power, style for compact sedan — <b>Toyota</b> Corolla unveiled",http://techkenyot.com/2018/11/16/more-power-style-for-compact-sedan-toyota-corolla-unveiled/,techkenyot.com,2018-11-17T13:41:00.0000000Z
9,"With its potential points haul, <b>Toyota</b> is also looking good to secure the Manufacturers ... Unlike his teammate, Latvala only took one spare wheel, preferring the balance of the <b>car</b> with less weight, but the Finn regretted the decision when his tires ...",Tanak leads Rally Australia; Ogier closing on title,https://racer.com/2018/11/17/tanak-leads-rally-australia-ogier-closing-on-title/,Racer,2018-11-17T13:18:00.0000000Z
10,"Here&#39;s how I voted for <b>car</b>, truck and utility of the year How I voted for NACTOY finalists, and why the <b>Toyota</b> RAV4, Nissan Altima, VW Jetta, Hyundai Kona, Volvo S60, Jeep Wrangler and Jag I-Pace made cut. Check out this story on Freep.com: https://www ...","Here&#39;s how I voted for <b>car</b>, truck and utility of the year",https://www.freep.com/story/money/cars/mark-phelan/2018/11/17/nactoy-finalists-vote/2008865002/,Detroit Free Press,2018-11-17T12:51:00.0000000Z
11,<b>Toyota</b> Motorsport GmbH technical director Pascal Vasselon told Motorsport.com: &quot;It was always in the plan to do three runs with three new sets of tyres with each <b>car</b>. &quot;We knew we had to because it ...,<b>Toyota</b> needed extra runs to counter privateer threat,https://sports.yahoo.com/toyota-needed-extra-runs-counter-122640942.html,Yahoo Sports,2018-11-17T12:45:00.0000000Z
12,"A TRD-badged shift knob completes the look. 2020 <b>Toyota</b> Avalon TRD The Avalon TRD and Camry TRD go on sale in fall 2019. Before that, the vehicles will debut at the L.A. <b>Auto</b> Show.",<b>Toyota</b> Introduces Avalon and Camry TRD,http://internetdo.com/technology/toyota-introduces-avalon-and-camry-trd.html,internetdo.com,2018-11-17T11:33:00.0000000Z
13,"(Nov. 16, 2018)-- Today in Huntsville, the first shovel of dirt was turned on what will become a jointly owned-and-operated <b>automotive</b> production plant that will have the capacity to build 300,000 vehicles a year, beginning in 2021. Mazda <b>Toyota</b> ...",Mazda <b>Toyota</b> Plant Paving the Way for Groundbreaking Future,http://www.pressreleasepoint.com/mazda-toyota-plant-paving-way-groundbreaking-future,KLAS Press Release,2018-11-17T10:16:00.0000000Z
14,<b>Toyota</b> Gazoo Racing locked out the front row ... 1:42.931 while the FIA World Endurance Championship-leading No. 8 <b>car</b> of Fernando Alonso and Kazuki Nakajima followed 0.228 seconds behind.,<b>Toyota</b> Resists Rebellion to Take 6H Shanghai Pole,https://sportscar365.com/lemans/wec/toyota-resists-rebellion-to-take-6h-shanghai-pole/,Sportscar365,2018-11-17T07:12:00.0000000Z
15,<b>Toyota</b> says the new interior has an &quot;elevated feeling of quality ... The initial line up will present the <b>auto</b> in Sporty and Prestige forms.,<b>Toyota</b> Corolla sedan gets a bold new look in its 12th generation,http://nhltradereport.com/2018/11/17/toyota-corolla-sedan-gets-a-bold-new-look-in-its-12th.html,NHL Trade Report,2018-11-17T06:09:00.0000000Z
16,"The latest Corolla sedan, <b>Toyota</b> says, draws from the same DNA as the new Corolla hatchback revealed this year. The new chassis dictates a multi-link rear suspension in place of last year&#39;s simpler twist-beam unit, which should provide the Corolla sedan ...",<b>Toyota</b> to start mass production of its new hybrid <b>auto</b> in Turkey,http://booktour.tips/2018/11/toyota-to-start-mass-production-of-its-new-hybrid-auto-in/,booktour.tips,2018-11-17T05:12:00.0000000Z
17,"For the first time in the United States, the Corolla will be offered in hybrid for more fuel efficiency to its list of accolades that will be revealed at the LA <b>Auto</b> Show on November 28. The 12th-generation <b>Toyota</b> Corolla made its arrival in two chapters ...",New <b>Toyota</b> Corolla with More Tech than Before,https://www.autoconnectedcar.com/2018/11/new-toyota-corolla-closer-to/,autoconnectedcar.com,2018-11-17T00:08:00.0000000Z
18,"When we last tested a <b>Toyota</b> Corolla, we found it slow and outdated. It wasn’t a bad <b>car</b>, though. Just badly in need of a redesign. Well, the long-awaited redesign is finally here, and we have to say, we like what we see. If you’re interested in the ...","2020 <b>Toyota</b> Corolla Sedan is Lower, Broader, and Wider",https://www.automobilemag.com/news/2020-toyota-corolla-sedan-is-lower-broader-and-wider/,Automobile,2018-11-17T03:10:00.0000000Z
19,<b>Toyota</b>’s reputation for durability and strong resale value ... Denis Flierl has invested over 25 years in the <b>automotive</b> industry in a variety of roles. Follow his work on Twitter: @CarReviewGuy,2018 <b>Toyota</b> Tacoma Limited Review: Not Too Shabby,https://www.automoblog.net/2018/11/16/2018-toyota-tacoma-limited-review/,Automoblog.net,2018-11-17T01:59:00.0000000Z
20,"Instead, owners of mass market cars such as the Honda Accord and <b>Toyota</b> Prius are opening their wallets for the ... which has struggled with production issues and self-inflicted controversies. The <b>car</b> is particularly popular with younger buyers, and ...",Tesla&#39;s Model 3 sedan is pulling in buyers who previously owned Accords and Priuses,http://www.latimes.com/business/la-fi-tesla-buyers-stretch-20181116-story.html,Los Angeles Times,2018-11-17T01:00:00.0000000Z
21,"Proving that <b>Toyota</b> executives are committed to injecting their <b>automotive</b> appliances with a vitality that goes beyond dependability, America’s favorite Japanese automaker unveiled the 2020 <b>Toyota</b> Corolla sedan Thursday. Like the five-door 2019 Corolla ...",<b>Toyota</b> adds style to 2020 Corolla,https://www.bendbulletin.com/home/6692075-151/toyota-adds-style-to-2020-corolla,The Bulletin,2018-11-17T00:40:00.0000000Z
22,"<b>Toyota</b>&#39;s Jari-Matti Latvala claimed the lead ... The Hyundai i20 flicked into a bank but the Belgian steered his <b>car</b> out of trouble, although he appeared to suffer a related problem on the ...",Latvala now leads Tanak in <b>Toyota</b> one-two,https://asia.eurosport.com/wrc/latvala-now-leads-tanak-in-toyota-one-two_sto7015071/story.shtml,Eurosport Asia,2018-11-17T00:29:00.0000000Z
23,"Have any query about this report, ask our expert @ https://www.infiniumglobalresearch.com/reports/enquiry/1076 The major key players in <b>Automotive</b> Air Filters Market are Sogefi SpA, <b>TOYOTA</b> BOSHOKU CORPORATION, Valeo, ROKI Co. Ltd, MANN+HUMMEL, MAHLE GmbH ...","<b>Automotive</b> Air Filters Market - Current Competitive Analysis 2024 : Sogefi SpA, Valeo, ROKI Co. Ltd, MANN+HUMMEL, MAHLE GmbH, Lydall, Cummins",http://www.sbwire.com/press-releases/automotive-air-filters-market-current-competitive-analysis-2024-sogefi-spa-valeo-roki-co-ltd-mannhummel-mahle-gmbh-lydall-cummins-1086888.htm,SBWire,2018-11-16T23:58:00.0000000Z
24,"Bob Tyler <b>Toyota</b>, a new and used <b>car</b> dealership located on Pensacola Blvd. is currently hosting its Toyotathon sales event, in which it offers incentive pricing on select new <b>Toyota</b> vehicles. Giving shoppers the chance to purchase or lease a new vehicle ...",Bob Tyler <b>Toyota</b> Offers Deals on New Vehicles During the Toyotathon Sales Event,https://www.bizjournals.com/tampabay/prnewswire/press_releases/Florida/2018/11/16/UN77172,The Business Journals,2018-11-16T23:30:00.0000000Z
25,"The ground for a new <b>auto</b> assembly plant has officially been broken in Huntsville, Alabama, as Mazda <b>Toyota</b> Manufacturing USA begins building a new $1.6 billion facility. The facility, set to ...",Ivey welcomes <b>Toyota</b> and Mazda executives for <b>auto</b> assembly plant groundbreaking ceremony in Huntsville,https://yellowhammernews.com/ivey-welcomes-toyota-and-mazda-executives-for-auto-assembly-plant-groundbreaking-ceremony-in-huntsville/,Yellowhammer News,2018-11-16T22:43:00.0000000Z
26,"Three synonyms that describe the new 2019 <b>Toyota</b> Avalon to a “T ... I remember when I first moved to Texas from New York, I was told I didn’t want leather in my <b>car</b>. I replied “What?” You gotta be kidding me! I do. Now, everyone agrees and ...",Luxury Marks <b>Toyota</b> Flagship 2019 Avalon Hybrid,http://www.focusdailynews.com/luxury-marks-toyota-flagship-2019-avalon-hybrid/,Focus Daily News,2018-11-16T22:25:00.0000000Z
27,"I’m one of those annoying people who goes to the gourmet ice cream shop and orders a scoop of vanilla on a cake cone. Not interested in the fancy homemade waffle cone; a sometimes-stale, low-calorie cake cone works for me. So I totally understand people ...","<b>Auto</b> review: <b>Toyota</b> Camry feels like Xanax, numbs passion for life",https://www.ohio.com/news/20181116/auto-review-toyota-camry-feels-like-xanax-numbs-passion-for-life,Akron Beacon Journal,2018-11-16T22:12:00.0000000Z
28,But now it&#39;s gaining traction among an unlikely audience: <b>car</b> makers. <b>Toyota</b> is one of a growing number of <b>auto</b> makers hoping augmented-reality headsets can improve everything from designing cars to manufacturing and fixing them. These headsets let users ...,<b>Toyota</b> is using Microsoft&#39;s HoloLens to build cars faster,https://www.clickondetroit.com/tech/toyota-is-using-microsofts-hololens-to-build-cars-faster,clickondetroit.com,2018-11-16T21:50:00.0000000Z
29,This is a 1/10 scale radio control replica of the <b>Toyota</b> GAZO Racing TS050 Hybrid. It is a World Endurance Championship race <b>car</b> that competed throughout the WEC 2018-2019 season. This specific kit celebrates <b>Toyota</b>’s first ever win at the famed 24 Hours ...,Tamiya <b>Toyota</b> Gazoo Racing TS050 Hybrid (F103GT),http://www.rcdriver.com/tamiya-toyota-gazoo-racing-ts050-hybrid-f103gt/,rcdriver.com,2018-11-16T21:47:00.0000000Z
30,"The 2020 <b>Toyota</b> Camry TRD also gets chassis improvements, with beefier front and rear sway bars and thicker underbody braces. That means the Camry TRD is 44 percent stiffer in the front and 67 percent stiffer in the rear than the normal <b>car</b>. The Camry TRD ...",The 2020 <b>Toyota</b> Avalon TRD and Camry TRD Leave Their Boring Reputation Behind [News],https://www.tflcar.com/2018/11/2020-toyota-camry-trd-avalon-trd/,The Fast Lane Car,2018-11-16T21:41:00.0000000Z
31,"Strategic planning A spokeswoman for <b>Toyota</b> said strategic planning for the plant is ongoing. &quot;Right now we are focusing on the process to hire and train 4,000 new team members.,&quot; the spokeswoman wrote in an email to <b>Automotive</b> News. &quot;We have great ...","<b>Toyota</b>, Mazda will launch $1.6 billion Alabama plant construction next month",http://www.autonews.com/article/20181116/OEM01/181119759/toyota-mazda-alabama-plant-construction,Automotive News,2018-11-16T21:32:00.0000000Z
32,"and there is a TRD Special Edition of the <b>Toyota</b> 86 sports <b>car</b>. But in a bid to keep its sedans exciting when consumers are running toward taller vehicles, <b>Toyota</b> is bringing them to the track. <b>Toyota</b> has made sporty cars throughout its history ...","<b>Toyota</b> is making high-performance versions of its popular, but &#39;boring,&#39; Camry and Avalon sedans",https://www.yahoo.com/news/toyota-making-high-performance-versions-162800763.html,YAHOO!,2018-11-16T20:19:00.0000000Z
33,"Pricing for the 2020 Corolla sedan has yet to be announced, but our colleagues over at <b>Car</b> and Driver estimate it&#39;ll start at somewhere around $20,000, and could surpass $25,000 depending on options and trim level. <b>Toyota</b> says the <b>car</b> will be available in ...",The 2020 <b>Toyota</b> Corolla Sedan Looks Like a Genuinely Fun Economy Four-Door,https://www.roadandtrack.com/new-cars/a25171472/2020-toyota-corolla-sedan-pictures-price-hp-specs-info/,Road &amp; Track,2018-11-16T19:29:00.0000000Z
34,The 2020 <b>Toyota</b> Supra Prototype MotorTrend’s 2019 Truck of the Year: The Overview MotorTrend’s 2019 <b>Car</b> of the Year: The Overview MotorTrend’s 2019 SUV of the Year: The Overview,"<b>Toyota</b> Gives Camry, Avalon the TRD Treatment",https://www.motortrend.com/news/toyota-gives-camry-avalon-trd-treatment/,Motor Trend,2018-11-16T19:01:00.0000000Z
35,"At China&#39;s Guangzhou International Automobile Exhibition, <b>Toyota</b> unveiled a redesigned Corolla sedan, making the world&#39;s best-selling vehicle more connected and efficient than ever before. The 12th generation of the <b>Toyota</b> Corolla was unveiled Friday ...",World&#39;s most popular <b>car</b> gets a new face: meet the new <b>Toyota</b> Corolla,https://www.msn.com/en-us/autos/news/worlds-most-popular-car-gets-a-new-face-meet-the-new-toyota-corolla/ar-BBPM44N,Relaxnews (AFP),2018-11-16T12:30:00.0000000Z
36,<b>Toyota</b> will unveil full specifications for the U.S.-bound Corolla sedan during the 2018 Los Angeles <b>Auto</b> Show later this month. Here&#39;s what we know so far: What it looks like: The front two-thirds of the Corolla sedan look just like the Corolla Hatchback.,Redesigned 2020 <b>Toyota</b> Corolla Finally Gets a Hybrid,https://www.consumerreports.org/small-cars/2020-toyota-corolla-preview/,Consumer Reports,2018-11-16T18:41:00.0000000Z
37,"That should promote a bit more rotation of the <b>car</b>’s tail, if you feel like autocrossing your Avalon. New TRD shock absorbers control roll and vertical movement but <b>Toyota</b> says they maintain on-road ride quality. The 19-inch wheels are wider (now 8.5 ...",<b>Toyota</b> Debuts ‘Track-Tuned’ Camry TRD and Avalon TRD,https://www.autoguide.com/auto-news/2018/11/toyota-goes-trd-on-track-tuned-camry-and-avalon.html,AutoGuide,2018-11-16T17:45:00.0000000Z
38,"Ahead of the 2018 Los Angeles <b>Auto</b> Show, <b>Toyota</b> unveiled a much-anticipated redesign of the Corolla sedan this week, and if you&#39;re playing catch-up, we don&#39;t blame you. In a nutshell, the 2020 Corolla sedan is based heavily on the just-introduced 2019 ...",Catching Up on All the <b>Toyota</b> Corolla News? Here&#39;s What to Know,https://www.cars.com/articles/catching-up-on-all-the-toyota-corolla-news-heres-what-to-know-1420703620517/,Cars.com,2018-11-16T17:41:00.0000000Z
39,"HUNTSVILLE, Alabama – With help from a robot, the first shovel of dirt was turned today at a sprawling site that will be home to Alabama’s next <b>auto</b> assembly plant – a $1.6 billon facility being built by Mazda <b>Toyota</b> Manufacturing USA that will ...",Mazda <b>Toyota</b> Manufacturing kicks off construction on $1.6B Alabama plant,http://www.madeinalabama.com/2018/11/mazda-toyota-manufacturing/,Alabama Department of Commerce,2018-11-16T17:36:00.0000000Z
40,"HUNTSVILLE, Ala. – A groundbreaking ceremony for the Mazda <b>Toyota</b> Manufacturing plant was held Friday morning at the Huntsville plant’s location in Limestone County. The plant is estimated to ...",Mazda <b>Toyota</b> Manufacturing breaks ground on $1.6 billion <b>auto</b> plant in Huntsville,https://whnt.com/2018/11/16/mazda-toyota-manufacturing-breaks-ground-on-1-6-billion-auto-plant-in-huntsville/,WHNT,2018-11-16T17:24:00.0000000Z
41,"Following a preview earlier this week, <b>Toyota</b> has officially unveiled the 2020 Avalon and Camry TRD. Set to debut at the Los Angeles <b>Auto</b> Show, the models are billed as “track-tuned sedans that enthusiasts have been asking for.” While we can’t recall ...",2020 <b>Toyota</b> Avalon And Camry TRD Pack 301HP And Track-Tuned Suspension,https://www.carscoops.com/2018/11/2020-toyota-avalon-camry-trd-pack-301-hp-track-tuned-suspension/,Carscoops,2018-11-16T17:18:00.0000000Z
42,<b>Toyota</b> announces it will build a hybrid version of the Corolla. Rivian teases images of its upcoming electric pickup. Mercedes-Benz launches a consumer fuel-cell test fleet. And we crunch the accident-rate numbers on Tesla&#39;s Autopilot. All this and more on ...,"<b>Toyota</b> Corolla Hybrid, Tesla Autopilot safety, Rivian pickup: Today&#39;s <b>Car</b> News",https://www.greencarreports.com/news/1119966_toyota-corolla-hybrid-tesla-autopilot-safety-rivian-pickup-todays-car-news,Green Car Reports,2018-11-16T16:51:00.0000000Z
43,<b>Toyota</b> has been on a quest to shed its ho-hum image for the ... Their latest attempt is the 2020 Corolla sedan which debuted last night before heading off to the LA <b>Auto</b> Show in a couple of weeks. The basic shape of the Corolla isn&#39;t that much different ...,2020 <b>Toyota</b> Corolla Becomes Much Bolder,https://www.cheersandgears.com/articles/auto-show-news/la-auto-show/2020-toyota-corolla-becomes-much-bolder-r5393/,cheersandgears.com,2018-11-16T16:20:00.0000000Z
44,"Ask a dyed-in-the-wool <b>car</b> geek their opinion on the <b>Toyota</b> Camry or <b>Toyota</b> Avalon, and you might hear a range of emotions from, &quot;It&#39;s fine&quot; to &quot;It&#39;s pretty decent.&quot; These two cars traditionally fall on the pocket-protector side of the risk spectrum ...",2020 <b>Toyota</b> Camry and Avalon TRD seek to shed stodgy stereotypes,https://www.cnet.com/roadshow/news/2020-toyota-camry-avalon-trd/,CNET,2018-11-16T16:08:00.0000000Z
45,"With the 2020 Corolla <b>Toyota</b> unveiled Thursday at simultaneous events in China and the U.S., the automaker makes its most dramatic effort yet to shed the small <b>car</b>&#39;s stodgy image. 2019 Honda Passport crossover SUV teased ahead of LA revival After rumors ...","2020 <b>Toyota</b> Corolla, <b>Toyota</b> Camry and Avalon TRD, Tesla Autopilot: What&#39;s New @ The <b>Car</b> Connection",https://www.thecarconnection.com/news/1119975_2020-toyota-corolla-toyota-camry-and-avalon-trd-tesla-autopilot-whats-new-the-car-connection,The Car Connection,2018-11-16T15:35:00.0000000Z
46,"The world’s best-selling <b>car</b> has gotten a redesign. The 12th-generation 2020 <b>Toyota</b> Corolla debuted showing off a pointed nose, piercing headlamps and a spacious interior. The Corolla joins the 2019 <b>Toyota</b> Corolla Hatchback, which debuted earlier this year.",<b>Automotive</b> Minute: World’s best-selling <b>car</b> gets a complete redesign for 2020 (Photos),https://www.bizjournals.com/atlanta/news/2018/11/16/automotive-minute-world-s-best-selling-car-gets-a.html,The Business Journals,2018-11-16T15:30:00.0000000Z
47,"The <b>Toyota</b> Corolla, best-selling <b>car</b> of all time, arrives next spring as a 2020 model. Sold in 90-plus countries, every Corolla gets the <b>Toyota</b> Safety Sense suite, “with specifications and availability refined for each country.” In the US, that means ...",2020 <b>Toyota</b> Corolla Shames Luxury Sedans With Standard Safety Suite,https://www.extremetech.com/extreme/280737-2020-toyota-corolla-shames-luxury-sedans-with-standard-safety-suite,ExtremeTech,2018-11-16T15:17:00.0000000Z
48,"The line builds the <b>Toyota</b> Avalon and the best-selling <b>car</b> in the U.S., the <b>Toyota</b> Camry. Here’s more from Bloomberg: ﻿“The <b>auto</b> industry is cyclical, and our normal process is to ...",<b>Toyota</b> Is Slowing Camry Production Due to Slumping Sedan Sales,https://jalopnik.com/toyota-is-slowing-camry-production-due-to-slumping-seda-1830488828,Jalopnik,2018-11-16T15:14:00.0000000Z
49,"The new sedan joins a family with one of the most enduring nameplates in <b>automotive</b> history, with over 46 million Corollas sold since 1966. It sits on the same TNGA (<b>Toyota</b> New Global Architecture) platform as its siblings, but uses the longer, 106.3-inch ...","<b>Toyota</b> Ditches Beige with New Corolla Sedan, Available 2019",https://www.gtplanet.net/toyota-ditches-beige-with-new-corolla-sedan-available-2019/,GTPlanet,2018-11-16T15:03:00.0000000Z
50,"The carmaker has plans to sell the <b>car</b> in this configuration in close to 100 countries, a much broader market than the current generation was allowed access to. The new <b>Toyota</b> Corolla sedan will be on display at the Los Angeles <b>Auto</b> Show at the end of the ...",2020 <b>Toyota</b> Corolla Turns Hybrid for the U.S. for the First Time,https://www.autoevolution.com/news/2020-toyota-corolla-turns-hybrid-for-the-us-for-the-first-time-130208.html,autoevolution,2018-11-16T14:48:00.0000000Z
51,"I was curious about CuriosityStream’s three-year-old science and tech documentary service, but reluctant to take out a subscription. So I tried CuriosityStream’s three-month-old, free, advertiser-supported service called Showcase. In August ...",CuriosityStream&#39;s <b>Toyota</b> Theater Features Free Anti-<b>Car</b> Documentaries,https://www.mediapost.com/publications/article/328012/curiositystreams-toyota-theater-features-free-ant.html?edition=111793,MediaPost,2018-11-16T14:32:00.0000000Z
52,"Firstly, the manufacturer says this new Corolla has a lower center of gravity and a generally sportier feel to the way it drives - in fact, <b>Toyota</b> used the word “sporty” to describe the <b>car</b> in its press blurb some seven times - it really wants to drive ...",<b>Toyota</b> Brightens Its 2020 Lineup with a Redesigned Corolla That’s More Powerful and Safer Than Ever,https://www.topspeed.com/cars/car-news/toyota-brightens-its-2020-lineup-with-a-redesigned-corolla-that-s-more-powerful-and-safer-than-ever-ar183447.html,Top Speed,2018-11-16T14:20:00.0000000Z
