,description,headline,url,provider,date
52,"<b>Toyota</b> projects that global sales of fuel cell electric vehicles (FCEV) will increase significantly after 2020 to at least 30,000 per year from today’s 3,000. To prepare for this growth, the company unveiled plans for two major new facilities: a brand ...",<b>Toyota</b> moves to expand mass-<b>production</b> of fuel cell stacks and hydrogen tanks towards ten-fold increase post-2020,https://www.greencarcongress.com/2018/05/20180524-toyota.html,Green Car Congress,2018-05-24T10:39:00.0000000Z
53,"Tesla&#39;s <b>production</b> woes stem from its anti-<b>Toyota</b> philosophy, betting that robots are better than humans at low-cost high-volume <b>production</b>. Tesla&#39;s highly automated <b>production</b> line will remain costly as long as leadership prioritizes quantity over quality.",Tesla: Why Betting Against <b>Toyota</b> Was A Bad Idea,https://seekingalpha.com/article/4172190-tesla-betting-toyota-bad-idea,Seeking Alpha,2018-05-10T15:25:00.0000000Z
54,"It is springtime in Blue Springs, and plants – such as <b>Toyota</b> Motor Manufacturing, Mississippi – are growing. During a groundbreaking ceremony for <b>Toyota</b> Mississippi’s new visitor and training center, the company announced it would invest $170 ...","<b>Toyota</b> upgrading <b>production</b> line, adding 440 jobs and welcome center",http://www.djournal.com/new-albany/toyota-upgrading-production-line-adding-jobs-and-welcome-center/article_b6c3ed38-ad28-5728-8f16-5d7e6c35cf62.html,djournal.com,2018-05-01T20:57:00.0000000Z
55,"Very few people have been able to harness and use their wisdom as powerfully as Taiichi Ohno, a Japanese industrial engineer and businessman who invented the “Ten Precepts” of lean manufacturing, a cornerstone of the <b>Toyota Production</b> System.",Taiichi Ohno: Hero of the <b>Toyota Production</b> System,https://blog.qad.com/2018/03/taiichi-ohno-toyota-production-system/,blog.qad.com,2018-03-15T08:37:00.0000000Z
56,"To enable the new efforts at TRI-AD, <b>Toyota</b> Motor Corporation (TMC), Aisin Seiki Co., Ltd. (Aisin), and Denso Corporation (Denso) have concluded a memorandum of understanding on joint development of fully-integrated, <b>production</b>-quality software for ...","Advanced Development (TRI-AD) Established in Tokyo To Provide Fully-Integrated, <b>Production</b>-Quality Software For Automated Driving | CORPORATE",https://newsroom.toyota.co.jp/en/corporate/21315381.html,newsroom.toyota.co.jp,2018-03-02T06:32:00.0000000Z
57,"<b>Toyota</b> has confirmed <b>production</b> plans for a next-generation Supra, issuing a statement surrounding its “most iconic sports car”. A brief bulletin titled “The legend returns” states simply that “At 2018 Geneva Motor Show, a modern racing concept ...",New <b>Toyota Supra confirmed for production</b>,https://www.drive.com.au/motor-news/new-toyota-supra-confirmed-for-production-117230,Drive.com.au,2018-02-13T00:00:00.0000000Z
58,"In 2017, <b>Toyota</b> built 1,983,723 vehicles at its North American vehicle assembly plants. <b>Production</b> volume was down slightly from the previous year total of 2,124,608 vehicles. <b>Toyota</b>’s total vehicle <b>production</b> in North America since 1986 has reached ...",<b>Toyota production</b> in <b>North America nearly 2 million</b> in 2017,https://www.automotiveworld.com/news-releases/toyota-production-north-america-nearly-2-million-2017/,Automotive World,2018-01-16T16:13:00.0000000Z
59,"Nearly 32 Million Vehicles Produced in North America Since 1986 PLANO, Texas, Jan. 16, 2018 /PRNewswire/ -- In 2017, <b>Toyota</b> built 1,983,723 vehicles at its North American vehicle assembly plants. <b>Production</b> volume was down approximately 1 percent over the ...",<b>Toyota Production</b> in <b>North America Nearly</b> 2 Million in 2017,https://finance.yahoo.com/news/toyota-production-north-america-nearly-150000568.html,Yahoo Finance,2018-01-16T15:03:00.0000000Z
60,"PLANO, Texas (Jan. 16, 2018) – In 2017, <b>Toyota</b> built 1,983,723 vehicles at its North American vehicle assembly plants. <b>Production</b> volume was down slightly from the previous year total of 2,124,608 vehicles. <b>Toyota</b>’s total vehicle <b>production</b> in North ...",<b>Toyota Production in North America Nearly</b> 2 Million in 2017,http://corporatenews.pressroom.toyota.com/releases/toyota+production+north+america+nearly+two+million+in+2017.htm,corporatenews.pressroom.toyota.com,2018-01-16T15:03:00.0000000Z
61,"PLANO, Texas, Jan. 16, 2018 /PRNewswire/ -- In 2017, <b>Toyota</b> built 1,983,723 vehicles at its North American vehicle assembly plants. <b>Production</b> volume was down approximately 1 percent over the previous year total of 2,124,608 vehicles. <b>Toyota</b>&#39;s total ...",<b>Toyota Production</b> in North America Nearly 2 Million in 2017,https://www.marketwatch.com/press-release/toyota-production-in-north-america-nearly-2-million-in-2017-2018-01-16,MarketWatch,2018-01-16T10:00:00.0000000Z
62,"PLANO, Texas, Jan. 16, 2018 /PRNewswire/ -- In 2017, <b>Toyota</b> built 1,983,723 vehicles at its North American vehicle assembly plants. <b>Production</b> volume was down slightly from the previous year total of 2,124,608 vehicles. <b>Toyota</b>&#39;s total vehicle ...",<b>Toyota Production in North America Nearly</b> 2 Million in 2017,https://www.prnewswire.com/news-releases/toyota-production-in-north-america-nearly-2-million-in-2017-300583106.html,PR Newswire,2018-01-16T10:00:00.0000000Z
63,"Alabama Gov. Kay Ivey, Huntsville Mayor Tommy Battle, and officials from <b>Toyota</b> and Mazda announced Wednesday afternoon that Japanese automakers <b>Toyota</b> and Mazda will build a $1.6 billion automotive plant in Huntsville-annexed Limestone County, bringing ...",Officials announce <b>Toyota</b>-Mazda <b>production</b> facility in Huntsville,https://www.waaytv.com/content/news/Huntsville-Chosen-for-new-Toyota-facility-468604603.html,WAAY-TV,2018-01-10T13:31:00.0000000Z
64,"The knives are out on costs at <b>Toyota</b> Motor Corp. Asia’s biggest automaker saved 100 billion yen ($875 million) in the half year ended September through measures including the continued roll out of a new manufacturing process. That’s more than $3,300 ...",<b>Toyota</b> cuts <b>production</b> costs to fund research,https://www.detroitnews.com/story/business/autos/foreign/2017/11/07/toyota-cuts-production-costs-record-research-budget/107431598/,The Detroit News,2017-11-07T18:05:00.0000000Z
65,"GEORGETOWN, Ky. (Oct. 30, 2017) – <b>Toyota</b> executives and state and local officials were in Georgetown today to celebrate the opening of the company’s $80 million <b>production</b> engineering headquarters. More than 600 engineers at the new facility connect ...",<b>Toyota</b> unveils $80M <b>production engineering headquarters in Georgetown</b>,https://www.lanereport.com/83064/2017/10/toyota-unveils-80m-production-engineering-headquarters-in-georgetown/,Lane Report,2017-10-30T22:10:00.0000000Z
66,"GEORGETOWN, Ky. (October 30, 2017) – It’s a big task, but <b>Toyota</b> Motor North America has the best and brightest accepting the challenge: innovate and problem solve to create the next generation of manufacturing technology. Today’s newly opened $80 ...",<b>Challenge accepted: Toyota production engineers turn</b> status quo on head,http://toyotanews.pressroom.toyota.com/releases/toyota+production+engineers+turn+status+quo+head+production+engineering+manufacturing+center.htm,toyotanews.pressroom.toyota.com,2017-10-30T00:00:00.0000000Z
67,"On Tuesday, <b>Toyota</b> wound up <b>production</b> at its plant in Altona, a working-class suburb in southwest Melbourne. The closure marks the end of the company’s 54-year Australian manufacturing operation. The shutdown left 2,700 workers unemployed, and threatens ...",<b>Toyota</b> ends car <b>production</b> in Australia,https://www.wsws.org/en/articles/2017/10/05/toyo-o05.html,wsws,2017-10-05T05:00:00.0000000Z
68,"<b>Toyota</b> Motor Corporation continues its investment in being a truly global company by increasing its stake in future technologies with the addition of hybrid manufacturing to its North American portfolio. <b>Toyota</b> Motor Sales, the U.S. arm of the Japanese ...",<b>Toyota announces first-ever hybrid production</b> in the U.S.,http://www.nydailynews.com/autos/news/toyota-announces-first-ever-hybrid-production-u-s-article-1.3527628,New York Daily News,2017-09-28T15:53:00.0000000Z
69,"BLUE SPRINGS – <b>Toyota</b> Mississippi officials said <b>production</b> of the Corolla at the Blue Springs ... More people are reading the <b>Mississippi Business Journal</b> than ever before, but advertising revenues for all conventional media are falling fast.",<b>Toyota Mississippi production unaffected by</b> <b>Toyota</b>-Mazda venture,http://msbusiness.com/2017/08/toyota-mississippi-production-unaffected-toyota-mazda-venture/,Mississippi Business Journal,2017-08-11T14:26:00.0000000Z
70,BLUE SPRINGS – <b>Toyota</b> Mississippi officials said <b>production</b> of the Corolla at the Blue Springs plant won’t be affected by Friday’s announcement that <b>Toyota</b> will be building the vehicle at a new $1.6 billion assembly plant in which it is partnering ...,<b>Toyota Mississippi production unaffected by Toyota</b>-Mazda venture,http://www.djournal.com/news/business/toyota-mississippi-production-unaffected-by-toyota-mazda-venture/article_b190bd96-d245-50a4-bf53-1fe82980ac93.html,djournal.com,2017-08-04T21:21:00.0000000Z
71,"The following article comes directly from the online course, The <b>Toyota</b> Way to Lean Leadership, by Dr.Jeffrey K. Liker with George Trachilis. These materials are also part of the book, Developing Lean Leaders at All Levels. 1. Tell what TPS (<b>Toyota</b> ...",<b>TOYOTA PRODUCTION SYSTEM ORIGINS</b>,https://www.linkedin.com/pulse/toyota-production-system-origins-alex-singh,LinkedIn,2017-05-02T00:00:00.0000000Z
72,"The <b>Toyota C-HR</b> is the fruit of collaboration between several European <b>Toyota production</b> sites and supplier businesses. In addition to 1.8-litre hybrid engines from TMUK in Deeside (see above), C-HR is using manual transmissions from <b>Toyota</b> Motor ...",<b>Toyota C-HR</b> hits the assembly line in Turkey,https://www.motor1.com/news/128131/toyota-c-hr-production-start/,Motor1,2016-11-10T08:20:00.0000000Z
73,The researcher hired by <b>Toyota</b> Motor Corp. to spearhead its robotics and artificial intelligence efforts says the automaker’s <b>production</b> principles can be applied to build affordable helper robots for rapidly aging societies. Robot makers are struggling ...,<b>Toyota Researcher Sees Cheap Robots Possible</b> by Mass <b>Production</b>,https://www.bloomberg.com/news/articles/2016-06-20/toyota-researcher-sees-cheap-robots-possible-by-mass-production,Bloomberg L.P.,2016-06-20T05:26:00.0000000Z
74,"<b>Toyota</b>, the world’s biggest-selling automaker ... more parts across various models to enable in house <b>production</b> at alternative plants during emergencies. Sign up now to receive <b>FORTUNE</b>&#39;s best content, special offers, and much more.","<b>Toyota</b>, Other Major Japanese Firms Hit by Quake Damage, Supply Disruptions",http://fortune.com/2016/04/17/toyota-earthquake-disruptions/,Fortune,2016-04-17T14:35:00.0000000Z
75,"The <b>Toyota Production</b> System (TPS), also known as the Lean management system (Lean), is already helping health care organizations provide high-quality, low-cost care, and it promises to do far more. However, the potential benefits of TPS/Lean are ...","The <b>Toyota Production System: What Does It Mean</b>, And <b>What Does It Mean</b> For Health Care?",https://www.healthaffairs.org/do/10.1377/hblog20160406.054094/full/,Health Affairs,2016-04-06T15:05:00.0000000Z
76,"The innovations of the <b>Toyota Production</b> System (TPS) are well documented in the management literature and standard features of business school curricula everywhere. These concepts are usually discussed in the context of industrial operations, but I also ...","The <b>Toyota Production System Works for Relationships</b>, Too",https://hbr.org/2016/04/the-toyota-production-system-works-for-relationships-too,Harvard Business Review,2016-04-01T17:08:00.0000000Z
77,"Mar 07, 2016 Jakarta, Indonesia, Mar 7, 2016 (JCN Newswire via COMTEX) -- Jakarta, Indonesia, Mar 7, 2016 - (JCN Newswire) - <b>Toyota</b> Motor Manufacturing Indonesia (TMMIN), <b>Toyota</b> Motor Corporation&#39;s vehicle <b>production</b> subsidiary in Indonesia, recently ...",<b>Toyota</b> Begins <b>Production</b> at Efficient New Engine Plant in Indonesia,https://www.marketwatch.com/press-release/toyota-begins-production-at-efficient-new-engine-plant-in-indonesia-2016-03-07,MarketWatch,2016-03-07T07:45:00.0000000Z
78,"This post is mainly about Respect for People in <b>Toyota Production</b> System, to show that this idea has been an integral part of <b>Toyota Production</b> System from the early days on. “<b>Toyota Production</b> System – The foundation is respect for human rights”.",Respect for Humanity (An <b>early theme in Toyota Production System</b>):,https://harishsnotebook.wordpress.com/2015/11/22/respect-for-humanity-an-early-theme-in-toyota-production-system/,harishsnotebook.wordpress.com,2015-11-22T23:13:00.0000000Z
79,Many people don&#39;t understand the DNA of the <b>Toyota Production</b> System and the core values of the <b>Toyota</b> Way. I have seen many who think about TPS as a toolkit or lean manufacturing techniques that have worked with <b>Toyota</b> because <b>Toyota</b> has a different ...,<b>What Toyota Production System</b> is Really About?,https://www.linkedin.com/pulse/what-toyota-production-system-really-mohammed-hamed-ahmed-soliman,LinkedIn,2015-06-23T00:00:00.0000000Z
80,"<b>Toyota</b> said today it plans to end <b>production</b> of the Venza just a little over seven years after the crossover station wagon, which was engineered in Ann Arbor, was introduced. The automaker said <b>production</b> at its plant in Georgetown, Kentucky will end by ...",<b>Toyota</b> ends <b>Venza production</b>,https://www.freep.com/story/money/cars/2015/03/02/toyota-venza-production/24285453/,Detroit Free Press,2015-03-03T03:13:00.0000000Z
81,"After an announcement on tripling <b>production</b> of fuel cell cars from the initial 700 annually to 2,100 by the end of 2015, <b>Toyota</b> now is willing to raise the bar to 3,000 Mirai year in 2017. A Nikkei article states that <b>production</b> will more than quadruple ...","<b>Toyota</b> Mirai Orders Top 1,400 In Japan – <b>Toyota</b> To <b>Quadruple Production Capacity</b>",https://insideevs.com/toyota-mirai-orders-top-1400-japan-toyota-quadruple-production-capacity/,Inside EVs,2015-01-15T15:34:00.0000000Z
82,"With Subaru&#39;s sales bulging in the U.S., it&#39;s going to end the joint <b>production</b> operation that it has with <b>Toyota</b> at its Lafayette, Ind., plant in 2016. <b>Toyota</b>, in a statement Friday, says it&#39;s going to shift all of the Camry <b>production</b> that it now has in ...",<b>Toyota</b> shifting Camry <b>production</b> from Subaru plant,https://www.usatoday.com/story/money/cars/2014/05/09/toyota-camry-subaru/8895835/,USA Today,2014-05-09T16:14:00.0000000Z
83,"The Konnyaku Stone is used to smooth unpainted body panels and remove imperfections. The size of a fist, and made of gritty resins; the stone is known as the ‘devil’s tongue’. Brushing the stone across the surface of a panel smoothes the metal so ...",13 pillars of the <b>Toyota Production</b> System,https://blog.toyota.co.uk/13-pillars-of-the-toyota-production-system,blog.toyota.co.uk,2014-04-24T13:58:00.0000000Z
84,Are the standards of the much-lauded <b>Toyota Production</b> System (TPS) being lowered? TPS was created in the 1950s to boost Japan’s economy post World War II. In 1945 Japanese General Tomoyuki Yamashita said that he thought that Japan had lost the war ...,<b>Toyota Production System Standards Lowered</b>?,http://guardianlv.com/2014/04/toyota-production-system-standards-lowered/,Guardian LV,2014-04-10T07:39:00.0000000Z
85,"Strong sales demand for Yaris Hybrid – unique in small car sector – in particular Introduction of 3 rd shift to increased <b>production</b> plan of 15 per cent to 220,000 units for calendar year 2014 <b>Toyota</b> announced this week that it will start operating ...",<b>Toyota</b> Increase <b>Production</b> of the <b>Toyota</b> Yaris,https://3d-car-shows.com/toyota-increase-production-of-the-toyota-yaris/,Nissan Off Road Racing,2014-02-14T10:46:00.0000000Z
86,"<b>Toyota</b> Camry no longer will come off the assembly line in 2017 at Subaru of <b>Indiana</b> Automotive&#39;s factory in Lafayette ... &quot;Based on changes in <b>Toyota</b>&#39;s <b>production</b> plans, they have decided that the award-winning Camry <b>production</b> contract will not be ...",<b>Toyota</b> pulling Camry from Subaru&#39;s <b>Indiana</b> plant,https://www.usatoday.com/story/money/cars/2013/11/14/toyota-subaru-indiana/3523917/,USA Today,2013-11-14T13:00:00.0000000Z
87,"Eliminating waste is the key to efficiency – in the <b>Toyota Production</b> System, this is termed as Muda, Muri and Mura. Read on to see our explanation. Muda means waste and refers in management terms to a wide range of non-value-adding activities.","Muda, Muri, Mura – <b>Toyota Production</b> System guide",https://blog.toyota.co.uk/muda-muri-mura-toyota-production-system,blog.toyota.co.uk,2013-05-31T09:06:00.0000000Z
88,"My mother just got her new car. After driving a problematic Renault for many years, she decided to go for a <b>Toyota</b> Yaris. That’s an excellent choice for her needs. Despite <b>Toyota</b>’s recent recalls, it continues to deliver the best quality at the best ...",Why my mother drives a <b>Toyota</b>: The <b>Toyota Production</b> System,https://better-operations.com/2013/01/27/toyota-production-system/,better-operations.com,2013-01-27T18:00:00.0000000Z
89,"NEW ORLEANS -- (March 2, 2012) – Two days before Hurricane Katrina struck New Orleans, Courtenay LaRoche fled to Texas with her two children. Thinking it may be “just another storm that would blow over,” she packed only two sets of clothes for each ...",<b>Toyota Production Techniques Boost Home Reconstruction</b> in New Orleans,http://toyotanews.pressroom.toyota.com/releases/toyota+production+techniques+boost+home+reconstruction+new+orleans.htm,toyotanews.pressroom.toyota.com,2012-03-02T00:00:00.0000000Z
90,"<b>Toyota</b> is famous for its <b>Toyota Production</b> System, an approach that effectively engages front-line workers in improving their work. As I argued in my last post, “pulling” improvement from the front line is critical to continually improve operations ...",<b>How Toyota Pulls Improvement</b> from the Front Line,https://hbr.org/2011/06/how-toyota-pulls-improvement-f,Harvard Business Review,2011-06-23T23:59:00.0000000Z
91,"TOKYO -- <b>Toyota</b>&#39;s car <b>production</b> in Japan plummeted a staggering 62.7 percent in March due to a parts supply crunch following the earthquake and tsunami. <b>Toyota</b> Motor Corp., the world&#39;s top-selling automaker last year, said Monday its domestic <b>production</b> ...",<b>Toyota</b> car <b>production</b> plummets after tsunami,https://www.cleveland.com/business/index.ssf/2011/04/toyota_car_production_plummets.html,The Plain Dealer,2011-04-25T11:16:00.0000000Z
92,"TOKYO (AP) — <b>Toyota</b>&#39;s global car <b>production</b>, disrupted by parts shortages from Japan&#39;s earthquake and tsunami, won&#39;t return to normal until November or December — imperiling its spot as the world&#39;s top-selling automaker. President Akio Toyoda ...",<b>Toyota: Car production disrupted until end</b> of 2011,https://www.csmonitor.com/Business/Latest-News-Wires/2011/0422/Toyota-Car-production-disrupted-until-end-of-2011,The Christian Science Monitor,2011-04-22T15:06:00.0000000Z
93,"DETROIT, April 11 (Reuters) - <b>Toyota</b> Motor Corp (7203.T) might face limited <b>production</b> through July due to Japan’s March 11 earthquake and its aftermath, its U.S. sales chief, Bob Carter, said in a note to dealers. “Today we have good levels of ...",UPDATE 2-<b>Toyota production</b> might be limited through July,https://www.reuters.com/article/toyota-production-idUSN119249220110411,Reuters,2011-04-11T20:41:00.0000000Z
94,SAN ANTONIO — <b>Toyota</b>&#39;s truck plant in San Antonio will suspend <b>production</b> for five non-consecutive days starting next Friday as a result of a supply-chain disruption in Japan. The work stoppage is part of a halt in <b>production</b> at all of <b>Toyota</b>&#39;s North ...,San Antonio <b>Toyota plant will halt production for</b> 5 days,https://www.chron.com/business/article/San-Antonio-Toyota-plant-will-halt-production-for-1686074.php,Houston Chronicle,2011-04-10T02:45:00.0000000Z
95,"Up to this point I have resisted weighing in on the <b>Toyota</b> quality story largely because: I don’t have anymore insight than anyone else. The signal-to-noise ratio in the story seems really low, and I didn’t feel I would contribute much. But there is ...",The <b>TPS vs. Toyota’s Production System</b>,http://theleanthinker.com/2010/03/09/the-tps-vs-toyotas-production-system/,The Lean Thinker,2010-03-09T22:24:00.0000000Z
96,"TOKYO – <b>Toyota</b> is suspending <b>production</b> at all 12 of its Japan plants for 11 days over February and March, a stoppage of unprecedented scale for the nation&#39;s top automaker as it grapples with shrinking global demand. The last time <b>Toyota</b> Motor Corp ...",<b>Toyota to Suspend Production for 11 Days</b> in Japan,http://www.foxnews.com/story/2009/01/06/toyota-to-suspend-production-for-11-days-in-japan.html,Fox News,2009-01-06T06:44:00.0000000Z
97,"The <b>Toyota Production</b> System and Kanban System introduced in this paper was developed by the Vice-President of <b>Toyota</b> Motor Company, Mr. Taiiohi Ohno, and it was under his guidance that these unique <b>production</b> systems have become deeply rooted in <b>Toyota</b> ...",<b>Toyota production</b> system and Kanban system Materialization of just-in-time and respect-for-human system,http://www.tandfonline.com/doi/abs/10.1080/00207547708943149,Taylor &amp; Francis Online,2007-03-28T00:00:00.0000000Z
98,"Koromo, Japan, October 1949. Passenger car <b>production</b> restrictions were lifted in post-war Japan. In 1945, Kiichiro Toyoda had challenged his company to &quot;catch up with America,&quot; but it was clear that <b>Toyota</b> could not catch up by adopting America&#39;s mass ...",<b>The Toyota Production System</b>,http://www.informit.com/articles/article.aspx?p=664147&seqNum=4,InformIT,2006-11-03T00:00:00.0000000Z
99,"For a long while, Kenneth Carter didn&#39;t recognize his town of Houston. When Hurricane Harvey hit on August 25, 2017, thousands of families were displaced. Carter even saw 6 feet of water in his home near the bayou. But Carter is one of the lucky ones who ...",<b>Toyota production</b> principles used to build homes after Harvey,https://www.wfaa.com/article/features/original/toyota-production-principles-used-to-build-homes-after-harvey/287-591345621,WFAA,2018-09-06T04:31:00.0000000Z
0,"For a long while, Kenneth Carter didn&#39;t recognize his town of Houston. When Hurricane Harvey hit on August 25, 2017, thousands of families were displaced. Carter even saw 6 feet of water in his home near the bayou. But Carter is one of the lucky ones who ...",<b>Toyota production</b> principles used to build homes after Harvey,https://www.wfaa.com/article/features/original/toyota-production-principles-used-to-build-homes-after-harvey/287-591345621,WFAA,2018-09-06T04:31:00.0000000Z
1,The objective of this study is to document the implementation of the <b>Toyota production</b> system (TPS) in a Healthcare Organisation – Heartland Regional Medical Center – undertaken to meet accreditation standards and customer service goals. We record the ...,<b>Toyota production</b> system for healthcare organisations: prospects and implementation challenges,http://www.tandfonline.com/doi/full/10.1080/14783363.2014.909624,Taylor &amp; Francis Online,2014-04-28T00:00:00.0000000Z
2,"According to reports in The Wall Street Journal and Japan’s Chunichi Shimbun, <b>Toyota</b> is in the “<b>production</b> engineering” stage of building an electric vehicle (EV) battery with a solid electrolyte. Reports suggest the new battery will debut in Japan ...","<b>Toyota in “production engineering” for a solid</b> state battery, WSJ says",https://arstechnica.com/cars/2017/07/toyota-wants-to-commercialize-solid-state-ev-batteries-by-2022-reports-say/,Ars Technica,2017-07-26T07:17:00.0000000Z
3,"BEIJING: Japan’s <b>Toyota</b> Motor Corp will build additional capacity at its auto plant in China’s Guangzhou, a company source said, in addition to beefing up <b>production</b> at a factory in Tianjin city by 120,000 vehicles a year. A person close to the company ...",<b>Toyota</b> to increase <b>production</b> capacity in China by 20pc,https://www.brecorder.com/2018/08/18/434516/toyota-to-increase-production-capacity-in-china-by-20pc/,Business Recorder,2018-08-17T23:16:00.0000000Z
