,description,headline,url,provider,date
0,"The M2 <b>Competition</b> is the most affordable M car in India and you can see the full report here. New <b>Mercedes</b>-Benz CLS launched, C-Class petrol to follow soon The sharper-looking, all-new <b>Mercedes</b>-Benz CLS 4-door coupe has been launched in India. Available ...","Car News Of The Week: 2019 Corolla, Alturas G4, 2018 Ertiga, New BMW &amp; <b>Mercedes</b> Launches And More",https://www.zigwheels.com/news-features/news/car-news-of-the-week-2019-corolla-alturas-g4-2018-ertiga-new-bmw-mercedes-launches-and-more/32339/,ZigWheels,2018-11-18T06:17:00.0000000Z
1,"Farfus scored his fourth Macau main race win and first in GT <b>competition</b> at the Guia Circuit. Edoardo Mortara completed the podium in third in the No. 1 <b>Mercedes</b>, ahead of the No. 912 Manthey ...","Farfus, BMW Win Emotional FIA GT World Cup in Macau",https://sportscar365.com/other-series/gt-world-cup/farfus-bmw-win-emotional-fia-gt-world-cup-in-macau/,Sportscar365,2018-11-18T05:17:00.0000000Z
2,"Leigh entered the final round of the second season of the <b>competition</b> with a commanding lead in the drivers’ championship, with his <b>Mercedes</b> team also leading the teams’ standings. Sauber driver Salih Saltunc took his maiden F1 Esports victory when he ...","Leigh defends F1 Esports crown, <b>Mercedes</b> wins inaugural teams’ title",https://in.news.yahoo.com/leigh-defends-f1-esports-crown-231755405.html,Yahoo! India News,2018-11-17T23:56:00.0000000Z
3,"Leigh entered the final round of the second season of the <b>competition</b> with a commanding lead in the drivers&#39; championship, with his <b>Mercedes</b> team also on top of the teams&#39; standings. Sauber driver Salih Saltunc took his maiden F1 Esports victory when he ...",F1 Esports final: <b>Mercedes</b> and Brendon Leigh win 2018 titles,https://www.autosport.com/esports/news/140144/mercedes-leigh-retains-f1-esports-title,Autosport,2018-11-17T23:18:00.0000000Z
4,"<b>Mercedes</b> made it five constructors championships in a row ... The driver&#39;s championship gets more a spotlight in the media and by the fans, but this is the <b>competition</b> which the teams care about the most, as it&#39;s the one which defines how much prize ...",F1 Teams with the Most Constructors&#39; World Championship Titles,https://www.sportskeeda.com/f1/f1-teams-with-the-most-constructors-world-championship-titles,Sportskeeda,2018-11-17T19:32:00.0000000Z
5,"The M2 is the entry-level M model and this is the first time it is officially on sale in India. The M2 <b>Competition</b> rivals against the likes of <b>Mercedes</b>-AMG CLA45, Porsche 718 Cayman, Audi TT and Jaguar F-Type V6 Coupe. BMW launched the M2 <b>Competition</b> in ...",BMW launched the M2 <b>Competition</b> in India at Rs 79.9 lakhs,https://www.msn.com/en-in/autos/news/bmw-launched-the-m2-competition-in-india-at-rs-799-lakhs/ar-BBPMjRG,CarTrade,2018-11-16T14:50:00.0000000Z
6,"Lewis Hamilton predicts <b>Mercedes</b> will enjoy &quot;a great knock-on effect&quot; for 2019 after clinching its fifth consecutive Formula 1 title double in the face of increased <b>competition</b> from Ferrari. Hamilton&#39;s Brazilian Grand Prix victory last weekend, coupled ...",Hamilton says 2018 title will have great 2019 &quot;knock-on effect&quot;,https://www.motorsport.com/f1/news/hamilton-mercedes-knock-on-2019/3214100/,Motorsport,2018-11-16T17:34:00.0000000Z
7,"We gave you the option of six epic on-track tussles to choose from, with one going through to represent F1 in the FIA’s annual ‘Action of the Year’ <b>competition</b> ... produced a magnificent overtake on <b>Mercedes</b> rival Bottas. Until the last second ...",Ricciardo’s daring China pass on Bottas wins F1 ‘Action of the Year’ accolade,https://www.formula1.com/en/latest/article.ricciardo's-daring-china-pass-on-bottas-wins-f1-'action-of-the-year'.17WasIhIVc4MkYEoUyEwyQ.html,Formula 1,2018-11-16T17:32:00.0000000Z
8,You can also find excellent manufacturer incentives on our Lexus deals page. Lexus LX Versus the <b>Competition</b> Which Is Better: Lexus LX or <b>Mercedes</b>-Benz GLS? The <b>Mercedes</b>-Benz GLS sits near the top of the class rankings because it&#39;s one of the best ...,2019 Lexus LX: What You Need to Know,https://www.msn.com/en-us/autos/reviews/2019-lexus-lx-what-you-need-to-know/ar-BBPOgSp,US News &amp; World Report - Cars,2018-11-17T21:43:00.0000000Z
9,"<b>Mercedes</b> and Ferrari were neck-and-neck for more than half the season but a golden run of form, led by Hamilton, put <b>Mercedes</b> in the clear and allowed it to wrap up the both drivers&#39; and constructors&#39; championships for the fifth season in a row. &quot;We win ...",Hamilton: Title will have huge 2019 &#39;knock-on&#39;,https://www.eurosport.com/formula-1/hamilton-title-will-have-huge-2019-knock-on_sto7014268/story.shtml,Eurosport,2018-11-16T16:19:00.0000000Z
10,Lewis Hamilton predicts <b>Mercedes</b> will enjoy &quot;a great knock-on effect&quot; for 2019 from clinching its fifth consecutive Formula 1 title double in the face of increased <b>competition</b> from Ferrari.,Lewis Hamilton: <b>Mercedes</b>&#39; F1 titles will have huge 2019 &#39;knock-on&#39;,https://uk.sports.yahoo.com/news/lewis-hamilton-mercedes-apos-f1-152107472.html,Yahoo Sports,2018-11-16T15:36:00.0000000Z
11,"For half a decade now, <b>Mercedes</b> have dominated the world of motorsports ... And when they reached the top, they decimated the <b>competition</b>. The numbers tell the story. They are just the second team in history after Ferrari to win five consecutive titles.",F1 Timeline: <b>Mercedes</b>&#39; rise to dominance,https://www.sportskeeda.com/f1/f1-timeline-mercedes-rise-to-dominance,Sportskeeda,2018-11-16T13:14:00.0000000Z
12,"GUANGZHOU, China -- Volvo&#39;s performance electric-vehicle subbrand Polestar sees China as its greatest opportunity even as it&#39;s set to face stiff <b>competition</b> ... brands such as <b>Mercedes</b>-Benz ...",Volvo&#39;s Polestar targets China opportunity despite Tesla <b>competition</b>,http://europe.autonews.com/article/20181116/ANE/181119794/volvos-polestar-targets-china-opportunity-despite-tesla-competition,Automotive News Europe,2018-11-16T13:14:00.0000000Z
13,"<b>Mercedes</b>-Benz India has launched the third-generation CLS in India. Priced at Rs 84.70 lakh (ex-showroom), the stylish new four-door coupe gets the company’s new design language and comes with a BS-VI diesel engine. <b>Competition</b> for the new CLS will ...",New <b>Mercedes</b>-Benz CLS launched at Rs 84.70 lakh,https://www.autox.com/news/car-news/new-mercedes-benz-cls-launched-at-rs-8470-lakh-104947/,autoX,2018-11-16T07:56:00.0000000Z
14,"When you look at <b>Mercedes</b>, it took five years ... “It’s a very tough <b>competition</b>,” Stoll said. “At the very beginning, we said we have a five- to six-year journey to be on the podium.",Renault Sport Racing F1 is ready to move up to the big kids table,https://autoweek.com/article/formula-one/renault-sport-racing-f1-president-says-team-pace-contend-podiums,Autoweek,2018-11-15T22:00:00.0000000Z
15,"The <b>competition</b> in the luxury SUV segment has gotten intense, and compelling all-new entries from Audi and Lincoln ousted perennial favorite <b>Mercedes</b> out of the SUV winner&#39;s circle.&quot; Honda dominated the Edmunds Buyers Most Wanted Awards for a second year ...",Honda Leads 2019 Edmunds Buyers Most Wanted Awards,https://www.bizjournals.com/sanjose/prnewswire/press_releases/California/2018/11/15/LA66300,The Business Journals,2018-11-15T14:00:00.0000000Z
16,The opportunity to win exciting <b>Mercedes</b>-AMG Petronas merchandise ... For more information about the program click here. 2. This <b>competition</b> will run from midnight Thursday 15th November 2018 ...,Promoted: Enter the Marriott sweepstake today for your chance to win exciting prizes,https://uk.sports.yahoo.com/news/promoted-enter-marriott-sweepstake-today-112624818.html,Yahoo Sports,2018-11-15T11:57:00.0000000Z
17,"The BMW M2 <b>Competition</b> will compete with the likes of the Porsche 718 Cayman and <b>Mercedes</b>-AMG CLA 45. That said, the M2 <b>Competition</b> packs more grunt and it also has more equipment in terms of performance and handling aides. autoX Editorial Fuelled by ...",BMW M2 <b>Competition</b> launched at Rs 79.90 lakh,https://www.autox.com/news/car-news/bmw-m2-competition-launched-at-7990-lakh-104921/,autoX,2018-11-15T11:41:00.0000000Z
18,praising the way <b>Mercedes</b> reacted in the face of a significant Ferrari challenge. “One of our great advantages this year was that we were able to turn all the pressure from the <b>competition</b> and the tough battle with Ferrari into strengths and motivation ...,Hamilton says 2018 car is his best yet,https://racer.com/2018/11/14/hamilton-says-2018-car-is-his-best-yet/,Racer,2018-11-14T14:41:00.0000000Z
19,"In addition to this, families will be kept well entertained with a dedicated children’s area set in a woodland scene, with colouring <b>competitions</b>, a bike ride simulator, <b>Mercedes</b>-Benz Collection shop, and a special visit in-store from Britain’s Got ...",<b>Mercedes</b>-Benz Vans pop-up store comes to Bluewater,https://www.automotiveworld.com/news-releases/mercedes-benz-vans-pop-up-store-comes-to-bluewater/,Automotive World,2018-11-14T12:27:00.0000000Z
20,Lewis Hamilton had his work cut out in the Brazilian Grand Prix to secure his 72nd career F1 victory in the face of spirited <b>competition</b> ... championship for <b>Mercedes</b> for the fifth season in ...,Lewis Hamilton snatches victory at Brazil GP as <b>Mercedes</b> win Constructrors&#39; Championship,https://asia.eurosport.com/formula-1/lewis-hamilton-snatches-victory-at-brazil-gp-as-mercedes-win-constructrors-championship_sto7008993/story.shtml,Eurosport Asia,2018-11-13T23:56:00.0000000Z
21,<b>Mercedes</b> celebrated their fifth consecutive double-title ... One of our great advantages this year was that we were able to turn all the pressure from the <b>competition</b> and the tough battle with Ferrari into strengths and motivation. That has been the ...,Gallery: <b>Mercedes</b> employees celebrate title success,http://www.motorsportweek.com/news/id/20685,grandprixtimes.com,2018-11-13T22:04:00.0000000Z
22,"The new G-Wagen, <b>Mercedes</b> G63 uses the same displacement ... In a roll race or drag, the Tesla stomps the <b>competition</b>. Which is fine, even for an ICE enthusiast like myself. But let&#39;s vote on ...","No surprises: Tesla Model X drag-races Lamborghini Urus, Range Rover SVR and <b>Mercedes</b>-AMG G63",https://autoweek.com/article/supercars/no-surprises-tesla-model-x-drag-races-lamborghini-urus-range-rover-svr-and,Autoweek,2018-11-13T15:14:00.0000000Z
23,"<b>Mercedes</b>-Benz&#39;s &quot;Don&#39;t stop evolving&quot; campaign on Strava aims to align with the brand&#39;s philosophy of &quot;seeking excellence and innovation in its models,&quot; and could reach active, higher-income consumers looking for some <b>competition</b>. Multiple studies have ...",<b>Mercedes</b>-Benz Brazil teams with social fitness app Strava,https://www.mobilemarketer.com/news/mercedes-benz-brazil-teams-with-social-fitness-app-strava/542065/,mobile,2018-11-13T15:13:00.0000000Z
24,"For these reasons Cairo’s “Arabic <b>competition</b> this year is particularly strong,” he noted. Accordingly, the Horizons of Arab Film <b>Competition</b> section comprises new works from veterans and ...",Cairo Film Festival Undergoes Radical Revamp,https://variety.com/2018/film/festivals/cairo-film-festival-undergoes-radical-revamp-mohamed-hefzy-1203027009/,Variety,2018-11-13T09:20:00.0000000Z
25,"It&#39;s a <b>competition</b> that&#39;s been going on for decades, but we honestly don&#39;t know what <b>Mercedes</b> can change in the engine department. The E-Class is already one of the primary beneficiaries of the latest inline-6 and four-cylinder engines that are said to be ...",2020 <b>Mercedes</b> E-Class Sedan Facelift Spied Next to the Model It Will Replace,https://www.autoevolution.com/news/2020-mercedes-e-class-sedan-facelift-spied-next-to-the-model-it-will-replace-130100.html,autoevolution,2018-11-12T21:45:00.0000000Z
26,Sao Paulo (AFP) - Lewis Hamilton hailed his <b>Mercedes</b> team as legends on Monday ... We are setting the benchmark at the moment and our <b>competition</b> will get more energised and motivated by usâ ...,Hamilton hails <b>Mercedes</b> triumph as his best moment,https://sports.yahoo.com/hamilton-hails-mercedes-triumph-best-moment-175541128--f1.html,Yahoo Sports,2018-11-12T18:09:00.0000000Z
27,"But <b>competition</b> between the handful of big names in the 4x4 ... We find that it&#39;s not as sporty as the smaller GLC Coupe, though that won&#39;t stop the people who want <b>Mercedes</b>&#39; best and most expensive from buying one. What sets the two apart?",2020 <b>Mercedes</b> GLE Coupe Shows Glimpses of MBUX System in Latest Spy Video,https://www.autoevolution.com/news/2020-mercedes-gle-coupe-shows-glimpses-of-mbux-system-in-latest-spy-video-130098.html,autoevolution,2018-11-12T18:05:00.0000000Z
28,"... be even more differentiated from the standard versions than it is the case today with the <b>Competition</b> Package versions. It’s a similar move to what <b>Mercedes</b>-Benz is doing these days with its AMG and AMG S models, if you will. What that entails ...",Upcoming BMW M3 and M3 <b>Competition</b> Models Could Arrive Simultaneously,https://www.bmwblog.com/2018/11/12/upcoming-bmw-m3-and-m3-competition-models-could-arrive-simultaneously/,BMW BLOG,2018-11-12T17:51:00.0000000Z
29,Why does the BMW M2 <b>Competition</b> get a moral victory ... And it’s made by Renault. Not BMW or <b>Mercedes</b>-Benz or even Porsche. Renault. If the plucky French brand that isn’t even sold in the second largest car market in the world (America) can make ...,BMW M2 <b>Competition</b> comes fifth in Top Gear’s Speed Week,https://www.bmwblog.com/2018/11/12/bmw-m2-competition-comes-fifth-in-top-gears-speed-week/,BMW BLOG,2018-11-12T14:05:00.0000000Z
30,"So really the conclusion is, <b>Mercedes</b> driver Esteban Ocon pulled a move on a car ... “act prejudicial to the interests of any <b>Competition</b> or to the interests of motor sport generally”, physical contact with another competitor in FIA garage.",Ocon plays perfect <b>Mercedes</b> driver role on Verstappen in Brazil,https://thejudge13.com/2018/11/11/ocon-plays-perfect-mercedes-driver-role-on-verstappen-in-brazil/,thejudge13.com,2018-11-11T20:38:00.0000000Z
31,"But what makes <b>Mercedes</b>-AMG Petronas Motorsport stand out ... Between unforeseen weather circumstances and intense <b>competition</b> from Red Bull and Ferrari, both drivers and team members were on their toes to expect the unexpected. And it helped that the ...",<b>Mercedes</b>-AMG Petronas Motorsport Takes Their Fifth Constructors’ Championship,https://www.tibco.com/blog/2018/11/11/mercedes-amg-petronas-motorsport-takes-their-fifth-constructors-championship/,TIBCO Software,2018-11-11T19:23:00.0000000Z
32,"<b>Mercedes</b> leads Ferrari in the constructors ... former Vice President of <b>Competition</b> and Operations for Red Bull’s Global Rallycross series, has joined American Flat Track as Chief <b>Competition</b> ...",F1: Lewis Hamilton tops Sebastian Vettel to get pole position at Brazilian GP,https://motorsports.nbcsports.com/2018/11/10/f1-lewis-hamilton-tops-sebastian-vettel-to-get-pole-position-at-brazilian-gp/,NBC Sports - Motorsports,2018-11-10T17:49:00.0000000Z
33,"This reading has a feeling of, relax, it’s all over, take it easy and forget all about the <b>competition</b>. Of course ... just because Lewis is champion, <b>Mercedes</b> and Lewis had better not let their guard down, as we’ve seen in the past, and let Ferrari ...",Big danger that <b>Mercedes</b> will drop the ball in Brazil,https://thejudge13.com/2018/11/10/big-danger-that-mercedes-will-drop-the-ball-in-brazil/,thejudge13.com,2018-11-10T10:43:00.0000000Z
34,"<b>Mercedes</b> minibus torched in arson attack in city street Birmingham mail - 12:15 PM GMT November 08, 2018 Closures on the M62 following reports of overturned minibus - LIVE updates Manchester Evening News - 19:47 PM GMT November 07, 2018 Cheshire ...",Community groups urged to enter P&amp;J Minibus <b>competition</b>,https://www.newsoneplace.com/6938751809/community-minibus-groups-competition,newsoneplace.com,2018-11-10T07:29:00.0000000Z
35,"<b>Mercedes</b> will continue to offer five body styles ... and we expect it to be offered in the United States as a 2021 model. <b>Competition</b> will include the BMW 3-series and the Audi A4, and prices should remain close to those of the current model.",Next-Generation 2021 <b>Mercedes</b>-Benz C-class Sedan Spied,https://www.caranddriver.com/news/2021-mercedes-benz-c-class-sedan-future-cars,Car and Driver,2018-11-10T02:30:00.0000000Z
36,"The <b>Mercedes</b>-Benz 190 SL was the more laid-back version of the ... The car comes with a standard full-size single-piece windscreen although, as part of a dealer-installed <b>competition</b> pack, the SL was available with a small windshield up front and other ...",1958 <b>Mercedes</b>-Benz 190 SL,https://www.topspeed.com/cars/mercedes/1958-mercedes-benz-190-sl-ar183115.html,Top Speed,2018-11-09T14:10:00.0000000Z
37,"The <b>Mercedes</b>-Benz S-class sits at the top of its rarefied segment, with unmatched comfort and leading-edge technology that put it a step ahead of the <b>competition</b> from BMW and Audi. Now Stuttgart is rolling out a plug-in hybrid, the S560e, and the question ...",2019 <b>Mercedes</b>-Benz S560e Has Unique Talents but Isn&#39;t the Star of the Lineup,https://www.caranddriver.com/reviews/2019-mercedes-benz-s560e-plug-in-hybrid-drive,Car and Driver,2018-11-07T20:41:00.0000000Z
38,"Rocking a Koenig Specials widebody kit and draped in burgundy paint, this 1987 560SEL is the ultimate 1980s throwback. The Eighties were a truly magical time in human history. Pastel and spandex clothes flew off the shelves, the music was turbocharged with ...",<b>Mercedes</b> Sedan Blows Away <b>Competition</b> at Radwood Philly,https://mbworld.org/articles/560sel-radwood-philly/,MBWorld.org,2018-10-26T00:00:00.0000000Z
39,It’s never easy operating a large dealership for a premium brand as globally renowned as <b>Mercedes</b>-Benz. This is more so when the brand is associated with the famous tagline – ‘The Best Or Nothing’. In order to meet the growing demands and ...,AD: Hap Seng Star proves its the best as champions at <b>Mercedes</b>-Benz SEA II Skills <b>Competition</b> 2018,https://paultan.org/2018/10/19/ad-hap-seng-star-proves-its-the-best-as-champions-at-mercedes-benz-sea-ii-skills-competition-2018/,Paul Tan,2018-10-19T08:56:00.0000000Z
40,"Super sedans have become so fast in recent years that they now offer levels of performance once limited to expensive supercar. Take the BMW M5 <b>Competition</b> and <b>Mercedes</b>-AMG E63 S, for example. Both of these sedans provide owners and passengers with ...",BMW M5 <b>Competition</b> Puts On A Show Against <b>Mercedes</b>-AMG E63 S,https://www.carscoops.com/2018/10/bmw-m5-competition-puts-show-mercedes-amg-e63-s/,Carscoops,2018-10-18T16:39:00.0000000Z
41,"An intense event was this eRacing <b>competition</b>. Kevin Siggy won against other 11 drivers, mixed real DTM and simracing drivers who fought vigorously for the win. Here the official note. One more time – for the third year in a row, <b>Mercedes</b>-AMG Motorsport ...",<b>Mercedes</b>-AMG Motorsport eRacing <b>Competition</b> 2018,https://boxthislap.org/mercedes-amg-motorsport-eracing-competition-2018/,Bodnar V2 impressions,2018-10-16T09:49:00.0000000Z
42,"Identifying the best warrants <b>competition</b> (at times) and it is through <b>competition</b> that standards are pushed to greater heights. This is the basis of the recent <b>Mercedes</b>-Benz SEA II Skills <b>Competition</b> 2018, where customer service professionals from ...",<b>Mercedes</b>-Benz SEA II Skills <b>Competition</b> 2018 – identifying the best in pursuit of higher standards,https://paultan.org/2018/09/06/mercedes-benz-sea-ii-skills-competition-2018/,Paul Tan,2018-09-06T09:09:00.0000000Z
43,<b>Mercedes</b>-Benz is the latest luxury automaker to debut its first all-electric vehicle in a bid both to recapture market share taken by Tesla and to be positioned for the new mobility era of automobiles. The <b>Mercedes</b>-Benz EQC is an all-electric compact ...,"<b>Mercedes</b>-Benz EQC: Electric crossover juices <b>competition</b> with Tesla, Jaguar",https://www.chicagotribune.com/classified/automotive/fuelefficient/ct-auto-mercedes-eqc-launch-20180904-story.html,Chicago Tribune,2018-09-04T21:21:00.0000000Z
44,"<b>Mercedes</b>-Benz unveiled its first fully electric SUV today ... it will find itself in a world of increasingly fierce <b>competition</b>. The EQC unveil comes amid a flurry of electrifying announcements from the auto industry. Later this month, Audi will debut ...",<b>Mercedes</b> Challenges Tesla With an All-Electric SUV,https://www.wired.com/story/mercedes-benz-eqc-electric-suv/,Wired,2018-09-04T18:22:00.0000000Z
45,"It will be quick, but it won’t last as long as the <b>competition</b> While <b>Mercedes</b>-Benz teased a range of around 300 miles with the concept version, the production EQC will potentially travel less than that on a full charge. <b>Mercedes</b>-Benz parent company ...",<b>Mercedes</b>-Benz’s first serious all-electric car is a 402-horsepower SUV with over 200 miles of range,https://www.theverge.com/2018/9/4/17818836/mercedes-benz-eqc-suv-ev-specs-photos,The Verge,2018-09-04T17:13:00.0000000Z
46,"<b>Mercedes</b>-Benz, the world’s largest maker of luxury cars ... Tesla’s backyard and the heart of the tech community. <b>Competition</b> will be particularly fierce in the SUV and crossover categories. In addition to the Model X, which starts at about $85,000 ...",<b>Mercedes</b> Unveils First Tesla Rival in $12 Billion Attack,https://www.bloomberg.com/news/articles/2018-09-04/mercedes-readies-first-tesla-rival-in-12-billion-attack-plan,Bloomberg L.P.,2018-09-04T15:17:00.0000000Z
47,"The <b>Mercedes</b> EQC - whose launch program in Stockholm features ... “Tesla has virtually zero <b>competition</b> - but this will change from 2019 onwards.” Rival forecaster LMC Automotive agrees, predicting a steady decline in Tesla’s share of an exploding ...",Electric <b>Mercedes</b> opens German assault on Tesla,https://www.reuters.com/article/us-tesla-germany-daimler-idUSKCN1LJ17Y,Reuters,2018-09-03T12:21:00.0000000Z
48,"Oh, yes. Every performance <b>Mercedes</b> model has a counterpart from BMW because that’s how the world works. In the case of the AMG CLA 45, it’s the M2 <b>Competition</b>, Bimmer’s smallest and latest mighty M car that also happens to be one of the most dynamic ...",2020 <b>Mercedes</b>-AMG CLA 45,https://www.topspeed.com/cars/mercedes/2020-mercedes-amg-cla-45-ar182072.html,Top Speed,2018-08-09T17:56:00.0000000Z
49,2008 or 2018? The visual design of MBUX feels tired from the outset. A few weeks ago I posted an article that looked at how <b>Mercedes</b> made a clever change to their physical input devices and massively improved their system. This time I’ve taken a deep ...,5 design changes <b>Mercedes</b> could use to make MBUX better than the <b>competition</b>.,https://medium.com/@drewdraws2/5-design-changes-mercedes-could-use-to-make-mbux-better-than-the-competition-998431dc861f,Medium,2018-07-06T14:53:00.0000000Z
50,"The 2019 model year is shaping up to be one full of high-powered, performance-oriented people haulers. But let’s be honest, not everyone is necessarily in the market for a new car that can approach extralegal speeds in the blink of an eye. While we will ...","Friday Five: BMW debuts 2019 M5 <b>Competition</b>, <b>Mercedes</b> reveals AMG GT, 2019’s new cars and more",http://www.nydailynews.com/autos/news/bmw-m5-competition-2019-new-redesigned-cars-article-1.3984493,New York Daily News,2018-05-11T21:07:00.0000000Z
51,"The 2018 BMW M5 <b>Competition</b> has been officially confirmed for Australia, less than a week after the German BMW site (and an Aussie customer) leaked most of the key specs. By now that we know it’s on the way, we here at MOTOR can start thinking of what to ...",2018 BMW M5 <b>Competition</b> vs 2018 <b>Mercedes</b>-AMG E63 S: in numbers,https://www.whichcar.com.au/news/2018-bmw-m5-competition-vs-mercedes-amg-e63-s-numbers,whichcar.com.au,2018-05-08T22:23:00.0000000Z
52,"High-power SUVs have been enjoying their moment in the spotlight for a few years. But the battle for Autobahn supremacy among today&#39;s crop of premium super sedans continues unabated, and at a furious pace. The latest salvo? This 2019 BMW M5 <b>Competition</b> Sedan.",2019 BMW M5 <b>Competition</b> is a 617-hp strike at <b>Mercedes</b>-AMG,https://www.cnet.com/roadshow/news/2019-bmw-m5-competition-617-hp-mercedes-amg-strike/,CNET,2018-05-08T22:17:00.0000000Z
53,"Is the German limousine still a byword for luxury? We&#39;re about to find... Changes over the standard M5 include BMW&#39;s M Sport exhaust system as standard, the volume of which can be adjusted via a button, as well as new engine mounts with a higher spring ...",616bhp BMW M5 <b>Competition</b> takes fight to <b>Mercedes</b>-AMG E63 S,https://www.autocar.co.uk/car-news/new-cars/616bhp-bmw-m5-competition-takes-fight-mercedes-amg-e63-s,Autocar,2018-05-08T22:11:00.0000000Z
