,description,headline,url,provider,date
53,"During the 2018 Miami International Boat Show, <b>Mercedes</b>-AMG debuted what it considers to be “the most impressive and innovative performance boat ever constructed” by Cigarette Racing. Dubbed the “515 Project ONE,” the 51’ 5” boat was inspired ...",<b>Mercedes</b>-AMG and <b>Cigarette Racing Unveil 515 Project</b> ONE Boat,http://compositesmanufacturingmagazine.com/2018/02/mercedes-amg-cigarette-racing-unveil-515-project-one-boat/,Composites,2018-02-26T06:26:00.0000000Z
54,"Officially, and in German, it is called Werk 56. And even if it sounds a bit like something Kurt Vonnegut would write, it is not. It is only a new assembly hall being built by <b>Mercedes</b> at the Sindelfingen complex. Only a new assembly hall is probably an ...","Factory 56, the <b>Mercedes-Benz Car Manufacturing Revolution</b>",https://www.autoevolution.com/news/factory-56-the-mercedes-benz-car-manufacturing-revolution-123663.html,autoevolution,2018-02-20T14:47:00.0000000Z
55,"The 48-year-old Swede, who was previously head of AMG and <b>Mercedes</b>&#39; Alabama <b>manufacturing</b> facility, discussed a wide range of Benz-related topics. On the 2019 <b>Mercedes</b>-Benz G-Class introduced in Detroit, and how you make it better on-road without ...","Talking 2019 <b>Mercedes</b> G-Class, new AMG 53s, inline-sixes, 48V tech and the EQ electrics",https://www.autoblog.com/2018/01/26/mercedes-interview-g-class-amg/,Autoblog,2018-01-26T22:26:00.0000000Z
56,"The Iranian car <b>manufacturing</b> company Iran Khodro and the German Daimler concern signed an agreement on the start of production of <b>Mercedes</b>-Benz cars in Iran from the Islamic new year (late March), the ISNA news agency reported on Friday. The German car ...",<b>Mercedes</b>-Benz <b>Company to Launch Car Manufacturing in Iran</b> – Reports,https://sputniknews.com/business/201801201060901359-mercedes-benz-car-manufacturing-iran/,Sputnik,2018-01-20T01:00:00.0000000Z
57,"In the U.S., for example, Daimler announced a $1 billion EV-related investment into its <b>manufacturing</b> plant in Tuscaloosa, Alabama where GLE, GLE Coupe and C-Class are made. The site was selected to produce the upcoming <b>Mercedes</b>-Benz EQC (GLE sized SUV ...",<b>Mercedes Predicts EQ Electric Vehicles Could</b> Account For 25% Of Global Sales By 2025,https://insideevs.com/mercedes-predicts-eq-electric-vehicles-could-account-for-25-of-global-sales-by-2025/,Inside EVs,2018-01-18T17:10:00.0000000Z
58,"Meet the all-new <b>2019 Mercedes-Benz G-Class</b>, arriving ... Modern materials and <b>manufacturing</b> tighten up the G-Class’s panel gaps, and the new design better integrates the wheel arches and bumpers. As a result, <b>Mercedes</b> says the new G appears to be ...",First Look: The redesigned 2019 <b>Mercedes</b> G-Class still goes just about anywhere and does just about anything,http://www.nydailynews.com/autos/news/2019-mercedes-benz-g-class-preview-article-1.3757662,New York Daily News,2018-01-15T15:06:00.0000000Z
59,This article is part of a series examining <b>Trends in Additive Manufacturing for End-Use Production</b>. Matthias Krust is Manager Global Business Communications <b>Mercedes</b>-Benz Cars Daimler AG. 3D printing technology has been used at Daimler for more than 25 years.,<b>Trends in Additive Manufacturing for end-use production</b> with Daimler AG,https://3dprintingindustry.com/news/trends-additive-manufacturing-end-use-production-daimler-ag-125470/,3D Printing Industry,2017-12-01T10:32:00.0000000Z
60,"&quot;<b>Mercedes</b> is convinced it can match Tesla battery costs, beat its <b>manufacturing</b> and procurement costs, ramp up production faster and have better quality. It is also confident its cars will drive better.&quot; <b>Mercedes</b>&#39; move also comes as the major German ...",<b>Mercedes-Benz makes a</b> $1B bet <b>it can take down Tesla</b>,https://www.usatoday.com/story/money/cars/2017/09/21/mercedes-benz-tuscaloosa-electric-vehicles-batteries/688721001/,USA Today,2017-09-21T18:11:00.0000000Z
61,"With this one billion dollar investment, we are significantly growing our <b>manufacturing</b> footprint here in Alabama, while sending a clear message to our customers across the U.S. and around the world: <b>Mercedes</b>-Benz will continue to be on the cutting-edge of ...",<b>Mercedes-Benz strengthens manufacturing footprint</b> in the U.S. with $1 billion investment,https://www.bizjournals.com/birmingham/prnewswire/press_releases/Alabama/2017/09/21/CL95283,The Business Journals,2017-09-21T17:48:00.0000000Z
62,"Altogether, <b>Mercedes</b>’ new investment in Alabama is expected to create more than 600 jobs and upgrade a plant that the company already describes as one of the world’s “smartest” <b>manufacturing</b> facilities. The automaker announced its expansion plans ...",<b>Mercedes</b> <b>to launch electric vehicle production in</b> $1B Alabama project,http://www.madeinalabama.com/2017/09/mercedes-to-launch-electric-vehicle-production-in-1b-alabama-project/,Alabama Department of Commerce,2017-09-21T17:19:00.0000000Z
63,"TUSCALOOSA, Ala., Sept. 21, 2017 /PRNewswire/ -- As part of its ongoing commitment to engineer and manufacture the world&#39;s most attractive vehicles, <b>Mercedes</b>-Benz will set up electric vehicle production in the United States. The company plans to produce ...",<b>Mercedes-Benz strengthens manufacturing footprint in</b> the U.S. with $1 billion investment,https://www.prnewswire.com/news-releases/mercedes-benz-strengthens-manufacturing-footprint-in-the-us-with-1-billion-investment-300523352.html,PR Newswire,2017-09-21T16:06:00.0000000Z
64,"<b>Mercedes</b>-Benz is spending $1 billion at its Tuscaloosa <b>manufacturing</b> plant, making SUVs for the company&#39;s EQ electric brand. The company is expected to hire another 600 people as part of a sweeping number of moves situated in west Alabama. The projects ...",<b>Mercedes-Benz investing</b> $1 billion in electric SUV expansion in Tuscaloosa,https://www.al.com/business/index.ssf/2017/09/mercedes-benz_investing_1_bill.html,al.com,2017-09-21T16:03:00.0000000Z
65,"- Investment expected to create more than 600 new jobs in the region In addition to the electric initiative, the logistics activities in the U.S. will be expanded with a new Global Logistics Center and a new after-sales North American hub, exporting car ...",<b>Mercedes-Benz strengthens manufacturing footprint in</b> the U.S. with $1 billion investment,https://www.autoblog.com/press-releases/mercedes-benz-strengthens-manufacturing-footprint-in-the-us-with-1-billion-investment_8530/,Autoblog,2017-09-21T00:00:00.0000000Z
66,"Kaggle are running a regression machine learning competition with <b>Mercedes</b>-Benz right now, it closes in a week and runs for about 6 weeks overall. I’ve managed to squeeze in 5 days to have a play (I managed about 10 days on the previous Quora ...",Kaggle’s <b>Mercedes</b>-Benz Greener <b>Manufacturing</b>,https://opendatascience.com/kaggles-mercedes-benz-greener-manufacturing/,Open Data Science,2017-08-15T15:54:00.0000000Z
67,"TORONTO - <b>Mercedes</b>-Benz Canada is pleased to announce that its Fuel Cell Division (MBFC) has made the 2017 List of Best Workplaces in <b>Manufacturing</b>. This accomplishment builds on the company&#39;s growing reputation as a leading Canadian employer, which was ...",<b>Mercedes</b>-Benz <b>Canada Fuel Cell Division recognized among 2017</b>’s Best Workplaces in <b>Manufacturing</b>,https://fuelcellsworks.com/news/mercedes-benz-canada-fuel-cell-division-recognized-among-2017s-best-workplaces-in-manufacturing,fuelcellsworks.com,2017-07-10T14:55:00.0000000Z
68,"Kaggle are running a regression machine learning competition with <b>Mercedes</b>-Benz right now, it closes in a week and runs for about 6 weeks overall. I’ve managed to squeeze in 5 days to have a play (I managed about 10 days on the previous Quora competition).",Kaggle’<b>s Mercedes-Benz Greener Manufacturing</b>,http://ianozsvald.com/2017/07/01/kaggles-mercedes-benz-greener-manufacturing/,ianozsvald.com,2017-07-01T00:00:00.0000000Z
69,<b>Mercedes</b>-Benz is not only talking about electric car concepts and show models anymore. The German automaker is increasingly securing <b>manufacturing</b> capacity at its existing plants in order to produce its upcoming EQ electric vehicles. The company announced ...,<b>Mercedes</b>-Benz secures <b>manufacturing</b> capacity to <b>produce compact electric vehicles</b>,https://electrek.co/2017/05/29/mercedes-produce-compact-electric-vehicles/,Electrek,2017-05-29T21:27:00.0000000Z
70,"Honda began production in Alabama in 2001. (Honda) But <b>Mercedes</b>’ decision to build its first U.S. <b>manufacturing</b> plant in Alabama was a signal seen around the world that the state was fertile ground for new business opportunities, said Greg Canfield ...",<b>Mercedes</b> holds key to Alabama auto industry boom,https://alabamanewscenter.com/2017/02/20/mercedes-holds-key-to-alabama-auto-industry-boom/,Alabama NewsCenter,2017-02-20T00:00:00.0000000Z
71,"Markus Schäfer, member of the Divisional Board of <b>Mercedes</b> Benz Cars, <b>Manufacturing</b> and Supply Chain Management says, this new plant is another milestone in the development of the brands production network. With the local productions like this the brand ...",<b>Mercedes</b> Benz Starts <b>Production at its Car Manufacturing</b> Plant in Brazil,https://gaadiwaadi.com/mercedes-benz-starts-production-at-its-car-manufacturing-plant-in-brazil-441247/,gaadiwaadi.com,2017-01-28T21:02:00.0000000Z
72,"They need to stop bombs and bullets. They need armor. For these <b>Mercedes</b>-Maybach owners, Canada&#39;s Inkas Armored Vehicle <b>Manufacturing</b> has come up with a Maybach that can offer some &quot;extra protection.&quot; &quot;It shows what happens when the best innovations in ...","This $500,000 armored <b>Mercedes</b>-Maybach limo is a force to be reckoned with",https://www.businessinsider.com/mercedes-maybach-armored-inkas-2016-8,Business Insider,2016-08-21T15:51:00.0000000Z
73,"TRAVERSE CITY, MI – Daimler’s <b>Mercedes</b>-Benz is putting more emphasis on how design and <b>manufacturing</b> engineers can collaborate early in vehicle development. The previous singular attitude was “the car is designed, and then we build it,” says Jason ...",<b>Mercedes Manufacturing</b> Gets More Say in Vehicle Development,https://www.wardsauto.com/car-management-briefing-seminars/mercedes-manufacturing-gets-more-say-vehicle-development,WardsAuto,2016-08-01T17:57:00.0000000Z
74,"Additionally, many of the older spare parts that the company would like to make available are simply impossible to make using modern <b>manufacturing</b> technology. Daimler, <b>Mercedes</b>-Benz’ parent company, currently uses commercial 3D printers to produce more ...",3D Printing Will Help <b>Mercedes</b>-Benz <b>Trucks Deliver Thousands of Replacement Parts</b> On Demand,https://3dprint.com/142207/mercedes-benz-trucks-parts/,3dprint,2016-07-14T00:00:00.0000000Z
75,"The <b>Mercedes</b>- Benz plant in East London is part of the C‑Class global production network whose lead plant is in Bremen. The network also encompasses the <b>Mercedes</b>- Benz plant in Tuscaloosa, USA, and the BBAC joint venture plant in Beijing, China.","East <b>London, Mercedes-Benz Manufacturing South Africa</b> Ltd",https://www.daimler.com/career/thats-us/locations/location-detail-page-5096.html,Daimler,2015-12-03T19:36:00.0000000Z
76,"Finnish company Valmet Automotive will start <b>manufacturing</b> <b>Mercedes</b>-Benz GLC SUVs in Uusikaupunki, Finland. Valmet Automotive has been <b>manufacturing</b> <b>Mercedes</b>-Benz A-class since 2013 and the planned production volume for the GLC is comparable to the A-Class ...",<b>Mercedes-Benz’s SUV manufacturing to Finland</b>,http://www.goodnewsfinland.com/mercedes-benz-s-suv-manufacturing-to-finland/,Good News from Finland,2015-11-27T00:00:00.0000000Z
77,"NEW DELHI: <b>Mercedes</b>-Benz India is looking at expanding local <b>manufacturing</b>, a plan that though depends on getting support such as tax concessions from Maharashtra, the state where its factory is located, new managing director and chief executive Roland ...",<b>Mercedes</b>-Benz to expand <b>manufacturing</b> in India; seeks government support on tax concessions,https://economictimes.indiatimes.com/industry/mercedes-benz-to-expand-manufacturing-in-india-seeks-government-support-on-tax-concessions/articleshow/49498514.cms,Economic Times,2015-10-22T22:37:00.0000000Z
78,"“Our entire team is proud to reinforce the State of Alabama’s growing reputation as a leader in high-quality automotive <b>manufacturing</b>.” <b>Mercedes</b> suppliers have also been expanding or establishing new operations <b>in Alabama</b>. In August, parts maker SMP ...",<b>Mercedes</b> to invest $1.3 billion <b>in Alabama</b> plant for next-gen SUVs,http://www.madeinalabama.com/2015/09/mercedes-to-invest-1-3-billion-in-alabama-plant/,Alabama Department of Commerce,2015-09-17T21:34:00.0000000Z
79,"The companies will invest $1 billion in COMPAS, which will oversee the construction and operation of a <b>manufacturing</b> plant to produce next-generation premium compact vehicles for the brands <b>Mercedes</b>-Benz and Infiniti. Located near the Nissan Aguascalientes ...","Nissan, Daimler to Collaborate in Mexico",https://www.industryweek.com/strategic-siting/nissan-daimler-collaborate-mexico,IndustryWeek,2015-07-28T17:59:00.0000000Z
80,<b>Manufacturing</b> joint venture called COMPAS (Cooperation <b>Manufacturing</b> Plant Aguascalientes) To build plant for the production of next-generation premium compact vehicles for the brands <b>Mercedes</b>-Benz and Infiniti COMPAS led by international management team ...,Daimler and <b>Renault-Nissan Alliance start manufacturing joint venture</b> in Mexico,http://nissannews.com/en-US/nissan/usa/releases/daimler-and-renault-nissan-alliance-start-manufacturing-joint-venture-in-mexico,nissannews.com,2015-07-28T10:24:00.0000000Z
81,This is a 3 million square foot assembly facility so it has large scale. Tours are only Tuesday and Thursday in the morning (9-ish) and around noon (12:30-ish). You should call ahead to reserve the time that you want. The website talks about two hours for ...,American <b>Manufacturing</b> - <b>Mercedes-Benz US International Visitor Center and Factory</b> Tour,https://www.tripadvisor.com/ShowUserReviews-g30889-d107362-r273331170-Mercedes_Benz_US_International_Visitor_Center_and_Factory_Tour-Tuscaloosa_Alabama.html,TripAdvisor,2015-05-20T00:00:00.0000000Z
82,"“Plant Tuscaloosa needs all available production capacities for this segment,” said Jason Hoff, president and CEO of <b>Mercedes’ manufacturing</b> in the U.S. <b>AM General</b> spokesperson Jeff Adams said his company, which is based in South Bend, Ind., will ...",<b>AM General to build Mercedes</b> R-Class in U.S. for China market,https://www.canadianmanufacturing.com/manufacturing/general-build-mercedes-r-class-u-s-china-market-144884/,Canadian Manufacturing,2015-01-28T13:37:00.0000000Z
83,"A source told <b>Automotive News</b> that <b>Mercedes</b> production will be around or slightly over ... AM General said its commercial assembly plant is a “full service <b>manufacturing</b> and support facility that utilizes state-of-the-art robotic welding, painting ...",<b>Mercedes</b> plans to move R-class production to AM General in Indiana,http://www.autonews.com/article/20150127/OEM01/150129822/mercedes-plans-to-move-r-class-production-to-am-general-in-indiana,Automotive News,2015-01-27T15:29:00.0000000Z
84,"Atlanta is closer to a <b>Mercedes</b> port in Brunswick, Ga. and a <b>manufacturing</b> facility in Alabama responsible for about half of the <b>Mercedes</b> vehicles sold in the U.S. According to John Boyd, a corporate site selection specialist with Princeton-based The Boyd ...",<b>Mercedes</b>-Benz USA announces move from Montvale to Atlanta,https://www.nj.com/bergen/index.ssf/2015/01/mercedes-benz_usa_announces_move_from_montvale_to_atlanta.html,NJ.com,2015-01-06T21:09:00.0000000Z
85,"Daimler ranks second on our list due to the fact it owns a stake in many other prominent <b>manufacturing</b> companies, including <b>Mercedes</b>-Benz, Tesla Motors and Renault-Nissan Alliance. Exor is an Italian investment company controlled by the Agnelli family ...",Top 10 <b>manufacturing</b> companies in Europe,https://www.manufacturingglobal.com/top-10/top-10-manufacturing-companies-europe,manufacturingglobal.com,2014-10-14T10:34:00.0000000Z
86,Daimler AG and Renault-Nissan are extending their <b>manufacturing</b> alliance to include engines and transmissions. The partnership will include an agreement for Renault to supply Daimler with a 1.6-liter four-cylinder diesel engine for use in its <b>Mercedes</b>-Benz ...,"<b>Daimler, Renault-Nissan extend manufacturing alliance</b>",http://www.autonews.com/article/20141003/COPY01/310039980/daimler-renault-nissan-extend-manufacturing-alliance,Automotive News,2014-10-03T12:16:00.0000000Z
87,"Founded by three former <b>Mercedes</b> engineers in 1967, AMG was created as a way for <b>Mercedes</b>-Benz to experiment with new technologies in the automotive racing world before passing those technologies down the line to consumer automobiles. Regardless if you ...","Behind the Scenes at the &quot;One Man, <b>One Engine&quot; Mercedes-AMG Manufacturing Plant</b>",https://www.solidsmack.com/fabrication/one-man-one-engine-mercedes-amg-engine-handcrafted-single-mechanic/,solidsmack.com,2014-09-29T11:17:00.0000000Z
88,"SINDELFINGEN, Germany -- Daimler&#39;s <b>Mercedes</b>-Benz unit is reorganizing its <b>manufacturing</b> operations along vehicle architectures to improve flexibility, lift productivity and reduce fixed costs in order to limit investments for each model line. Called ...",<b>Mercedes reorganizes manufacturing operations to reduce</b> costs,http://europe.autonews.com/article/20140910/ANE/140919998/mercedes-reorganizes-manufacturing-operations-to-reduce-costs,Automotive News Europe,2014-09-11T04:06:00.0000000Z
89,"The Russian economy has been struggling lately amid geopolitical issues with Ukraine. The U.S. and the European Union issued sanctions against Russia for supporting separatist rebels in Ukraine, an accusation denied by Russia. In the wake of a possible new ...",<b>Mercedes-Benz Considering Manufacturing In Russia</b> Amid Political Uncertainties,https://www.forbes.com/sites/greatspeculations/2014/09/04/mercedes-benz-considering-manufacturing-in-russia-amid-political-uncertainties/,Forbes,2014-09-04T21:10:00.0000000Z
90,The <b>Mercedes</b> G63 AMG has been transformed into the kind of ride that will redefine the way we look at interior luxury we don’t normally see in a car of its size and stature. But <b>INKAS Armored Vehicle Manufacturing</b> has made a habit of blowing us away with ...,2014 <b>Mercedes</b>-Benz G63 <b>by INKAS Armored Vehicle Manufacturing</b>,https://www.topspeed.com/cars/mercedes/2014-mercedes-benz-g63-by-inkas-armored-vehicle-manufacturing-ar164513.html,Top Speed,2014-07-22T09:00:00.0000000Z
91,"The Renault-Nissan alliance and Daimler, parent company of <b>Mercedes</b>-Benz, have revealed finalize details regarding their 50: 50 <b>manufacturing</b> joint venture in Mexico. Located in Aguascalientes, Mexico, the new plant is adjacent to an existing Nissan ...","Nissan, <b>Mercedes</b>-Benz Detail Joint Mexico <b>Manufacturing</b> Plant",http://www.autotribute.com/34750/nissan-mercedes-detail-joint-mexico-plant/,AutoTribute,2014-06-29T00:00:00.0000000Z
92,"The new S-class will begin production at <b>Mercedes</b>-Benz’s <b>manufacturing</b> headquarters in Sindelfingen, Germany with four different drivelines -- traditional gasoline, gasoline electric, diesel and diesel electric. All four will come with a seven-speed ...",<b>2014 Mercedes-Benz S-class arrives</b>,http://autoweek.com/article/car-news/2014-mercedes-benz-s-class-arrives,Autoweek,2013-05-16T08:54:00.0000000Z
93,"<b>Mercedes</b>-Benz has decided to move the production of US-specific models of its GLC sports utility vehicle (SUV) to its assembly lines at Chakan near Pune. With this, the company has now become the first luxury car maker in India to export to the US.","To America, with love: <b>Mercedes</b>-Benz lines up made-in-India GLC for export",https://www.moneycontrol.com/news/technology/auto/to-america-with-love-mercedes-benz-lines-up-made-in-india-glc-for-export-2984141.html,moneycontrol.com,2018-09-25T08:30:00.0000000Z
94,"President Donald Trump’s administration is laser-focused on trade with China, particularly by placing tariffs on hundreds of billions of dollars of Chinese-made goods. So while everyone’s looking there, cars are starting to be imported into the United ...",<b>Mercedes</b> Is Going To Import Cars From India While Everyone Is Looking At China,https://jalopnik.com/mercedes-is-going-to-import-cars-from-india-while-every-1829267530,Jalopnik,2018-09-24T17:38:00.0000000Z
95,"The <b>Mercedes</b>-Benz electric vehicle platform, or “multi-model vehicle architecture” is similar in many ways to the Tesla Motors layout. The battery pack is flat on the bottom floor pan, and the electric motors are at the front and rear of the car.",<b>Mercedes-Benz Develops First Plug</b>-in Hybrid Fuel Cell Car,http://compositesmanufacturingmagazine.com/2016/06/mercedes-benz-develops-first-plug-hybrid-fuel-cell-car/,Composites,2016-06-20T00:00:00.0000000Z
96,"India&#39;s largest luxury car manufacturer, <b>Mercedes</b>-Benz has rolled-out its 100,000th unit for the Indian market. The E-Class sedan rolled out of the assembly line as the 100,000th unit. Roland Folger, MD &amp; CEO, along with Piyush Arora, Executive Director ...",<b>Mercedes</b>-Benz India Reaches One Lakh <b>Manufacturing</b> Milestone; Rolls Out The E-Class Sedan,https://www.drivespark.com/four-wheelers/2018/mercedes-benz-1-lakh-cars-manufacturing-india-milestone-rolls-out-e-class-sedan-025787.html,DriveSpark,2018-05-28T13:00:00.0000000Z
97,"<b>Mercedes</b>-Benz has unveiled its vision for the future of motoring at CES 2015 with a pod-like concept car, which is designed to function as a mobile luxury living space. “Anyone who focuses solely on the technology has not yet grasped how autonomous ...",CES 2015: <b>Mercedes</b>-Benz just unveiled the coolest driverless concept car ever,https://www.manufacturingglobal.com/lean-manufacturing/ces-2015-mercedes-benz-just-unveiled-coolest-driverless-concept-car-ever,manufacturingglobal.com,2015-01-08T12:50:00.0000000Z
98,"The Pune facility currently produces 10,000 vehicles annually and they now are planning to double this figure and produce 20,000 vehicles every year. <b>Mercedes</b> have reported more inquiries and walk ins, post the Indian election for the Prime Ministerial post.",<b>Mercedes Benz India To Double Manufacturing Capacity</b>,https://www.drivespark.com/four-wheelers/2014/mercedes-benz-india-to-double-manufacturing-capacity-007546.html,DriveSpark,2014-06-06T15:59:00.0000000Z
0,"<b>Mercedes</b>-Benz has decided to move the production of US-specific models of its GLC sports utility vehicle (SUV) to its assembly lines at Chakan near Pune. With this, the company has now become the first luxury car maker in India to export to the US.","To America, with love: <b>Mercedes</b>-Benz lines up made-in-India GLC for export",https://www.moneycontrol.com/news/technology/auto/to-america-with-love-mercedes-benz-lines-up-made-in-india-glc-for-export-2984141.html,moneycontrol.com,2018-09-25T08:30:00.0000000Z
1,"President Donald Trump’s administration is laser-focused on trade with China, particularly by placing tariffs on hundreds of billions of dollars of Chinese-made goods. So while everyone’s looking there, cars are starting to be imported into the United ...",<b>Mercedes</b> Is Going To Import Cars From India While Everyone Is Looking At China,https://jalopnik.com/mercedes-is-going-to-import-cars-from-india-while-every-1829267530,Jalopnik,2018-09-24T17:38:00.0000000Z
2,"The <b>Mercedes</b>-Benz electric vehicle platform, or “multi-model vehicle architecture” is similar in many ways to the Tesla Motors layout. The battery pack is flat on the bottom floor pan, and the electric motors are at the front and rear of the car.",<b>Mercedes-Benz Develops First Plug</b>-in Hybrid Fuel Cell Car,http://compositesmanufacturingmagazine.com/2016/06/mercedes-benz-develops-first-plug-hybrid-fuel-cell-car/,Composites,2016-06-20T00:00:00.0000000Z
3,"India&#39;s largest luxury car manufacturer, <b>Mercedes</b>-Benz has rolled-out its 100,000th unit for the Indian market. The E-Class sedan rolled out of the assembly line as the 100,000th unit. Roland Folger, MD &amp; CEO, along with Piyush Arora, Executive Director ...",<b>Mercedes</b>-Benz India Reaches One Lakh <b>Manufacturing</b> Milestone; Rolls Out The E-Class Sedan,https://www.drivespark.com/four-wheelers/2018/mercedes-benz-1-lakh-cars-manufacturing-india-milestone-rolls-out-e-class-sedan-025787.html,DriveSpark,2018-05-28T13:00:00.0000000Z
4,"<b>Mercedes</b>-Benz has unveiled its vision for the future of motoring at CES 2015 with a pod-like concept car, which is designed to function as a mobile luxury living space. “Anyone who focuses solely on the technology has not yet grasped how autonomous ...",CES 2015: <b>Mercedes</b>-Benz just unveiled the coolest driverless concept car ever,https://www.manufacturingglobal.com/lean-manufacturing/ces-2015-mercedes-benz-just-unveiled-coolest-driverless-concept-car-ever,manufacturingglobal.com,2015-01-08T12:50:00.0000000Z
